date,num_comments,score,subreddit,title,pos,neu,compound
2018-01-01 21:41:01,0,1,ethereum,Trade Recommendation: Ethereum Classic,0.0,1.0,0.0
2018-01-02 06:12:06,5,1,CryptoMarkets,"New Ethereum dApp FishBanks alpha releasing today. Slightly similar to cryptokitties and ethertanks, this is a great way to grow your ETH holdings if you're early.",0.146,0.854,0.6249
2018-01-02 06:32:38,0,1,EthereumClassic,What is Ethereum Classic ?,0.0,1.0,0.0
2018-01-02 06:39:57,0,1,BitcoinAll,Bitcoin mentioned around Reddit: Luno - Ethereum is Hard Forking on 19th Jan. Anybody know if Luno is supporting this fork? /r/southafrica,0.124,0.815,0.3612
2018-01-02 04:28:04,0,1,noncensored_bitcoin,[uncensored-r/CryptoCurrency] Ethereum new all-time high and on its way to $1000. Your opinion?,0.0,1.0,0.0
2018-01-02 05:27:05,0,1,u_Doc_Coin,We are glad to inform you that on friends ICOLERT put information about yourself DocCoin website. You can see from the following link: https://m.icolert.com/#!section=17897303&amp;cat=0&amp;item=0gdge8f99t2ecgem1d129tm2al #ico #tokensale #doccoin #bitcoin #ethereum #telehealth #blockchain,0.181,0.819,0.75
2018-01-02 03:28:20,0,1,cryptovideos,"thinkinghuman TV: 1/1/18 CRYPTO RECAP: BITCOIN, ETHEREUM, LITECOIN + ALTS TECHNICAL ANALYSIS",0.0,1.0,0.0
2018-01-02 04:23:23,0,1,Cryptoalert,Dapp Browsers Will Radically Accelerate Mainstream Ethereum Adoption,0.0,1.0,0.0
2018-01-02 02:58:01,0,1,CryptoCurrency,WTF is causing Ethereum to Go So High?,0.0,0.607,-0.6739
2018-01-02 06:56:28,0,1,bitcoin_cash,Ethereum Mining GPU,0.0,1.0,0.0
2018-01-02 07:37:16,0,1,smartmediatokens,We Will Be Testing Out The Ethereum Block Chain With STEEMISH,0.0,0.775,-0.4404
2018-01-02 07:29:05,0,1,noncensored_bitcoin,[uncensored-r/CryptoCurrency] New Ethereum dApp FishBanks alpha releasing today. Slightly similar to cryptokitties and ethertan...,0.0,1.0,0.0
2018-01-01 08:46:30,0,1,CryptoCurrency,Why is bitcoin so popular when ethereum is almost the same but with a ton more features?,0.133,0.867,0.32
2018-01-01 06:13:43,1,1,giftcardexchange,[H] US PlayStation store $25 card [W] 80% Litecoin or Ethereum,0.0,1.0,0.0
2018-01-01 06:21:44,1,1,BitcoinAll,Serious question for this sub: Why not Ethereum? /r/btc,0.0,0.86,-0.0772
2018-01-01 06:41:10,0,1,ethtrader,Happy New Year Ethereum. Let humanity be set free with decentralised solutions,0.492,0.508,0.8271
2018-01-01 06:57:22,0,1,CryptoCurrency,Bitcoin Alternatives - Ethereum Vs Litecoin Vs Verge Vs Ripple Vs Zcash,0.0,1.0,0.0
2018-01-01 18:01:52,8,1,CryptoCurrency,Ethereum Vs Litecoin Vs Verge Vs Ripple Vs Zcash,0.0,1.0,0.0
2018-01-02 00:45:44,0,1,cryptonewswire,Ripple Soars To Surpass Ethereum,0.0,1.0,0.0
2018-01-02 01:12:58,0,1,removalbot,01-02 01:12 - 'Ethereum is catching btc...' (self.Bitcoin) by /u/fauzool removed from /r/Bitcoin within 0-8min,0.0,1.0,0.0
2018-01-02 02:06:59,0,1,CryptoCurrency,"Ethereum New Highs!!! | To the Moon!!! Jan 1st, 2018",0.0,1.0,0.0
2018-01-02 00:01:14,0,1,CryptoCurrency,Ethereum Question,0.0,1.0,0.0
2018-01-02 02:12:33,0,1,Crypto_Arbitrage,Ethereum - ETH/BTC Arbo Ops - 01/01/18 9:12 PM EST,0.0,1.0,0.0
2018-01-02 02:13:02,1,1,CryptoCurrency,Ethereum new all-time high and on its way to $1000. Your opinion?,0.0,1.0,0.0
2018-01-02 02:33:05,0,1,ethtrader,Let's takeover bitcoin! Ethereum needs no-1 place now.,0.0,1.0,0.0
2018-01-01 05:26:24,0,1,EthereumClassic,"Developer ? Start With The Official Ethereum Classic Wallet ""Emerald""",0.0,1.0,0.0
2018-01-01 10:54:29,0,1,noncensored_bitcoin,[uncensored-r/CryptoCurrency] Why is bitcoin so popular when ethereum is almost the same but with a ton more features?,0.126,0.874,0.32
2018-01-01 09:41:56,0,1,btc,"2018 Bitcoin, Ethereum Overview",0.0,1.0,0.0
2018-01-01 07:48:07,0,1,Bitcoin,I Love Ethereum,0.808,0.192,0.6369
2018-01-01 22:25:03,0,1,ethtrader,I'm looking for a Ethereum Pro who can help me with a contract problem (LOST MY ETHER) - IMPORTANT - PLEASE,0.345,0.542,0.6774
2018-01-01 22:57:19,0,1,EthereumClassic,Trust Opensource Wallet For Ethereum Classic &amp; Token Support| Android / IOS - Download now !,0.23,0.77,0.5562
2018-01-01 23:38:02,1,1,giveaways,"Win $4000 in Bitcoin, $2000 in Ethereum, or $1000 in Litecoin! (01/18/2018) {??}",0.271,0.729,0.6654
2018-01-01 23:38:05,1,1,giveaways,"Win $4K in Bitcoin, $2K in Ethereum, and $1K in Litecoin {US} (1/19/2018)",0.241,0.759,0.5859
2018-01-02 09:17:34,0,1,ethereum,Ripple Goes Past Ethereum by Market Cap,0.0,1.0,0.0
2018-01-02 09:24:06,0,1,BitcoinAll,Dear friends! We are pleased to announce that the first fully decentralized lottery platform Fire Lotto is being launched with the authentic Ethereum prize pool. https://firelotto.io/?&amp;lang=en /r/Bitcoin,0.369,0.566,0.8832
2018-01-02 09:47:13,0,1,Cryptos_and_business,"Ethereum briefly exceeds the ripple, surges rising to $ 914",0.0,1.0,0.0
2018-01-02 07:58:22,0,1,NEWSBTC,Race for second place as Ethereum reaches new high,0.13,0.87,0.0516
2018-01-02 10:17:54,1,1,ethereum,The Cost of Running an Ethereum Node?,0.0,1.0,0.0
2018-01-03 20:53:51,2,1,xyMarket,[H] US PlayStation Store $25 [W] 67% Ethereum or Litecoin,0.0,1.0,0.0
2018-01-07 02:56:40,4,1,Cash4Cash,"[W] Ethereum, XRP, XMR [H] PayPal, Venmo, BTC, BCH",0.0,1.0,0.0
2018-01-07 22:42:46,1,1,adnesys,Where and how you can quickly buy Bitcoin and Ethereum through a credit or debit card or through PayPall,0.133,0.867,0.3818
2018-01-05 22:00:14,38,1,CryptoCurrency,"Just put a grand in Bitcoin, Ethereum, and Ripple",0.3,0.7,0.4588
2018-01-08 00:51:25,53,1,DankNation,"POWERFLOWER: NEW MENU- DJ Short Blueberry, Bubblegum X Green Crack. We take Monero Ethereum, Litecoin Bitcoin Cash- 2oz for $290 1oz for $175 $550 mix and match qp",0.0,1.0,0.0
2018-01-04 02:13:44,0,1,u_LetgoCrypto,"Only 23 years old, taking the world by storm, Vitalik Buterin Co-founder of Ethereum which implements smart contacts will be very useful and may soon see adoption by banks, casinos, hedge funds etc. Ethereum is absolutely a very good investment for the portfolio.",0.194,0.806,0.8543
2018-01-04 05:25:31,0,1,Embily,https://www.reddit.com/r/ethereum/comments/7nvigr/warning_scam_ico_othororg_list_vitalik_as_a_team/,0.0,1.0,0.0
2018-01-04 05:00:40,0,1,CryptoCurrency,Invest Bitcoin/Ethereum on REAL business for company SHARES and fiat dividend,0.227,0.773,0.4466
2018-01-04 05:08:57,0,1,ethereum,Ethereum Foundation Announces Millions in Grants for Scaling Research - Is it true?,0.32,0.68,0.5719
2018-01-04 05:13:16,0,1,ethereum,Ethereum noobie here.. is this transaction going to go through?,0.0,1.0,0.0
2018-01-04 05:43:29,0,1,cryptovideos,"thinkinghuman TV: 1/3/18 CRYPTO RECAP: BITCOIN, ETHEREUM, LITECOIN + ALTS TECHNICAL ANALYSIS",0.0,1.0,0.0
2018-01-04 15:40:27,0,1,BTCNews,"$1,000: Ethereum Tops Price Milestone in Market First",0.32,0.68,0.5106
2018-01-04 15:52:02,1,1,ethereum,"Ethereum as a Company, Not a Currency",0.0,1.0,0.0
2018-01-04 16:05:43,0,1,ethtrader,3 Important Ethereum Questions,0.474,0.526,0.2023
2018-01-04 11:38:21,1,1,cardano,"You should be taking Cardano (ADA) seriously, as it is the new Ethereum-Killer",0.0,0.876,-0.1779
2018-01-04 10:14:29,0,1,ethtrader,[BLOCKCHAIN] Chain Partners launches Ethereum-based payment service. http://www.theinvestor.co.kr/view.php?ud=20180104000723,0.0,1.0,0.0
2018-01-04 14:03:15,0,1,independentreserve,ETHEREUM sent with KRAKEN smart contract,0.351,0.649,0.4019
2018-01-04 17:09:51,0,1,ethereum,Who are the top competitors for Ethereum right now?,0.184,0.816,0.2023
2018-01-04 23:24:05,1,1,BitcoinAll,"Ethereum Over $1000 and $100B Market Cap, BTC Dominance at 32% Record Low",0.121,0.738,-0.0772
2018-01-04 23:35:36,2,1,BitMarket,[WTB] $1000 of litecoin or ethereum. Payment via paypal. Must have refs!,0.0,1.0,0.0
2018-01-04 23:12:22,0,1,litecoin,"Bitcoin, Ethereum, Bitcoin Cash, Ripple, IOTA, Litecoin, NEM, Cardano: Price Analysis, 04 Jan. 2018",0.0,1.0,0.0
2018-01-04 21:38:35,2,1,eos,First Electric Vehicle Charging Platform Built on Ethereum Blockchain,0.0,1.0,0.0
2018-01-05 00:08:18,0,1,newsbotbot,"@TechCrunch: Ethereum hits $1,000 a coin, Eero lays off 20% of staff and Mark Zuckerberg issues his 2018 challenge. All this on #crunchreport with @titoyooo https://t.co/1kDQqIogyR",0.051,0.949,0.0772
2018-01-05 04:47:18,0,1,CryptoCurrency,"High volume Ethereum Classic Ethereum Classic (ETC), Korean Exchange ETC / BCH pairing.",0.0,1.0,0.0
2018-01-05 05:06:05,0,1,ethereum,Ethereum scaling vs RaiBlocks and Steem?,0.0,1.0,0.0
2018-01-05 07:35:14,0,1,Bitcoin,Malaysian car showroom accepting both Bitcoin and Ethereum as a form of payment for car,0.167,0.833,0.3818
2018-01-05 07:10:07,0,1,cardano,Bitcoin vs Ethereum vs Cardano,0.0,1.0,0.0
2018-01-05 07:28:46,1,1,slotmachines,Try this one using your ethereum on Slots!,0.0,1.0,0.0
2018-01-05 11:06:25,0,1,SAtechnews,Bitcoin vs Ethereum – What to expect in 2018,0.0,1.0,0.0
2018-01-05 11:23:06,0,1,CryptoCurrency,Estonian enterprises will use the Ethereum blockchain-based TIME token,0.0,1.0,0.0
2018-01-05 10:41:16,0,1,CryptoCurrency,"First we pitch'em Bitcoin, Litecoin, Ethereum. Coins these people know. Then...",0.0,1.0,0.0
2018-01-05 11:27:00,0,1,Crypto_Currency_News,"Ethereum Surge Past $1000 Mark for First Time, All Set to Hit Many more Milestones",0.0,1.0,0.0
2018-01-05 01:12:39,5,1,CryptoCurrency,Ledger Nano S Ethereum glitch?!,0.0,1.0,0.0
2018-01-05 03:59:01,0,1,binance,BitStamp To Binance. Ethereum Question.,0.0,1.0,0.0
2018-01-05 04:25:15,0,1,ethereum,"Ethereum Hits $1,000 a Coin",0.0,1.0,0.0
2018-01-05 02:48:48,0,1,Cryptoalert,"Technical Analysis: Ethereum Price Flirts with $1000, as Bitcoin Stuck near $15,000",0.124,0.73,-0.0772
2018-01-04 23:33:14,0,1,ethereum,Ethereum transaction not going through,0.0,1.0,0.0
2018-01-04 23:58:48,0,1,noncensored_bitcoin,[uncensored-r/Bitcoin] Ethereum fork cancelled.,0.0,0.6,-0.25
2018-01-05 01:30:30,0,1,bitnewsbot,Estonian Enterprises Will Use the Ethereum Blockchain-Based TIME Token,0.0,1.0,0.0
2018-01-05 09:39:08,1,1,ethereum,I told 10 people to buy Ethereum a year ago,0.0,1.0,0.0
2018-01-05 06:30:52,2,1,noncensored_bitcoin,[uncensored-r/CryptoCurrency] Was investigating FUN’s recent price increase and ran across their preview games on the Ethereum ...,0.126,0.874,0.3182
2018-01-05 05:32:54,0,1,ethtrader,Australians Can Buy Ethereum With Fiat On Coinspot!,0.0,1.0,0.0
2018-01-05 06:28:20,0,1,ethereum,"ETHEREUM HITS $1,000 FOR THE FIRST TIME",0.0,1.0,0.0
2018-01-05 18:33:47,0,1,u_Cryptocurrency_King,Need Ethereum donations.,0.0,1.0,0.0
2018-01-05 12:06:33,0,1,Changelly,Why can't I buy Ethereum anymore?,0.0,1.0,0.0
2018-01-05 11:53:56,1,1,crypto,"Ethereum breaks record by reaching $1,000",0.265,0.735,0.2023
2018-01-05 16:40:59,0,1,thenewsrightnow,"Ethereum hits record high; bitcoin briefly recovers $16,000",0.0,1.0,0.0
2018-01-05 16:43:13,0,1,CoinBase,Transferred $12 of ethereum to bank account in one day.,0.0,1.0,0.0
2018-01-05 17:07:35,0,1,BTCNews,"Ethereum clears $1,000 for the first time",0.178,0.822,0.0772
2018-01-05 18:04:14,0,1,cryptovideos,"thinkinghuman TV: 1/5/18 CRYPTO MORNING CALL: BITCOIN, ETHEREUM, LITECOIN + ALTS TECHNICAL ANALYSIS",0.0,1.0,0.0
2018-01-05 14:54:53,0,1,cryptogiveaways,"Sola: Sign up and receive 5 SOL tokens and 100 AP Free. A social network where you get paid. Sola is the next-gen decentralized social platform governed by users, Empowered by own nodes, IPFS and Ethereum blockchain.",0.088,0.912,0.5106
2018-01-05 15:06:42,0,1,ethtrader,STOP BUYING ETHEREUM IMMEDIATELY!,0.0,0.546,-0.3595
2018-01-08 21:05:26,0,1,noncensored_bitcoin,[uncensored-r/Bitcoin] New cryptogame on Ethereum. Check the article,0.0,1.0,0.0
2018-01-09 01:31:24,0,1,ethereum,Can the Bitcoin Ruby pre-sale grow as fast as Ethereum is growing now? They just finished an awesome Whitepaper Link,0.244,0.756,0.7003
2018-01-09 01:13:04,0,1,ethtrader,Daily Ethereum Update (1/8/18) + Technical Analysis,0.0,1.0,0.0
2018-01-08 22:02:08,0,1,GemsProtocol,Gems - A Decentralized Mechanical Turk Powered by Ethereum,0.0,1.0,0.0
2018-01-08 20:56:12,0,1,Cryptos_and_business,Brazil turns to Ethereum to solve its popular petition problem,0.322,0.49,0.2263
2018-01-08 21:02:52,1,1,noncensored_bitcoin,[uncensored-r/CryptoCurrency] ICON is not the Ethereum of Korea. It's way more.,0.0,1.0,0.0
2018-01-08 21:40:24,0,1,CryptoCurrencies,Ethereum Swings Like A Pendulum Do on Block Tribune Volatility Index,0.187,0.597,-0.1027
2018-01-09 12:02:15,2,1,singapore,Good websites to trade ethereum?,0.42,0.58,0.4404
2018-01-09 11:55:39,0,1,ethereum,"Theoretically, how much tx/s is required for ethereum to work with all the dapps?",0.0,1.0,0.0
2018-01-09 11:39:07,0,1,Crypto_General,Ethereum co-creator say Crypto Currency's value could triple in 2018 - Bitcoin Forum,0.179,0.821,0.34
2018-01-09 11:44:12,1,1,slavelabour,TASK I need a .edu email address payment 5USD in Ethereum,0.0,1.0,0.0
2018-01-09 12:55:38,0,1,ethereum,"If 0.00000001 Bitcoin is called a satoshi, will we be calling 0.00000001 Ethereum as 1 vitalik?",0.0,1.0,0.0
2018-01-09 14:39:16,0,1,Cryptos_and_business,The Ethereum price continues to grow while other pieces are sold See Correction induced by CMC,0.0,1.0,0.0
2018-01-09 14:54:28,0,1,CryptoCurrencyTrading,The Ethereum Award Shows a New Wave of Technological Problems,0.265,0.53,0.2023
2018-01-09 14:52:13,0,1,bitnewsbot,From Bitcoin to Ethereum: Here are the biggest cryptocurrencies in the world,0.0,1.0,0.0
2018-01-09 14:58:25,2,1,CryptoCurrency,I created a non-profit academic Ethereum project (read: experiment) that seeks to commodify everyday products into appreciating assets. I need some help reaching the sample size for my preliminary survey and would like your help in exchange for a chance to win 0.13 Eth.,0.416,0.584,0.959
2018-01-09 15:02:47,0,1,ethereum,Brand NEW GOLD Ethereum Coin ! ! !,0.0,1.0,0.0
2018-01-09 13:35:51,0,1,ethereum,Mist ethereum wallet,0.0,1.0,0.0
2018-01-09 13:49:03,2,1,hardwareswap,"[USA-MI][H] Astro A50 Xbox [W] $200, PayPal, Ethereum",0.0,1.0,0.0
2018-01-09 14:03:27,1,1,BitcoinAll,"""Other"" Altcoin's are set to exceed Bitcoin's Market Dominance, not Ripple, Ethereum or Bitcoin Cash /r/btc",0.107,0.893,0.2023
2018-01-09 13:06:18,0,1,TheColorIsRed,"Vitalik Buterin, Creator Of Ethereum, On The Big Guy Vs. The Little Guy",0.0,1.0,0.0
2018-01-09 15:12:17,0,1,CryptoCurrency,Ethereum All-Time Highs Overshadow Wave of Technical Issues,0.0,1.0,0.0
2018-01-10 01:08:50,0,1,noncensored_bitcoin,[uncensored-r/CryptoCurrency] What is the fraction name for ethereum?,0.0,1.0,0.0
2018-01-10 00:37:16,0,1,CryptoCurrency,Sell Ethereum for fiat then buy Bitcoin or trade Ethereum for Bitcoin?,0.0,1.0,0.0
2018-01-10 04:52:20,0,1,CryptoCurrency,Ethereum Price Prediction - ETH Price all time high,0.0,1.0,0.0
2018-01-10 04:50:17,0,1,CryptoCurrency,Ethereum,0.0,1.0,0.0
2018-01-10 05:00:38,0,1,UpliftingNews,Popular Petition Problem: Brazil Looks to Ethereum to Solve - Ethereum Blog,0.301,0.523,0.2263
2018-01-10 04:46:37,0,1,CryptoCurrency,How do i buy other alt coins when I already have usd money and ethereum in coinbase. I have some ethereum I want to buy other alt coins with it lesser known under dog type coins.,0.04,0.96,0.0772
2018-01-10 05:47:01,0,1,CryptoCurrency,Ethereum Lyte (ELYTE) - Limited Supply Coin,0.0,0.725,-0.2263
2018-01-10 04:25:15,0,1,eth,What's the Best Ethereum Wallet? How Satoshi Changed Our Reality &amp; How You Can Too Today in 360°,0.198,0.802,0.6369
2018-01-10 04:33:17,0,1,deepweb,Bitcoin/Ethereum,0.0,1.0,0.0
2018-01-10 04:22:11,0,1,bitnewsbot,In 2018 Ethereum Value Could Triple Leaving Bitcoin Behind,0.231,0.769,0.34
2018-01-10 04:35:15,0,1,CryptoCurrency,Ethereum dip,0.0,1.0,0.0
2018-01-10 07:23:10,0,1,ethereum,Ethereum Foundation’s Nick Johnson On recent GWei Transaction Fees,0.0,1.0,0.0
2018-01-10 07:11:00,2,1,gpumining,"Is there a way to only mine an altcoin with claymore, and not mine ethereum?",0.0,1.0,0.0
2018-01-10 06:56:47,7,1,ethtrader,"As Tax Awareness Increases, Beware a Bubble in Ethereum as Alts Are Traded in to Cash Out",0.0,1.0,0.0
2018-01-09 23:38:15,0,1,giveaways,Win $4000 in Bitcoin + $2000 in Ethereum + $1000 in Litecoin! 3 Winners! (01/18/2018) {??},0.416,0.584,0.8336
2018-01-09 23:38:10,1,1,giveaways,"Win $4000 in Bitcoin, $2000 in Ethereum, or $1000 in Litecoin! (01/18/2018) {??}",0.271,0.729,0.6654
2018-01-09 23:11:38,0,1,Bitcoin,"Bitcoin, Litecoin and Ethereum price analysis 10/01/2017",0.0,1.0,0.0
2018-01-09 23:48:09,1,1,ethereumnoobies,Trouble downloading Ethereum Wallet,0.0,0.526,-0.4019
2018-01-09 23:49:07,0,1,Ripple,Ethereum once went 330$-120$ and now its 1300$,0.0,1.0,0.0
2018-01-09 23:52:59,0,1,krownio,What Makes Ethereum Likely to Increase in Value?,0.439,0.561,0.5719
2018-01-10 01:21:38,0,1,ethtrader,"Great News, Ethereum is on a bull run!",0.423,0.577,0.6588
2018-01-10 03:03:07,0,1,ethtrader,One Ethereum price is higher than one ounce of Gold celebration thread!,0.0,1.0,0.0
2018-01-10 09:27:21,0,1,sidj2025blog,Hacker News: Learn to Code Ethereum DApps by Building Your Own Game,0.0,1.0,0.0
2018-01-10 09:33:32,0,1,ethereum,Ethereum history book 2013-2017,0.0,1.0,0.0
2018-01-10 11:04:52,0,1,EthereumClassic,Brazil to Embrace Ethereum Blockchain to Solve Their Electoral Problems,0.297,0.507,0.1027
2018-01-10 10:27:36,0,1,ethereum,How Futereum (FUTR) Buyers Are Getting Best of Ethereum (ETH) Price Rise To $1250,0.244,0.756,0.6369
2018-01-10 05:19:34,0,1,Bitcoin,Ethereum's co-creator predicts Ethereum could dethrone Bitcoin in 2018. Ether is having a killer month. Thoughts?,0.0,0.765,-0.6486
2018-01-10 06:13:36,0,1,removalbot,01-10 06:13 - 'Yes. You can trade your bitcoin for Ethereum and then send the Ethereum to binance. It would be cheaper that way. Bitcoin network is broken and congested as fuck that's why the fees are so damn high.' by /u/iFraud21 removed from /r/Bitcoin within 9-19min,0.0,0.81,-0.8776
2018-01-10 04:42:07,0,1,ethereum,Russian Bishop Castigates Cryptocurrencies: A Financial Bubble and a Ponzi’ - Ethereum Blog,0.0,1.0,0.0
2018-01-10 04:45:29,0,1,CryptoCurrency,Why I Invested in Ethereum,0.0,1.0,0.0
2018-01-10 05:10:53,6,1,ethtrader,Can an ERC20 token ever be worth more than Ethereum?,0.174,0.826,0.2263
2018-01-10 06:17:08,0,1,cryptonewswire,"Ethereum co-founder predicts crypto crash, then consolidation",0.0,0.69,-0.4019
2018-01-10 11:32:23,0,1,bitnewsbot,"Ethereum Price Peaks Above $1,300 as Market cap Inches Closer to Bitcoin’s",0.0,1.0,0.0
2018-01-10 11:50:35,0,1,altcoininvesting,How To Buy And Sell ELTCOIN And Other Ethereum Tokens On An Exchange,0.0,1.0,0.0
2018-01-10 11:27:32,0,1,CryptoMarkets,Although KIN no longer utilizing ethereum all the potential for major success still applies,0.207,0.67,0.3612
2018-01-10 09:34:20,0,1,AutoNewspaper,"[Top Stories] - Ethereum hits a fresh record high and is up nearly 17,000% in a year | NBC",0.141,0.859,0.3182
2018-01-10 09:42:12,0,1,ethtrader,Ethereum hits a new record high -- while bitcoin and Ripple's XRP slide,0.0,1.0,0.0
2018-01-10 12:12:22,0,1,ethtrader,Brazil Are Looking To Ethereum To Improve Their Voting System!,0.262,0.738,0.4926
2018-01-10 12:17:31,0,1,CryptoMarkets,How To Buy And Sell ELTCOIN And Other Ethereum Tokens On An Exchange.,0.0,1.0,0.0
2018-01-10 12:21:24,1,1,Tronix,Qtum Partners With Baofeng To Become Bigger Than Bitcoin And Ethereum (I though they Partner is TRON?),0.0,1.0,0.0
2018-01-09 16:46:13,1,1,mining,awesome 🏆SUNSET ETHEREUM T-SHIRT 🏆,0.577,0.423,0.6249
2018-01-09 18:55:56,0,1,LINKTrader,Since LINK is built on ethereum will it be hindered by ethereum’s scalability problem?,0.0,0.828,-0.4019
2018-01-09 15:58:51,5,1,lamden,Has Lamden its own chain or is it depending on Ethereum erc20???,0.0,1.0,0.0
2018-01-09 18:59:12,0,1,Bitcoin,"CoinYard-The best forum about cryptocurrency! Bitcoin, Ethereum, Bitcoin Cash, Ripple, Litecoin...",0.31,0.69,0.6696
2018-01-09 17:23:44,0,1,bitnewsbot,Ethereum Foundation’s Nick Johnson On GWei Transaction Fees,0.0,1.0,0.0
2018-01-09 17:24:15,0,1,Cryptos_and_business,Ethereum Advisor Predicts Greater Adoption,0.385,0.615,0.3612
2018-01-08 22:46:28,0,1,ethereum,Launch slowly approaching for one of the most anticipated Ethereum DAPPS (Augur)!,0.0,1.0,0.0
2018-01-08 17:49:48,0,1,ethtrader,"Ethereum Game Like Crypto-Kitties, Etherchan?",0.385,0.615,0.3612
2018-01-08 19:57:33,1,1,ethereum,Ethereum vs ICOs,0.0,1.0,0.0
2018-01-08 21:42:55,0,1,Bitcoin,"Earn Daily 1 Bitcoin , 1000 Dogecoin , Ethereum Etc FREE | 100% Working",0.309,0.691,0.6166
2018-01-08 23:59:18,0,1,ethereum,Ethereum has saved my life,0.412,0.588,0.4215
2018-01-09 00:02:27,0,1,CryptoCurrency,Will Ethereum Classic Follow the Success of Bitcoin Cash?,0.316,0.684,0.5719
2018-01-09 07:46:45,0,1,ethtrader,PSA: Steven Nerayoff is NOT a Co-Creator of Ethereum. We need to be careful of people like this.,0.215,0.785,0.4767
2018-01-09 06:57:38,0,1,ethereum,Ethereum withdrawal issues? Post yours here.,0.18,0.82,0.0258
2018-01-09 07:13:19,0,1,noncensored_bitcoin,[uncensored-r/Bitcoin] Is bitcoin MySpace and ethereum Facebook?,0.0,1.0,0.0
2018-01-09 06:46:52,0,1,CryptoCurrency,"Bitcoin, Ripple, Ethereum: Cryptocurrency market crashes 20 per cent",0.0,1.0,0.0
2018-01-09 07:30:16,0,1,u_XBrick-exchange,SEER added to XBrick exchange. 9 Cryptos now traded under ETH (Ethereum) asset class http://ht.ly/2PNG30hATp7,0.161,0.839,0.3612
2018-01-09 10:35:15,0,1,u_CrypSign,Here is the reason why ‘Ethereum’ sometimes called as Ethereum Virtual Machine: https://goo.gl/5JDpLD,0.0,1.0,0.0
2018-01-09 10:44:44,0,1,ethereum,Why are all my coins red while Ethereum stays in the green?,0.0,1.0,0.0
2018-01-09 09:50:24,0,1,BTCNews,Ethereum price jumps again as it approaches a new all-time high,0.0,1.0,0.0
2018-01-09 10:40:28,0,1,ethtrader,Ethereum predicted to be top 12 gainer in 2018,0.184,0.816,0.2023
2018-01-09 10:40:24,0,1,CryptoCurrencies,Somebody Finally Explained The Difference Between Bitcoin And Ethereum [Video],0.0,1.0,0.0
2018-01-09 04:10:59,0,1,ethereum,How do I start a business using ethereum block chain technology?,0.0,0.734,-0.4404
2018-01-09 03:59:15,0,1,vergecurrency,imagine how big Verge could be if Binance and Bittrex weren't blocking new users AND Kucoin and hitHBC weren't having problems with Ethereum deposits. So I'll just sit here and watch you all win.,0.21,0.79,0.8043
2018-01-08 22:20:29,1,1,ImagesOfThe2010s,[Kryptowar] It's 2018 and I can invade the Bahamas as Russia on the Ethereum Blockchain,0.0,1.0,0.0
2018-01-08 18:16:57,6,1,CryptoCurrency,"Please stop calling coins ""ethereum of X""",0.242,0.526,0.0258
2018-01-08 18:46:46,0,1,CryptoCurrencies,What are the main issues that need to be solved within the Ethereum platform?,0.139,0.861,0.2732
2018-01-08 18:49:20,0,1,cryptovideos,"thinkinghuman TV: 1/8/18 CRYPTO MORNING CALL: BITCOIN, ETHEREUM, LITECOIN + ALTS TECHNICAL ANALYSIS",0.0,1.0,0.0
2018-01-08 19:04:00,0,1,cryptosignals,Ethereum (ETH) Technical Analysis 8 January 2018,0.0,1.0,0.0
2018-01-09 03:08:51,0,1,CryptoCurrency,I’ve been hearing alot of bad stuff about Coinbase. I have Bitcoin and Ethereum through them. Anyone know of any better places to hold my crypto and from now on where I should buy them?,0.078,0.829,-0.1531
2018-01-08 22:08:09,2,1,hitbtc,LOST ETHEREUM,0.0,0.303,-0.3182
2018-01-15 19:24:35,0,1,ethereum,Opinions on NEO vs Ethereum I’m a holder of both. Just want to hear some opinions from the Ether side.,0.067,0.933,0.0772
2018-01-15 19:19:07,0,1,CryptoCurrency,CEO of Mobius Network talks about the Mobius team and why he thinks Stellar will win over Ethereum,0.183,0.817,0.5859
2018-01-15 18:31:01,1,1,noncensored_bitcoin,[uncensored-r/CryptoCurrency] Which coin will have 13000%+ gains this year like Ethereum did in 2017?,0.29,0.71,0.5994
2018-01-15 15:31:11,0,1,bitnewsbot,The Ethereum Scam Database helps you avoid cryptocurrency scammers,0.179,0.414,-0.5106
2018-01-15 15:23:13,0,1,JustGoodNews,NASA Awarded A Grant For Ethereum Blockchain-Related Research,0.51,0.49,0.6369
2018-01-15 17:18:03,1,1,ethereum,Cardano the Japanese Ethereum,0.0,1.0,0.0
2018-01-15 20:01:39,6,1,EtherDelta,"Bad jump destination, ethereum lost! please help!",0.348,0.209,-0.3365
2018-01-15 20:59:26,0,1,u_Trader_CobbSMM,"Ethereum has been on a staggering run higher since TraderCobb shared the trade call. Where to now? Watch this video and find out why $1,000 looks like a great area for Ethereum. www.tradercobb.com",0.243,0.757,0.8402
2018-01-15 20:52:56,0,1,Altcoins2018,"NEO Vs Ethereum (ETH): Dominant Altcoin, Still On The Rise",0.0,1.0,0.0
2018-01-15 20:50:16,0,1,newsbotbot,@TechCrunch: Inside Telegram's ambitious $1.2B ICO to create the next Ethereum https://t.co/CQjoUzJCAA by @jonrussell,0.302,0.698,0.6369
2018-01-15 21:41:41,0,1,ethtrader,A modest primer for Ethereum programming,0.0,1.0,0.0
2018-01-15 21:48:50,0,1,Bitcoin,Bitcoin And Ethereum Mining could Consume additional electricity Globally Than Electric Cars : To Evolution,0.0,1.0,0.0
2018-01-16 02:51:07,0,1,CryptoCurrency,How can i Buy ethereum if i’m under 18? I’ve tired pretty much every site but you have to be over 18. My parents don’t want to put their info in because they think it’s tied to the dark net for whatever reason. Can anyone help?,0.148,0.813,0.6715
2018-01-16 12:02:19,0,1,ethereum,Ethereum transaction,0.0,1.0,0.0
2018-01-16 11:42:41,0,1,Ripple,"Cryptocurrency 'bloodbath' as Bitcoin, Ethereum, Ripple, LiteCoin drop in price over fears of global clampdown",0.0,0.726,-0.5994
2018-01-16 11:44:10,0,1,sidj2025blog,"Hacker News: Bitcoin, Ethereum and almost every other cryptocurrency is plunging",0.0,1.0,0.0
2018-01-16 11:47:20,0,1,NewsWhatever,"Bitcoin, Ethereum and almost every other cryptocurrency is plunging",0.0,1.0,0.0
2018-01-16 12:41:46,0,1,ethtrader,"Bitcoin, Ethereum and Ripple Are Suffering Massive Plunges Yet Again",0.0,0.744,-0.4767
2018-01-16 11:25:02,1,1,ethereum,Ethereum-based new Crypto: Eticket4 (ET4),0.0,1.0,0.0
