date,num_comments,score,subreddit,title,pos,neu,compound
2019-06-17 06:51:24,0,1,cardano,"Keisha: #Blockchain Primer: How will a fully decentralized #Cardano benefit #ADA holders? Shelley, the second stage of Cardano’s development, will bring a new era to Cardano. Read more now:",0.112,0.888,0.5046
2019-06-19 02:28:37,0,1,FreeBitcoinOnline,Litecoin (LTC) to MOON then drop 73% ? / Cardano (ADA) News / Polymesh / Bitcoin Billionaires,0.0,0.851,-0.2732
2019-06-19 08:00:58,0,1,CoinPath,"Bitcoin Poised to ‘Easily’ Pass All-Time High, Says Wall Street Strategist – Plus Ethereum, Ripple and XRP, VeChain, Litecoin, Stellar, Cardano",0.095,0.905,0.25
2019-06-20 04:53:31,0,1,Bitcoin4free,CARDANO (ADA) COIN CAN MAKE YOU RICH 2019,0.382,0.618,0.6523
2019-06-19 15:54:00,0,1,crypto_currency,Cardano Testnet; Russia Adopting Crypto; Microsoft Engineer to NEO; MoneyGram XRP,0.0,1.0,0.0
2019-06-21 00:30:45,0,1,3bitcoins,Cardano Progress Update by Sebastien Guillemot (April 2019),0.286,0.714,0.4215
2019-06-21 05:44:13,2,1,cardano,At optimum how many TPS will cardano be able to handle?,0.0,1.0,0.0
2019-06-19 13:43:13,0,1,BestBitcoinNews,"100% Cardano Price Spike Awaits After TestNet Release, Predicts Analyst",0.126,0.874,0.0772
2019-06-20 15:34:53,0,1,Crypto_Currency_News,Cardano 'God Mode'; Amazon Taking on Banks; FunFair's CryptoCasino,0.352,0.648,0.4215
2019-06-20 13:53:30,0,1,CryptoCurrencyTrading,Cardano Price Analysis: ADA/USD Ready to Test Triangle Bottom?,0.238,0.762,0.3612
2019-06-20 13:02:34,0,1,kryptocal,"Add to your calendar Cardano (ADA) event: Taipei City Meetup - July 4, 2019",0.0,1.0,0.0
2019-06-21 19:45:49,0,1,BestBitcoinNews,Cardano ADA Based Exchange IronX Exchange | Bitcoin Cash Hard Fork | EOS Airdrops,0.0,0.887,-0.1027
2019-06-22 00:45:20,10,1,RenderToken,Why not Cardano? None of these platforms have scaled yet.. Algorand's community is tiny and only recently went open source,0.0,1.0,0.0
2019-06-17 21:42:34,0,1,noncensored_bitcoin,[uncensored-r/CryptoCurrency] Cardano (ADA) Partners Georgia To Improve Country's Educational System Using Blockchain,0.209,0.791,0.4404
2019-06-19 15:44:55,0,1,asktraders,Analyst believes cardano (ADA) will gain 117% before this time next month,0.236,0.764,0.5267
2019-06-19 23:22:29,0,1,Bitcoin4free,"Facebook Releases Two Cryptos + White Paper, The End Of Bitcoin Cash &amp; Cardano IOHK Georgia MoU",0.0,1.0,0.0
2019-06-21 22:31:21,0,1,BestBitcoinNews,Kryptos im Blick. 93: Down the Rabbit Hole + Cardano + Ethereum Hard Fork + Facebook,0.0,0.896,-0.1027
2019-06-16 09:44:26,0,1,CoinPath,Cardano Gains New PR Director - Is Global Reach on the Table?,0.28,0.72,0.3612
2019-06-17 07:55:00,0,1,CryptoCurrency,"Looks like the MakerDAO/DAI model has been replicated on EOS now with EOSDT. As someone who holds both ETH and EOS it's great to see DeFi do its job, no matter what chain. Is this happening on NEO, TRON, Cardano, LISK, and other dapp platforms?",0.151,0.806,0.6705
2019-06-17 08:02:11,0,1,CoinPath,"Alex Krüger Warns Bitcoin Approaching Major Line of Resistance – Plus Ethereum, Ripple and XRP, Litecoin, Stellar, Tron, Cardano",0.0,0.924,-0.1027
2019-06-19 18:07:19,0,1,ProBitcointrading,Cardano Price Analysis: ADA/USD Likely To Extend Losses To...,0.149,0.614,-0.25
2019-06-17 20:50:29,0,1,CoinPath,"EOS, Stellar, Cardano, and TRON are showing signs of the next altseason",0.0,1.0,0.0
2019-06-17 12:26:50,0,1,CryptoMarkets,"Adoption: Cardano (ADA) Signs MoU with Government of Georgia, Free University",0.248,0.752,0.5106
2019-06-17 19:03:24,0,1,CryptoCurrency,"#BTC #ADA Input Output Hong Kong, the third-generation R&amp;D firm spearheaded by Charles Hoskinson, Co-founder of Ethereum and creator of Cardano, made a major announc...Read more: https://t.co/Lts3y1yyT2",0.0,1.0,0.0
2019-06-18 00:07:26,0,1,ProBitcointrading,Cardano Price Analysis: Stellar Lumens and Litecoin Stabilizing...,0.0,1.0,0.0
2019-06-19 02:16:17,0,1,u_Friendster_IO,"Price analysis: Stellar, Tron, Cardano, and LTC preparing for an upswing",0.0,1.0,0.0
2019-06-15 07:58:56,0,1,CoinPath,"Crypto Analyst Warns Traders of Potential Altcoin Extinction – Plus Bitcoin, Ripple and XRP, Ethereum, Litecoin, Cardano, Tron",0.0,0.92,-0.1027
2019-06-19 14:03:55,1,1,cardano,Cryptotown.io - Realtime Price Prediction Videos For Cardano,0.0,1.0,0.0
2019-06-19 13:53:32,0,1,CryptoCurrency,By CCN Markets: Cardano is up by over 105 percent year-to-date as it trades at $0.0903 as of this writing. The cryptocurrency is known to some as the “Ethe...Read more: https://t.co/NgLLxfcaBu,0.0,1.0,0.0
2019-06-19 06:42:49,1,1,KONSTELLATION,"Konstellation Network Wants to Disrupt Financial Services Implementing Blockchain with its New Partners - Today's Gazette - Cryptocurrency, Bitcoin, Ripple, Tron, Verge, Cardano News",0.0,1.0,0.0
2019-06-20 05:40:15,0,1,thrillerpodcast,Cardano Price Spikes By 100% After TestNet Release,0.0,1.0,0.0
2019-06-19 20:07:42,0,1,CoinPath,"Bitcoin Derivatives Market Soars to Record High – BTC, Ethereum, XRP, Litecoin, Bitcoin Cash, EOS, Stellar, Cardano Forecasts",0.0,1.0,0.0
2019-06-21 12:22:43,0,1,CoinPath,Bitcoin Cash surges by 4.8% while Cardano follows suit with 3% rise in an hour,0.0,1.0,0.0
2019-06-20 19:28:10,0,1,CryptoCurrencyTrading,Facebook To Be The World's Biggest Bank?! Will Cardano Pump 2x?,0.0,1.0,0.0
2019-06-21 19:48:22,0,1,reddCoin,Cardano parent firm IOHK strives to bring ADA closer to the Chinese market,0.0,1.0,0.0
2019-06-20 13:02:32,0,1,kryptocal,"Add to your calendar Cardano (ADA) event: Tel Aviv Meetup - June 24, 2019",0.0,1.0,0.0
2019-06-21 08:02:30,0,1,CoinPath,"Crypto Analyst Says Bitcoin Set to Smash Through $10K – Plus Ethereum, Ripple and XRP, Litecoin, Stellar, Cardano",0.0,1.0,0.0
2019-06-21 08:07:36,0,1,CryptocurrencyVideos,"Cardano On Tech Monopoly; Grayscale Buys 11,000+ BTC; Coinbase Margin Trading",0.0,1.0,0.0
2019-06-22 00:56:17,0,2,cardano,Rendertoken should build on Cardano!,0.0,1.0,0.0
2019-06-28 03:13:13,0,1,Cryptochillout,Charles Hoskinson Thinks Cardano Will Prevail Over Libra in Emerging Markets,0.0,1.0,0.0
2019-06-29 02:52:30,0,1,FreeBitcoinOnline,"Bitcoin, Ethereum, Bitcoin Cash and Cardano Analysis for Monday 25 February.",0.0,1.0,0.0
2019-06-28 21:46:58,0,1,CoinPath,Cardano CEO Believes ADA Will Outcompete Facebook’s Libra Coin,0.0,1.0,0.0
2019-06-30 13:11:31,0,1,CryptoCurrency,Cardano (ADA) is once again grabbing the headlines because of the recent release of Weiss Ratings. The coin is recognized as the most promising currency an...Read more: https://t.co/ay7bhBCWqe,0.1,0.9,0.4576
2019-06-30 15:13:59,0,1,removalbot,06-30 15:13 - 'Cardano (ADA) - How does it Differ from Bitcoin?' (youtu.be) by /u/cryptoviser removed from /r/Bitcoin within 12-22min,0.0,1.0,0.0
2019-06-30 04:31:02,0,1,CryptoCurrency,Cardano Technical Analysis ADA/USDT (MEGA BULLISH),0.0,1.0,0.0
2019-06-22 15:09:31,0,1,crypto_currency,"Bitmain $500 Million IPO; Cardano IOHK Pushing Chinese Adoption; Bitcoin Passes $10,000",0.0,1.0,0.0
2019-06-22 22:21:15,0,1,CupOcrypto,Cardano launches the Shelley testnet website,0.0,1.0,0.0
2019-06-22 23:22:06,0,1,CoinPath,Cardano: Shelley Testnet’s ‘networking and incentive reward model’ features will be rolled out soon,0.341,0.659,0.7351
2019-06-26 12:47:45,0,1,CryptoCurrency,"The Cardano Foundation is working hard to streamline its international plans. In that context and to avoid any legal issues, they appoint Gianna Abegg as t...Read more: https://t.co/HBfWduzDIm",0.05,0.831,-0.2732
2019-06-28 16:06:38,0,1,CoinPath,"11.8 Million XRP and Cardano (ADA) Stolen From Singapore-Based Bitrue, Crypto Holders Accuse Ireland’s Bitsane of Exit Scam",0.0,0.633,-0.8271
2019-06-26 10:32:55,2,1,Neutro,How does #Neutro shape up against the existing options? #blockchain #comparison #bitcoin #ethereum #ripple #EOS #TRON #Cardano #monero #tezos,0.0,1.0,0.0
2019-06-29 15:39:33,0,1,CryptoCurrency,Tron in the top 10 surpass cardano and stellar,0.184,0.816,0.2023
2019-06-29 18:50:20,0,1,BestBitcoinNews,"Cardano Price Analysis on Road to $20,000 Bitcoin",0.0,1.0,0.0
2019-06-29 09:55:32,0,1,TCCP,The Cardano Community Podcast is now Live on Instagram,0.0,1.0,0.0
2019-06-24 20:00:04,0,1,cardano,Luckygames is the best CARDANO dice gambling site. The main goal is to bring you the greatest gambling experience ever with all the high-end features.,0.268,0.732,0.8555
2019-06-24 20:06:05,0,1,CoinPath,"Anthony Pompliano Predicts Bitcoin Will Shatter $100,000 – BTC, Ethereum, XRP, Litecoin, Bitcoin Cash, EOS, Tron, Cardano Forecasts",0.0,1.0,0.0
2019-06-25 08:10:54,2,1,cardano,Why is cardano performing so bad,0.0,0.527,-0.6696
2019-06-25 02:02:53,0,1,Bitcoin4free,Actual Bitcoin FOMO | Cardano Milestone | Institution Buying ETH 1300% Premium | Crypto News,0.0,1.0,0.0
2019-06-26 14:02:43,1,1,cardano,New to Cardano - Where to buy?,0.0,1.0,0.0
2019-06-26 21:04:30,0,1,CryptoCurrencies,Cardano (ADA) Price Prediction &amp; Technical Analysis - Highest Potential Coin For 2019? (AVAILABLE ON BINANCE),0.0,1.0,0.0
2019-06-27 10:42:38,0,1,CryptoCurrencies,"Singaporean Exchange Bitrue Gets Hacked, Losing $5 Million in XRP, Cardano",0.0,0.629,-0.6486
2019-06-23 13:02:15,0,1,kryptocal,"Add to your calendar Cardano (ADA) event: NYC Meetup - June 25, 2019",0.0,1.0,0.0
2019-06-23 14:54:01,0,1,Crypto_Currency_News,Cardano - Rollout of Shelley Testnet,0.0,1.0,0.0
2019-06-24 11:43:56,2,1,cardano,What Is Cardano (ADA) Why Is It Undervalued?,0.0,1.0,0.0
2019-06-26 20:19:16,0,1,BestBitcoinNews,"Coinbase Adds BAT.. Are Cardano, Zcash and Stellar Next? | Bitcoin Cash Pumps",0.0,1.0,0.0
2019-06-26 19:16:59,0,1,altcoin,Cardano (ADA) Price Prediction &amp; Technical Analysis - Highest Potential Coin For 2019?,0.0,1.0,0.0
2019-06-26 14:37:10,0,1,Crypto_Currency_News,The relaunch of The Cardano Community Podcast. 🎂🎊,0.0,1.0,0.0
2019-06-28 17:28:24,0,1,cryptoall,Weiss Praises Cardano; JPMorgan CEO Mad at Crypto Firms; US' Fake Unemployment Stats,0.157,0.417,-0.7003
2019-06-27 21:55:12,0,1,CoinPath,Cardano Will Outcompete Facebook's Libra in Emerging Markets. says Charles Hoskinson,0.0,1.0,0.0
2019-06-29 08:02:31,0,1,CoinPath,"MarketWatch: Odds of 40% Bitcoin Crash ‘Overwhelming’ – Plus Ethereum, Ripple and XRP, Litecoin, Stellar, Cardano",0.0,0.838,-0.4019
2019-06-29 12:14:04,0,1,CryptoCurrencies,CRYPTO-COASTER / LITECOIN ADOPTION / EOS to $4 ? / CARDANO UPDATE &amp; 3COMMAS,0.0,1.0,0.0
2019-06-24 15:13:35,0,1,CupOcrypto,Cardano (ADA) Developers Unveils Staking Testnet for Upcoming Shelley Upgrade,0.0,1.0,0.0
2019-06-24 17:17:41,0,1,cryptoall,"Cardano - ADA's First Transaction, Georgia MoU, Meetups",0.0,1.0,0.0
2019-06-26 22:11:23,0,1,CupOcrypto,Technical Analysis and Market Entry: Cardano (ADA) – Bulls are on a Launchpad and Next Jump is Near,0.0,1.0,0.0
2019-06-26 23:33:55,1,1,cardano,Cryptotown.io - Realtime Price Prediction Videos For Cardano,0.0,1.0,0.0
2019-06-27 14:09:00,0,1,Crypto_Currency_News,Yoroi (ADA) Payment URLS; Cardano/XRP Theft; Ripple FAFT Compliant; ErisX Bitcoin Futures,0.0,1.0,0.0
2019-06-27 15:54:43,0,1,CupOcrypto,Cardano Price Watch: ADA Flimsy at 9.5 Cents Despite Shelly Testnet Launching,0.0,1.0,0.0
2019-06-25 06:13:09,0,1,CupOcrypto,Please beware of anyone claiming to have a partnership or collaboration with #Cardano or the #CardanoFoundation. Av…,0.133,0.867,0.3182
2019-06-25 05:43:12,0,1,CupOcrypto,Please beware of anyone claiming to have a partnership or collaboration with #Cardano or the #CardanoFoundation. Avoid using/accessing third party wallets &amp; apps claiming to support staking or giving high % rewards for your (ADA) assets: beware of scams! #CardanoCommunity,0.297,0.586,0.8016
2019-06-25 18:10:00,1,1,cardano,5 Ways To Buy Cardano (ADA) – Cheapest Way To Buy &amp; Sell 2019,0.0,1.0,0.0
2019-06-27 21:13:05,1,1,cardano,How to host a Self-Node in Windows 10 | Cardano Shelly Test-net,0.0,1.0,0.0
2019-06-28 19:53:12,1,1,cardano,when cardano will moon...,0.0,1.0,0.0
2019-06-23 09:08:46,0,1,cardano,Will Cardano face any of these steaming obstacles?,0.0,0.729,-0.3818
2019-06-24 00:46:34,0,1,thrillerpodcast,Cardano (ADA) Launches Staking Testnet for Long-Awaited Shelley Upgrade,0.0,1.0,0.0
2019-06-29 02:33:54,2,1,cardano,Cryptotown.io - Cardano Price Predictions,0.0,1.0,0.0
2019-06-28 16:39:13,0,1,GGCrypto,Singapore-based Cryptocurrency Exchange Bitrue Hacked for $4.5 Million worth of Ripple (XRP) and Cardano (ADA),0.108,0.739,-0.2023
2019-06-27 13:17:06,0,1,cryptoall,"Bitrue Exchange Hacked, XRP and Cardano (ADA) Stolen",0.0,0.504,-0.7096
2019-06-27 08:05:15,0,1,CoinPath,"Crypto Analyst: Prepare for 40% Bitcoin Retracement – Plus Ethereum, Ripple and XRP, Stellar, Cardano, VeChain",0.0,1.0,0.0
2019-07-01 13:23:48,0,1,RippleTalk,"Major Reasons Why Ripple XRP is Not Pumping at the Moment – Kieran Kelly Highlights - Today's Gazette - Cryptocurrency, Bitcoin, Ripple, Tron, Verge, Cardano News",0.0,1.0,0.0
2019-07-02 20:03:56,0,1,cardano,Cryptotown.io - Cardano Predictions,0.0,1.0,0.0
2019-07-01 09:58:33,0,1,FreeBitcoinOnline,"LIVE: My 1000th Video ! Bitcoin Ethereum Price Movements, Cardano Shelley &amp; BTC Debit Card",0.0,1.0,0.0
2019-07-01 10:56:08,0,1,3bitcoins,CARDANO: Team Reddit AMA; Cardano VS Ethereum Approach; Value / Price Discussion,0.194,0.806,0.34
2019-07-02 07:04:07,0,1,BestBitcoinNews,"Cardano Founder Responds To Critics, ADA On The Chopping Board",0.0,0.804,-0.296
2019-07-02 19:19:14,3,1,cardano,"Cardano ICO, was there a period restriction on initial investors from selling?",0.0,0.826,-0.2732
2019-07-05 11:00:27,0,1,binarydistrict,"Consensys lists top 20 blockchain projects by developer activity, omits Cardano",0.153,0.847,0.2023
2019-07-05 05:50:06,0,1,CoinPath,Cardano Foundation Joins Industry Membership Group to Establish Regulatory Guidelines for Crypto,0.0,1.0,0.0
2019-07-05 07:26:12,0,1,3bitcoins,CARDANO DAEDALUS WALLET HOW TO STORE ADA COINS HINDI,0.0,1.0,0.0
2019-07-05 13:56:22,0,1,CryptoNews,"Massive Crypto Whale Moves 15,000 BTC Worth $176 Million – Plus Ethereum, Ripple and XRP, Litecoin, Stellar, Cardano",0.106,0.894,0.2263
2019-07-03 09:08:58,0,1,Crypto_Currency_News,Will Cardano and VeChain be the flag bearers for the imminent alt season?,0.0,1.0,0.0
2019-07-04 21:19:15,0,1,BitcoinExchangeGuide,Cardano Allowed to Join CDF to Participate in Promoting Regulatory Guidelines,0.343,0.657,0.5719
2019-07-04 21:28:50,2,1,cardano,Cardano Foundation Joined the London Based Global Digital Finance Group,0.0,1.0,0.0
2019-07-04 09:01:44,0,1,AltcoinTrader,A Decentralized Public Blockchain and Cryptocurrency Project Cardano (ADA) is now on KuCoin!,0.0,1.0,0.0
2019-07-06 03:47:09,0,1,ProBitcointrading,Cardano 2019/2020 Price Prediction - Whale Agent : Crypto signals made easy,0.244,0.756,0.4404
2019-07-05 20:22:10,0,1,CoinPath,Cardano Foundation announces association with Global Digital Finance to set market standards,0.0,1.0,0.0
2019-07-05 15:19:44,0,1,BitcoinExchangeGuide,"Cardano CEO: Even if Tron CEO Invited Him to Warren Buffett Dinner, He Would Have Said No",0.0,0.879,-0.296
2019-07-05 15:53:49,0,1,cryptoall,Cardano Joins GDF; Tezos $1 Billion STO; Tether Can Steal Money; Circle CEO to Congress,0.0,0.814,-0.4939
2019-07-01 15:18:44,0,1,cryptoall,Cardano &amp; SBI Ripple Asia on Cashless Society; TRON's July 2019 Outlook,0.0,1.0,0.0
2019-07-01 21:22:21,0,1,CryptocurrencyToday,"Singaporean Exchange Bitrue Gets Hacked, Losing $5 Million in XRP, Cardano",0.0,0.629,-0.6486
2019-07-02 16:08:24,0,1,cryptoall,Cardano ADA &amp; Staking on Huobi; DASH Upgrade Complete; Bank Bought for Crypto,0.0,1.0,0.0
2019-07-05 03:55:28,0,1,icocryptoo,Cardano Gets Listed on KuCoin Exchange! BTC and USDT Trading Pairs Available.,0.0,1.0,0.0
2019-07-05 09:41:12,0,1,GGCrypto,"Chainlink will be applied on Harmony, besides Ethereum. Other Smart Contract platforms (EOS, Cardano, Tron, NEO etc.) will follow.",0.241,0.759,0.6597
2019-07-05 09:55:20,0,1,CoinPath,Facebook's Blockchain Lead on 'Misunderstandings'; Cardano in Cryptocurrency Regulatory Push,0.0,1.0,0.0
2019-07-05 16:43:37,0,1,TelegramOpenNetwork,[NEWS] Facebook's Blockchain Lead on 'Misunderstandings'; Cardano in Cryptocurrency Regulatory Push,0.0,1.0,0.0
2019-07-01 17:02:41,0,1,CryptocurrencyToday,Charles Hoskinson Thinks Cardano Will Prevail Over Libra in Emerging Markets,0.0,1.0,0.0
2019-07-02 01:01:31,0,1,CryptoCurrency,#BTC #ADA Cardano price analysis is showing a bullish triangle forming as the currency is in sway along with the major cryptocurrencies. One of the major players in ...Read more: https://t.co/1jq5kj7iry,0.0,1.0,0.0
2019-07-05 15:19:47,0,1,BitcoinExchangeGuide,ADA Gets KuCoin Listing While Cardano CEO Reveals Upcoming Challenges &amp; His Bag Holdings,0.091,0.909,0.0772
2019-07-04 01:19:22,0,1,BitcoinExchangeGuide,Cardano Price Prediction Today: Daily (ADA) Value Forecast – July 3,0.231,0.769,0.34
2019-07-03 20:59:28,0,1,cryptocurrencynews,Cardano Market Cap Achieves $2.09 Billion (ADA),0.0,1.0,0.0
2019-07-04 04:53:20,0,2,TCCP,"We are honored to announce Episode 2 for the The Cardano Community Podcast In this awesome interview with the founder of Path to Plutus, our own __projekt__ talks to Vincent about: | Haskell | Cardano | Peer-Review | Future Vision Cardano",0.244,0.756,0.8928
2019-07-03 20:33:48,0,2,cardano,"Built a Free Cardano Dashboard for Graphing, Offical News &amp; This Subreddit",0.248,0.752,0.5106
2019-07-05 19:59:20,0,3,CryptoCurrencyTrading,The Cardano Community Podcast &gt;&gt; Projekt vs P2P,0.0,1.0,0.0
2019-07-06 13:31:12,0,3,CardanoMarkets,Cardano joined GDF for shaping governance policies,0.0,1.0,0.0
2019-07-04 13:02:34,0,3,cardano,"Add to your calendar Cardano (ADA) event: World Blockchain Summit - July 25, 2019",0.0,1.0,0.0
2019-07-01 19:09:17,2,4,CryptoCurrency,Cardano testnet setup guide on Linux (Fixed),0.0,1.0,0.0
2019-07-06 15:56:01,2,4,CardanoCoin,Cardano Positioning for STOs; Ether Index 'Preps for Future'; Trillion Dollar Bitcoin Market,0.0,1.0,0.0
2019-07-06 18:05:18,20,6,cardano,Why does EMURGO Academy India (@emurgo_in) twitter bio not reference Cardano at all? I thought Emurgo was charged with promoting Cardano &amp; $ADA?,0.116,0.811,0.264
2019-07-08 01:26:28,6,8,cardano,Does Cardano have any plans to be a DEX?,0.0,1.0,0.0
2019-07-01 14:52:18,14,8,cardano,"Cardano vs. Stellar, in context of code-level teach-in to blockchain.",0.0,1.0,0.0
2019-07-06 22:56:24,3,10,TRXTrading,Cardano (ADA) Fights To Overthrow Tron (TRX) and Reclaim the 10th Position,0.0,0.803,-0.4019
2019-07-04 11:07:03,5,12,cardano,Not directly related to Cardano but Facebook created an entirely new programming language - ‘Move’ in order to build out Libra. People have criticised Cardano for being Haskell based but as FB has identified early - you can’t build a sophisticated smart contract platform on more commonly used code.,0.193,0.741,0.8047
2019-07-01 12:25:47,106,12,cardano,"Cardano Weekly Discussion and Question Thread - July 01, 2019",0.0,1.0,0.0
2019-07-05 06:26:43,2,16,cardano,A Cardano Foundation statement about the International Blockchain Olympiad,0.0,1.0,0.0
2019-07-04 14:20:30,17,16,cardano,When Shelly Mainnet is live and Cardano becomes decentralized....Questions,0.0,1.0,0.0
2019-07-05 22:49:37,20,21,ledgerwallet,"Is Ledger working on getting Stellar, Tron, Cardano, BAT &amp; Chainlink into the Ledger Live App any time soon? Just curiosity.",0.0,1.0,0.0
2019-07-06 19:50:10,8,23,cardano,The Reason Emurgo Academy India Doesn't Reference Cardano or $ADA on Their Twitter Site https://twitter.com/emurgo_in,0.0,1.0,0.0
2019-07-08 02:27:25,1,23,cardano,Cardano registers new listings to attract mass adoption,0.263,0.737,0.3612
2019-07-04 08:04:12,11,29,kucoin,Cardano (ADA) Gets Listed on KuCoin!,0.0,1.0,0.0
2019-07-08 13:41:20,0,1,Bitcoin4free,BREAKING: Physically-Settled Bitcoin Futures APPROVED 📈 | Charles Hoskinson Leaving Cardano in 2020?,0.261,0.739,0.5473
2019-07-08 13:55:00,0,1,Crypto_Currency_News,7 Interesting Facts About Cardano (ADA) Before Investing,0.31,0.69,0.4019
2019-07-08 15:55:51,0,1,bitcoin_is_dead,"Bitcoin Generational Wealth Transfer, Ethereum Oil, Cardano In Georgia &amp; FATF Mistake",0.205,0.641,0.2023
2019-07-09 07:01:57,0,1,BestBitcoinNews,"ADA Indecision, Down 4.8% As Confidence in Cardano Increase",0.418,0.448,0.5859
2019-07-09 18:33:53,2,1,cardano,Cryptotown.io - Realtime Price Prediction Videos For Cardano,0.0,1.0,0.0
2019-07-09 14:49:26,0,1,cryptoall,Cardano Recap from Taiwan; China Eyeing Own Crypto; Removing GST Crypto Tax,0.0,1.0,0.0
2019-07-09 09:01:37,0,1,CoinPath,"Bitcoin Shooting Straight for $30,000, Says Morgan Creek Founder – Plus Ripple and XPR, Ethereum, Litecoin, Cardano",0.112,0.888,0.2263
2019-07-09 11:03:01,1,1,cardano,Will Cardano (ADA) yield positive returns on investment? Its recent price predicts otherwise,0.231,0.769,0.5574
2019-07-10 07:10:47,1,1,DLTInsiders,🤔 What is Cardano Crypto? [2019],0.0,1.0,0.0
2019-07-12 02:09:25,0,1,FreeBitcoinOnline,Cardano 1.5 in Mainnet brings Shelley nearer and CoinMarketCap offers to ADA ‘A’ Rating,0.0,1.0,0.0
2019-07-12 05:05:45,0,1,CryptocurrencyToday,"Bitcoin, Ethereum, Bitcoin Cash and Cardano quick Analysis, Tuesday March 5.",0.0,1.0,0.0
2019-07-12 06:28:58,0,1,Altcoinss,"NEO, Cardano and Monero Price Prediction And Analysis For July 12th: NEO, ADA, and XMR",0.0,1.0,0.0
2019-07-12 07:05:42,0,1,BestBitcoinNews,Cardano Plans To Boost Liquidity As ADA Bears Strike,0.241,0.625,0.296
2019-07-10 03:59:37,1,1,bitcoin_is_dead,Cardano AMA by charles Hoskinson 2 16 19 1of 9,0.0,1.0,0.0
2019-07-08 10:27:31,2,1,Neutro,This is why #neutro is better. Take part in the pre-sale for a 60% bonus #blockchain #cryptocurrency #bitcoin #ethereum #ripple #EOS #TRON #Cardano #monero #tezos,0.225,0.775,0.7506
2019-07-11 01:18:24,1,1,DLTInsiders,🤔 How do you buy Cardano? [2019],0.0,1.0,0.0
2019-07-12 00:24:12,0,1,FreeBitcoinOnline,"Bought $649 Investing In POS Cardano, Because POW Mining has Issues Due to Price",0.0,1.0,0.0
2019-07-12 15:48:35,0,1,Bitcoin4free,CARDANO ADA TO $5 BY 2020?! CHARLES SAYS PERFECT OPERABILITY IS A DECADE AWAY,0.283,0.717,0.6932
2019-07-12 17:38:30,0,1,CupOcrypto,BREAKING: Cardano Haskell node GUI revealed!,0.0,1.0,0.0
2019-07-13 00:19:06,0,1,CryptoCurrencies,Cardano is in serious trouble - DOWN 50% vs BTC in last 30 days,0.0,0.733,-0.4588
2019-07-10 17:57:18,0,1,3bitcoins,Using Coinbase Pro to Save Fees &amp; Purchase Cardano,0.286,0.714,0.4939
2019-07-11 09:34:47,0,1,BestBitcoinNews,Cardano AMA by charles Hoskinson 2 16 19 2of 9,0.0,1.0,0.0
2019-07-11 09:54:27,0,1,BitcoinExchangeGuide,Cardano Price Prediction Today: Daily (ADA) Value Forecast – July 10,0.211,0.789,0.34
2019-07-11 16:34:42,0,1,FreeBitcoinOnline,Cardano (ADA) – How does it Differ from Bitcoin?,0.0,1.0,0.0
2019-07-11 16:50:00,0,1,cardano,2gether now supports Cardano which allows its users to transact with $ADA without fees using the 2gether card,0.128,0.872,0.3612
2019-07-12 12:08:24,0,1,Bitcoin4free,WHAT IS CARDANO ADA? INSANE PRICE PREDICTION! TONE DIVES IN!,0.0,0.733,-0.508
2019-07-13 01:59:25,0,1,bitcoin_is_dead,"Bitcoin Remains Just Under $4,000, Cardano ADA Climbs Higher – March 15th Cryptocurrency News",0.0,1.0,0.0
2019-07-13 20:07:24,1,1,cardano,What's up with Emurgo HK? Should Guardians of Cardano get involved?,0.0,1.0,0.0
2019-07-14 09:42:22,0,1,CryptoCurrency,Cardano has shown four major price swings in the last 24 hours in the range of 3% and 9%. The target for 2019 remains at 0.2 USD. Cardano coin is a major c...Read more: https://t.co/5r0kxzbJIv,0.0,1.0,0.0
2019-07-11 00:44:35,1,1,DLTInsiders,🤔 What is Cardano Cryptocurrency? [2019],0.0,1.0,0.0
2019-07-10 11:30:08,0,1,cardano,Cardano now available on the 2gether wallet,0.0,1.0,0.0
2019-07-10 18:49:41,3,1,cardano,"Check out these Cardano Cellphone cases (iPhone, Samsung, and Pixel)",0.0,1.0,0.0
2019-07-12 21:31:32,0,1,BitcoinExchangeGuide,Stellar Lumens (XLM) Posts Double Digit Gains to Oust Cardano (ADA) for 11th in Coin Market Cap,0.13,0.87,0.34
2019-07-11 02:38:10,1,1,DLTInsiders,🤔 What did Girolamo Cardano discover? [2019],0.0,1.0,0.0
2019-07-12 12:56:10,0,1,ProBitcointrading,Cardano Price Analysis: ADA/USD Could Correct Lower To...,0.0,0.761,-0.296
2019-07-12 14:44:18,0,1,AllThingsCrypto,"Cardano, Tron and EOS Price Prediction And Analysis For July 12th: ADA, TRX, and EOS",0.0,1.0,0.0
2019-07-12 13:29:33,0,1,bitcoin_is_dead,People Losing Interest in Bitcoin?! Could Cardano be NEXT for Coinbase? Riot Blockchain Exchange,0.144,0.528,-0.593
2019-07-08 18:42:05,2,1,cardano,Will cardano be able to be used with a distributed storage network like Filecoin? (Once we get Goguen and smart contracts),0.224,0.776,0.6369
2019-07-08 19:31:33,0,1,CryptoCurrencies,"Have some ADA crypto I got with Etherium back when it was .60/share, it’s now around .07, what is the outlook for Cardano ‘ADA’ getting back to form?",0.0,1.0,0.0
2019-07-08 08:42:49,0,1,cardano,"Cardano Collaborates Global Digital Finance to Shape Governance Policies, Other ADA News",0.0,1.0,0.0
2019-07-14 12:57:49,0,1,noncensored_bitcoin,[uncensored-r/btc] Guys. Do you think Cardano has a future?,0.0,1.0,0.0
2019-07-14 13:47:10,1,1,CryptocurrencyToday,Cardano AMA by charles Hoskinson 2 16 19 3of 9,0.0,1.0,0.0
2019-07-15 00:24:46,0,1,BitNewsLive,"Cardano Dips Below 0.059485 Level, Down 12%",0.0,1.0,0.0
2019-07-09 11:13:43,0,1,3bitcoins,Cardano sensible contracts for the longer term,0.0,1.0,0.0
2019-07-09 15:54:20,0,1,BitcoinExchangeGuide,"Cardano Reacting At A Key Technical Zone, ADA Prices May Rally To 9.5 Cents",0.0,1.0,0.0
2019-07-10 09:30:09,1,1,cardano,Cardano and AlgoZ : Cardano (ADA) Doubles Down On Liquidity As It Sets Sights On Institutional Backing,0.068,0.932,0.0258
2019-07-10 08:10:20,1,1,DLTInsiders,🤔 What is Cardano coin? [2019],0.0,1.0,0.0
2019-07-10 08:18:31,1,1,DLTInsiders,🤔 What is Cardano Blockchain? [2019],0.0,1.0,0.0
2019-07-16 18:03:53,2,1,cardano,Cryptotown.io - Cardano Price Predictions,0.0,1.0,0.0
