date,num_comments,score,subreddit,title,pos,neu,compound
2019-01-03 11:56:27,0,1,CryptoCurrencyTrading,"Cardano Most Actively Developed Cryptocurrency in 2018, Bitcoin Not Even in Top 50",0.171,0.724,0.2502
2019-01-03 12:24:35,0,1,fbitcoin,"Cardano most actively developed cryptocurrency in 2018, bitcoin not even in top 50 - Moneycontrol.com",0.16,0.741,0.2502
2019-01-02 07:03:45,15,1,cardano,"“Cardano has more than twice the commits of the second place Augur, at over 45,000.” Way to go @InputOutputHK 👏🏻",0.055,0.945,0.0258
2019-01-02 08:47:17,12,1,cardano,ERC-20 Tokens migrating from the Ethereum Network to Cardano - What's the impact on our holdings?,0.0,1.0,0.0
2019-01-03 12:58:45,0,1,cardano,What is Cardano Blockchain?,0.0,1.0,0.0
2019-01-04 09:19:24,0,1,TrendsProject,"Wall Street Pours $24 Billion Into Bitcoin and Crypto, Plus Ripple and XRP, Tron, Ethereum, Litecoin, Stellar, Cardano: Crypto News Alert",0.099,0.901,0.296
2019-01-04 11:22:28,0,1,CryptoCurrencies,"“Not Even Banks Want A Token Controlled By Banks”—Ripple XRP’s David Schwartz Replies Critics - Today's Gazette - Cryptocurrency, Bitcoin, Ripple, Tron, Verge, Cardano News",0.055,0.851,-0.2263
2019-01-04 08:46:25,4,1,cardano,CARDANO EFFECT: Episode 11 - Cardano Year in Review. We look at all the major Cardano accomplishments in 2018....,0.0,1.0,0.0
2019-01-01 08:15:20,0,1,CoinPath,"Crypto VC Says Bitcoin Set to Replace Gold With 100x Surge, Plus Ripple and XRP, Ethereum, Stellar, Cardano, IOTA, Nano: Crypto News Flash",0.0,1.0,0.0
2019-01-01 05:21:45,0,1,u_Trixamuz,Bitcoin Ripple Ethereum Litecoin EOS Cardano BTC XRP ETH LTC ADA,0.0,1.0,0.0
2019-01-03 23:51:39,0,1,u_DNACHMAN613,CARDANO,0.0,1.0,0.0
2019-01-03 23:50:32,0,1,u_DNACHMAN613,https://www.reddit.com/r/cardano/comments/ac6lmk/cardano_ranks_number_one_among_top_100_based_on/?st=JQH9JB2L&amp;sh=29b7d69e,0.0,1.0,0.0
2019-01-04 06:04:50,19,1,cardano,Cardano is no 1 in GitHub activities,0.0,0.694,-0.296
2019-01-05 01:42:29,0,1,CryptoCurrencies,"Bitcoin, Ethereum, Ripple, Bitcoin Cash, EOS, Stellar, Litecoin, Bitcoin SV, TRON, Cardano: Price Analysis, Jan. 4",0.0,1.0,0.0
2019-01-05 09:16:47,0,1,CoinPath,"Wall Street Titan Misses $7 Billion Bitcoin Windfall, Plus Ripple and XRP, Tron, Ethereum, Cardano, IOTA, VeChain: Crypto News Flash",0.0,0.909,-0.2263
2019-01-05 13:24:07,0,1,ethereumbtctrader,Cardano Price Analysis: ADA/USD Risk Dropping Below 6 Cents,0.0,0.769,-0.2732
2019-01-01 21:16:37,10,1,CryptoCurrency,Cardano publishes PoS paper. Anybody here think they can actually pull off what they set out to do?,0.0,1.0,0.0
2019-01-02 20:45:49,1,1,cardano,What is Cardano Blockchain ?,0.0,1.0,0.0
2019-01-03 18:44:53,0,1,Crypto_Currency_News,"Cardano Proof of Stake Paper; Mimblewimble, Beam, &amp; Grin; $182M Raised By Bakkt",0.205,0.795,0.4767
2019-01-05 00:27:02,0,1,CryptoCurrency,Why Investors Should be Paying Attention to Cardano in 2019,0.0,1.0,0.0
2019-01-04 11:31:07,4,1,CryptoCurrency,"Cardano most actively developed cryptocurrency in 2018, Bitcoin not even in top 50",0.171,0.724,0.2502
2019-01-01 20:23:24,0,1,CryptoCurrency,"2019 Top Cryptos? Bitcoin, Ethereum, Ripple, Bitcoin Cash, Bitcoin SV, EOS, Litecoin, Cardano, Ethereum Classic.",0.114,0.886,0.2023
2019-01-01 15:53:56,2,1,cardano,"2019 : Wherever you go, take Cardano !!!",0.0,1.0,0.0
2019-01-02 05:26:50,3,1,cardano,In 2019 you will be able to pay with Cardano and receive a discount on all purchases from stores where you usually shop,0.0,0.938,-0.1027
2019-01-02 08:19:18,0,1,TrendsProject,"Early Twitter Investor Predicts Bitcoin and Crypto Breakthrough, Plus Ripple and XRP, Ethereum, Tron, Litecoin, Cardano: Crypto News Alert",0.109,0.891,0.296
2019-01-02 11:39:08,0,1,fbitcoin,"Early Twitter Investor Predicts Bitcoin and Crypto Breakthrough, Plus Ripple and XRP, Ethereum, Tron, Litecoin, Cardano: Crypto News Alert - The Daily Hodl",0.095,0.905,0.296
2019-01-02 11:55:19,0,1,cryptobots,"Cardano Celebrates New Year With Newly-Published Proof-of-Stake Paper, Trezor Wallet Support https://goo.gl/7hnXqU - Crypto Insider Info - Whales's",0.314,0.686,0.7506
2019-01-02 15:00:38,0,1,cardano,"Altcoins Daily Preview: TRX Bulls Aim at 2.5 Cents, Cardano (ADA)—Tron Could “Flap”",0.0,1.0,0.0
2019-01-02 17:43:28,2,1,CryptoCurrency,Honest question for anyone who can answer: what are the differences between Tezos and Cardano?,0.191,0.809,0.5106
2019-01-02 18:57:51,0,1,cardano,Earn ICO tokens while you spend your cardano — Steemit,0.0,1.0,0.0
2019-01-02 21:09:22,0,1,Cryptochillout,"Bitcoin, Ethereum, Ripple, Bitcoin Cash, EOS, Stellar, Litecoin, Bitcoin SV, TRON, Cardano: Price Analysis, Jan. 2",0.0,1.0,0.0
2019-01-02 21:33:45,0,1,u_cryptokingjay,"CRYPTO HODL REPORT DAY 35 - RIPPLE XRP, SIACOIN, PUNDI X, CARDANO | Cryp...",0.0,1.0,0.0
2019-01-07 11:47:47,0,1,BitcoinNews,"DX.Exchange Revealed Bitcoin, Ethereum, XRP, Litecoin and Cardano Coming to Crypto and Wall Street Game Changer",0.0,1.0,0.0
2019-01-07 08:46:54,0,1,cardano,Cardano Effect: Cardano Business Development with Daniel Friedman - Episode 12 #thecardanoeffect #cardano #businessdevelopment,0.0,1.0,0.0
2019-01-07 13:12:44,2,1,CryptoCurrency,Cardano Business Development with Daniel Friedman - Episode 12,0.0,1.0,0.0
2019-01-06 17:12:59,7,1,dashpay,Cardano (ADA) on Japanese TV; DASH Critics; American Economics Association &amp; Crypto,0.0,0.833,-0.296
2019-01-06 10:24:29,12,1,cardano,Cardano (ADA) has Become Particularly Visible on Japanese TVs,0.0,1.0,0.0
2019-01-02 06:04:58,26,1,cardano,Is Cardano Sexy Enough?,0.531,0.469,0.5267
2019-01-06 05:51:37,1,1,CryptoCurrencies,Litecoin And Cardano Lead The Day As The Market Takes A Breather!,0.0,1.0,0.0
2019-01-04 12:08:04,3,1,cardano,"Sebastien: Every month we have a growing number of people watching through our progress update videos. On track to 10,000 people actively listening to all the details of our updates this month! The Cardano community just keeps growing 🚀",0.24,0.76,0.7959
2019-01-07 14:22:00,0,1,thecardanoeffect,Episode 12 - Cardano Business Development with Daniel Friedman,0.0,1.0,0.0
2019-01-07 14:44:38,0,1,Tronix,"Cryptocurrency Bull Run: Tron (TRX) Leads Bitcoin SV, Goes Past Cardano (ADA), IOTA (MIOTA)",0.0,1.0,0.0
2019-01-07 11:59:24,2,1,BitcoinMining,"DX.Exchange Revealed Bitcoin, Ethereum, XRP, Litecoin and Cardano Coming to Crypto and Wall Street Game Changer [x-post from /r/thecoinrepublic]",0.0,1.0,0.0
2019-01-07 17:14:57,0,1,CryptoCurrencyTrading,"Tokenized Security Platform DX.Exchange Adds Bitcoin (BTC), XRP, Ethereum, Litecoin (LTC), Cardano and other Tokens",0.146,0.854,0.34
2019-01-08 01:26:23,0,1,Cryptochillout,"Bitcoin, Ethereum, Ripple, Bitcoin Cash, EOS, Litecoin, Stellar, Bitcoin SV, TRON, Cardano: Price Analysis, Jan. 7",0.0,1.0,0.0
2019-01-06 19:53:12,0,1,tribetica,Upward Momentum Pushes Cardano Price Closer to $0.05,0.0,1.0,0.0
2019-01-06 19:06:24,0,1,BitcoinExchangeGuide,CARDANO (ADA) Long-term Price forecast-January 6,0.0,1.0,0.0
2019-01-06 19:01:39,0,1,CryptoCurrencies,"VeChain (VET), Ravencoin (RVN), ReddCoin (RDD), Buggyra Coin Zero (BCZERO) Swing High As Bitcoin (BTC) Touches 4000 Mark - Today's Gazette - Cryptocurrency, Bitcoin, Ripple, Tron, Verge, Cardano News",0.0,1.0,0.0
2019-01-06 22:18:23,0,1,ThisWeekInCrypto,"Revealed: Nasdaq-Powered DX.Exchange Will Support Bitcoin, Ethereum, XRP, Litecoin, Cardano, OmiseGo, Enigma, and Digibyte and ShareToken at Launch Tomorrow",0.13,0.87,0.4019
2019-01-02 17:38:22,22,1,cardano,Cardano (ADA) Publishes Long-awaited Proof of Stake Paper,0.0,1.0,0.0
2019-01-06 09:09:39,0,1,HARAToken,See How Hara and cardano are solving real world problems,0.183,0.611,-0.0772
2019-01-06 14:53:55,0,1,cryptobots,"Bitcoin SV Debate, TRON Asks For Help, Litecoin Use Case, Cardano Side Chain &amp; No One Will Use BTC https://goo.gl/hNe4ww - Crypto Insider Info - Whales's",0.1,0.818,0.128
2019-01-03 14:01:05,3,1,cardano,The Cardano roadmap is updated again - January 2019,0.0,1.0,0.0
2019-01-04 07:37:48,0,1,cardano,"Austin: Stellar &amp; #Cardano will compliment each other extremely well. The Stellar network will have fiat stablecoins &amp; tokenized assets/securities. The Cardano network will provide as a financial system for financial applications, and any dApps in general.",0.139,0.861,0.6697
2019-01-04 01:42:31,14,1,CryptoNewsandTalk,"Cardano most actively developed cryptocurrency in 2018, bitcoin not even in top 50",0.171,0.724,0.2502
2019-01-04 17:24:09,0,1,ethereumbtctrader,Cardano bounces off of the...,0.0,1.0,0.0
2019-01-05 06:46:40,0,1,CryptoCurrency,Cardano 2019 progress from December! Incredible! #BUIDL #HODL,0.326,0.674,0.5242
2019-01-06 05:56:10,1,1,cryptoall,Bitcoin mentioned around Reddit: Litecoin And Cardano Lead The Day As The Market Takes A Breather! /r/CryptoCurrencies,0.0,1.0,0.0
2019-01-06 06:15:38,9,1,cardano,"EMURGO: National broadcast TV station（NHK）introduced Cardano as reliable and scientific project. Cardano was also described active community project. Thanks always, community!! @8bit_HORIJUN #emurgo #cardano #ada youtu.be/yKAiTolYGP8",0.205,0.795,0.7339
2019-01-05 02:41:59,2,1,cardano,Cardano Dominates Blockchain Development by Git Commits,0.315,0.685,0.0772
2019-01-03 12:46:13,9,1,cardano,"Cardano, the most actively developed cryptocurrency in 2018",0.27,0.73,0.3804
2019-01-03 21:23:57,0,1,u_cryptokingjay,"CRYPTO HODL REPORT DAY 37 - RIPPLE XRP, SIACOIN, PUNDI X, CARDANO | Cryp...",0.0,1.0,0.0
2019-01-03 20:24:14,0,1,CoinPath,Crypto Markets Face Headwinds as Rally Stalls Again; Cardano Named Most Developed Cryptocurrency of 2018,0.0,1.0,0.0
2019-01-03 11:47:15,0,1,tradingcryptotoday,Cardano - Sell a bounce ? | Technical analysis By Whaleagent | 8.8.18 | — Steemit,0.0,1.0,0.0
2019-01-03 14:00:31,1,1,cardano,"Add to your calendar Cardano (ADA) event: Roadmap Update - January 3, 2019",0.0,1.0,0.0
2019-01-04 03:49:48,2,1,cardano,Cardano has more activity than any other crypto projects at GitHub,0.0,1.0,0.0
2019-01-05 15:43:17,0,1,ProBitcointrading,Cardano bounces off of the support | Technical Analysis by WhaleAgent | 8.1.2018 — Steemit,0.197,0.803,0.4019
2019-01-04 05:50:43,15,1,cardano,Cardano is the new bitcoin? And Charles is Satoshi?,0.0,1.0,0.0
2019-01-04 18:54:31,10,1,thecardanoeffect,"Daniel Friedman, IOHK Business Development, will be appearing on The Cardano Effect Monday, January 7th. Leave questions for him in this thread to be read on the podcast.",0.0,0.957,-0.0516
2019-01-14 11:18:20,0,1,cryptoall,Will Cardano Be A Good Investment In 2019? | BTC Wires,0.266,0.734,0.4404
2019-01-14 11:43:55,1,1,waltonchain,"Waltonchain (WTC) Now Korea’s New Educational Organization For Ministry Of Employment And Labor - Today's Gazette - Cryptocurrency, Bitcoin, Ripple, Tron, Verge, Cardano News",0.0,1.0,0.0
2019-01-13 18:05:54,11,1,cardano,How does Cardano compare to Tezos,0.0,1.0,0.0
2019-01-15 04:04:47,0,1,cardano,'Daedalus is unable to start' error on Windows for Cardano 1.4 (possible easy fix),0.165,0.682,0.0516
2019-01-13 17:21:07,0,1,cryptocurrencytopnews,"Top 5 Crypto Performers Overview: Tron, Neo, Cardano, Binance Coin, Litecoin",0.167,0.833,0.2023
2019-01-13 17:48:33,0,1,cryptoall,CARDANO Shelley Coming; Wine Makers Vechain; Thai Crypto P2P Payment; CEO On Market,0.0,1.0,0.0
2019-01-13 17:26:34,0,1,icocrypto,"What do you think? Top 5 Crypto Performers Overview: Tron, Neo, Cardano, Binance Coin, Litecoin",0.122,0.878,0.2023
2019-01-13 17:39:42,2,1,cardano,Two Catalysts Could Trigger Cardano (ADA)’s Price Surge in 2019 Above $10 - Crypto Daily Gazette,0.0,1.0,0.0
2019-01-14 20:23:56,0,1,Tronix,"Tron (TRX), Revain (R), and Chainlink (LINK) Are Back, Lead Crypto Bull With Over 8%, 23%, 19% Respectively - Today's Gazette - Cryptocurrency, Bitcoin, Ripple, Tron, Verge, Cardano News",0.085,0.915,0.34
2019-01-14 21:59:27,0,1,CryptoTrading24,"Bitcoin, Ripple, Ethereum, Bitcoin Cash, EOS, Stellar, Litecoin, Tron, Bitcoin SV, Cardano: Price Analysis, Jan. 14",0.0,1.0,0.0
2019-01-14 22:52:59,0,1,ledgerwallet,When will ADA (Cardano) be supported on Ledger S?,0.223,0.777,0.3182
2019-01-13 20:56:33,17,1,cardano,"CARDANO, Listen up! Welcome To The Clio.1 Educaton Hub",0.292,0.708,0.5093
2019-01-08 12:01:37,3,1,cardano,Cardano Gets a YES from Japan's National TV,0.364,0.636,0.5319
2019-01-09 13:06:26,0,1,BitcoinExchangeGuide,CARDANO (ADA) Daily Price Forecast –January 9,0.0,1.0,0.0
2019-01-09 13:01:41,0,1,cryptoeconomynet,Cardano [ADA] Moves a Step Closer to the Shelley Release,0.0,1.0,0.0
2019-01-10 16:26:34,0,1,cardano,"EMURGO: 2018 was also the year that EMURGO, along with three other leading Blockchain companies, founded the “Blockchain for Europe” Association. #tbt EMURGO | Building a Global #Cardano! #EU efforts",0.0,1.0,0.0
2019-01-10 17:44:27,0,1,cardano,Cardano To HQ In USA; Ripple's XRP In Australia; Thailand Crypto Lead; Debt &amp; Stocks,0.0,0.848,-0.3612
2019-01-10 15:48:27,0,1,cardano,"It is #throwbackthursday and what better day to report to the Cardano community on the incredible EMURGO successes of 2018. EMURGO is the commercial arm of the Cardano blockchain project. Read Part 1 of our blog covering #Yoroi, #Metaps, #SOSV, and winning the Grand Prix award at last year's JBC",0.272,0.728,0.9468
2019-01-10 20:41:45,0,1,cryptobots,Cardano Moving To Wyoming As New Governor Praises Blockchain https://t.co/24zdpy2YOs - Crypto Dynamic Info - Whales's,0.333,0.667,0.7184
2019-01-11 02:39:53,0,1,u_zhuhuan,Cardano [ADA] ranks first among cryptocurrencies in Github activity,0.0,1.0,0.0
2019-01-10 17:30:25,6,1,cardano,"Tom Lyons of ConsenSys (Ethereum) repeats Cardano roadmap word for word in this interview, watch at 17:46 What a joke!",0.122,0.878,0.3595
2019-01-10 22:50:21,33,1,CryptoCurrency,I’m looking to invest in either NEO or Cardano? Opinion?,0.0,1.0,0.0
2019-01-11 20:58:24,0,1,CryptoTrading24,"Bitcoin, Ripple, Ethereum, Bitcoin Cash, EOS, Stellar, Litecoin, Tron, Bitcoin SV, Cardano: Price Analysis, Jan. 11",0.0,1.0,0.0
2019-01-11 21:51:35,0,1,cryptobots,"Cardano to Enter Next Phase, Shelley, in Q1 2019 https://goo.gl/cBsgYL - Crypto Dynamic Info - Whales's",0.167,0.833,0.3818
2019-01-11 06:37:00,2,1,cardano,Katsumoto: One of our community members told us he loves Cardano so much he’s supporting us with EMURGO logos on his race car! Let’s cheer him on! #CARDANO #EMURGO #ADA #Racingcar,0.277,0.723,0.8945
2019-01-09 05:15:55,1,1,XRP,"2019 Prediction: XRP Could Be #1, EOS &amp; Cardano ADA Adoption &amp; Litecoin Price Jump",0.0,1.0,0.0
2019-01-09 20:21:05,0,1,AllThingsCrypto,"Bitcoin, Ethereum, Ripple, Bitcoin Cash, EOS, Litecoin, Stellar, Tron, Bitcoin SV, Cardano: Price Analysis, Jan. 9",0.0,1.0,0.0
2019-01-09 08:06:23,8,1,cardano,"With Ouroboros and PoS, does it mean that if a nation issued their currency on Cardano that it would be safe from PoW issues like a 51% percent attack etc?",0.161,0.746,0.3182
2019-01-09 14:03:17,7,1,cardano,Does Cardano have the flaw / threat of a 51% attack that ETC fell victim to?,0.0,0.561,-0.8225
2019-01-10 08:38:47,0,1,BitNewsLive,Cardano Moving To Wyoming As New Governor Praises Blockchain,0.298,0.702,0.5267
2019-01-08 19:48:43,0,1,cryptoall,"Cardano Moves Closer to Shelley Release, Amid Flurry of News",0.0,1.0,0.0
2019-01-08 09:42:12,1,1,cardano,Cardano (ADA) Recording Increased Media Attention in Japan,0.231,0.769,0.2732
2019-01-10 05:27:35,1,1,CryptoCurrencies,Tron and Cardano Lead The Day! New MimbleWimble Privacy Tech!,0.0,1.0,0.0
2019-01-10 13:28:02,0,1,cryptobots,Cardano (ADA) Price Analysis – January 10 https://goo.gl/WwSBtk - Crypto Dynamic Info - Whales's,0.206,0.794,0.3818
2019-01-13 11:46:29,0,1,fbitcoin,"Bitcoin Whales Burst to Life, Plus Ripple and XRP, Tron, Ethereum, Cardano, Kyber, VeChain: Crypto News Flash - The Daily Hodl",0.0,1.0,0.0
2019-01-12 10:13:53,27,1,cardano,Programming and Cardano,0.0,1.0,0.0
2019-01-13 15:41:25,2,1,cardano,Cardano Community Info,0.0,1.0,0.0
2019-01-12 13:57:11,8,1,CryptoCurrency,Looking for Cardano fans for a positive discussion about its strengths/weaknesses.,0.286,0.714,0.5574
2019-01-12 16:39:41,0,1,CryptoCurrency,Sidechain Paper by Cardano to be Highlighted at Cybersecurity Security Conference,0.194,0.806,0.34
2019-01-13 08:04:59,1,1,CryptoCurrency,"Bitcoin Whales Burst to Life, Plus Ripple and XRP, Tron, Ethereum, Cardano, Kyber, VeChain: Crypto News Flash",0.0,1.0,0.0
2019-01-08 09:06:22,0,1,AllThingsCrypto,"January Cryptocurrency Predictions Report: Nearly all coins expected to fall, with the exception of Stellar and Cardano",0.0,1.0,0.0
2019-01-08 17:21:23,0,1,fbitcoin,"Crypto Collides With the US Stock Market, Plus Bitcoin, Ripple and XRP, Tron, Ethereum, Litecoin, Cardano: Crypto News Alert - The Daily Hodl",0.091,0.823,0.0258
2019-01-10 04:00:46,8,1,tezos,Reminder: Cardano is a tezos wannabe centralized knockoffs powered by a great salesman (Charles) and it always misses it's deadline (per their roadmap) WTF it's up there is beyond me,0.115,0.704,-0.3254
2019-01-10 16:39:26,3,1,cardano,EMURGO: It is #throwbackthursday and what better day to report to the Cardano community on the incredible #EMURGO successes of 2018. EMURGO is the commercial arm of the #Cardano blockchain project. Read Part 1 of our blog here!,0.163,0.837,0.7777
2019-01-12 19:49:03,3,1,cardano,Cardano and security tokens,0.444,0.556,0.34
2019-01-08 09:43:12,2,1,cardano,Cardano price sheet for 2019 include Proof of stake reward sheet!,0.285,0.715,0.6114
2019-01-10 15:04:33,0,1,CoinPath,Cardano (ADA) Price Analysis – January 10,0.0,1.0,0.0
2019-01-10 08:24:19,0,1,cardano,Cardano Moving To Wyoming As New Governor Praises Blockchain - The Bitcoin News,0.236,0.764,0.5267
2019-01-10 05:14:25,0,1,CoinPath,"January Cryptocurrency Predictions Report: Bitcoin, Ethereum, XRP, EOS, Stellar, Litecoin, Tron, Cardano, Monero, NEO, Dogecoin",0.0,1.0,0.0
2019-01-10 10:19:55,0,1,cardano,Looking for people interested in starting a Cardano based exchange...,0.252,0.748,0.4019
2019-01-10 07:08:22,1,1,cardano,Cardano/bitcoin crash/drop,0.0,1.0,0.0
2019-01-09 08:30:40,7,1,cardano,Cardano Wallets aren't working,0.0,1.0,0.0
2019-01-10 16:40:43,0,1,cryptobots,"Bitcoin (BTC) and Alt Technicals: Tron (TRX), Neo (NEO), Stellar (XLM), Cardano (ADA) – | B… https://t.co/ysQb7rtWgY - Crypto Dynamic Info - Whales's",0.126,0.874,0.3818
2019-01-12 14:40:00,49,1,cardano,"Charles Hoskinson: Thanks guys for elaborating a point. So much extremely deep and subtle work has gone into Cardano by a large team of scientists and engineers. The criticism we are receiving ""for just a wallet"" or ""whitepaper"" is insulting and divorced from reality",0.062,0.809,-0.4939
2019-01-13 00:44:39,1,1,CryptoCurrency,Trezor to Yoroi from scratch for Cardano (January 2019) Video,0.0,1.0,0.0
2019-01-12 14:17:31,4,1,CryptoCurrency,LOL this video from Cardano,0.469,0.531,0.5473
2019-01-13 13:03:09,1,1,cardano,Vantuz Subhuman: Big thank you to @IOHK_Charles and @InputOutputHK for the awesome opportunity to join them at the internal #Cardano workshop in preparation for the Shelley release! It was a superb event and a chance to meet all the greatest people and to participate in fascinating discussions :),0.437,0.563,0.9812
2019-01-17 00:44:54,0,1,u_fredy456,Atomic Wallet ❤️ and support Cardano!,0.374,0.626,0.4574
2019-01-18 00:22:12,0,1,CryptoCurrencies,Cardano Price Analysis: ADA/USD Another Reversal Attempt?,0.0,1.0,0.0
2019-01-17 18:04:09,3,1,cardano,Which Blockchain has a dedicated and independent watchdog? @CardanoWatchdo1 monitoring the projects progress and challenging its devs❓ #Cardano is not only securely and diligently being developed according to very high standards. It’s being monitored by the community as well,0.213,0.741,0.7553
2019-01-20 13:01:01,0,1,AllThingsCrypto,Cardano Price Momentum Sours Following Bearish Bitcoin Trend,0.0,1.0,0.0
2019-01-20 15:35:18,0,1,cryptobots,Drawing the Lines between Cardano and Neo (How They Compare) https://goo.gl/xkMNoH - Crypto Dynamic Info - Whales's,0.157,0.843,0.3818
2019-01-20 18:11:15,0,1,thrillerpodcast,"Top 5 Crypto Performers Overview: Binance Coin, Cardano, IOTA, Neo, Tron",0.167,0.833,0.2023
2019-01-17 16:22:22,2,1,CardanoCoin,"Binance Fiat to Crypto; Ethereum - Constantinople, Cardano, &amp; Lubin; Beam Vulnerability",0.0,0.84,-0.2263
2019-01-18 17:13:17,0,1,cardano,"IOHK: The IOHK Cardano Weekly technical reports is now published, please read it here: buff.ly/2F3FPKg #Cardano #cardanocommunity",0.126,0.874,0.3182
2019-01-18 16:11:01,1,1,cardano,"Dionysis Zindros, Researcher at IOHK, will be appearing on The Cardano Effect Monday, January 21st. Leave questions for him over at r/The CardanoEffect to be read on the podcast.",0.0,0.959,-0.0516
2019-01-17 22:40:15,2,1,cardano,"New mobile Cardano wallet and exchange! Your private keys, your ADA",0.0,1.0,0.0
2019-01-18 10:53:37,0,1,tribetica,Bold Price Predictions For Stellar (XLM) and Cardano (ADA) in 2019,0.206,0.794,0.3818
2019-01-17 19:12:57,1,1,btc,Are you a Bitcoin Maximalist? Ethereum Maximalist? Bitcoin Cash Maximalist? EOS Maximalist? Cardano Maximalist? Ripple Maximalist? Litecoin Maximalist? Fiat Maximalist? Are we seeing a pattern?,0.0,1.0,0.0
2019-01-18 22:50:16,0,1,fbitcoin,"Bitcoin, Ripple, Ethereum, Bitcoin Cash, EOS, Stellar, Litecoin, TRON, Bitcoin SV, Cardano: Price Analysis, Jan. 18",0.0,1.0,0.0
2019-01-17 09:15:17,0,1,CoinPath,"Crypto Rally Fuels Coinbase Rumors, Plus News on Bitcoin, Ripple and XRP, Tron, Ethereum, Stellar and Cardano",0.0,1.0,0.0
2019-01-17 08:24:49,0,1,u_Dronmm,Cardano Price Analysis: ADA Bulls Set for Another Retest of Big Supply Area - BtcIndex,0.0,1.0,0.0
2019-01-20 08:11:32,0,1,thrillerpodcast,"Cardano [ADA]’s Charles Hoskinson: New revamp removes unnecessary rules, simplifies system and gets rid of redundancies",0.0,1.0,0.0
2019-01-19 13:30:53,4,1,Buttcoin,Cardano distributes failure to distribute to the community,0.0,0.68,-0.5106
2019-01-19 11:56:49,25,1,cardano,"If you think Cardano is fine, check this",0.205,0.795,0.2023
2019-01-17 21:39:26,15,1,cardano,People where is the best place to store ADA Cardano do you think,0.259,0.741,0.6369
2019-01-20 21:14:43,0,1,cardano,CARDANO Shelley AMA Updates; XRP Used by 27 Companies; Tron &amp; Kiip Partnership; Debt &amp; Market,0.0,0.857,-0.3612
2019-01-19 19:39:35,20,1,cardano,[In japanese] Cardano is growing into Japan: Interview with the Head of Cardano Japan: Toshi Miyatake,0.102,0.898,0.1779
2019-01-21 15:41:48,0,1,cardano,"(Japan Blockchain Conference) EMURGO will be at Booth 14 at JBC Jan. 30-31! Come learn more about #EMURGO’s mission to drive the adoption of #Cardano. We’ll be at Booth #14, right by the Main Stage entrance. A lot of Team EMURGO will be at JBC, so come on by and say hi if you are attending!",0.0,1.0,0.0
2019-01-21 09:17:15,0,1,ethereumbtctrader,Cardano - sell a bouncehttp://http://bit.ly/2Rn7UX5,0.0,1.0,0.0
2019-01-21 18:53:52,2,1,cardano,End of year crypto roundup: How did Cardano perform in 2018?,0.0,1.0,0.0
2019-01-21 19:03:24,0,1,ethereumbtctrader,Cardano - Sell a bounce ? | Technical analysis By Whaleagent | 8.8.18 | — Steemit,0.0,1.0,0.0
2019-01-21 14:32:18,0,1,CryptoCurrency,Jan 10 Losses Weighing Heavily on Stellar Lumens (XLM) and Cardano (ADA),0.0,0.803,-0.4019
2019-01-16 17:42:12,0,1,cardano,EMURGO: ICYMI: #EMURGO is hiring. EMURGO drives the adoption of #Cardano and adds value to #Ada holders. Check out our careers page for positions available now. RT or tag someone who needs to see this message!,0.071,0.929,0.4003
2019-01-15 07:38:50,0,1,Tronix,"Tron (TRX), Revain (R), and Chainlink (LINK) Are Back, Lead Crypto Bull With Over 8%, 23%, 19% Respectively - Today's Gazette - Cryptocurrency, Bitcoin, Ripple, Tron, Verge, Cardano News",0.085,0.915,0.34
2019-01-16 11:03:57,0,1,u_BCFocusAPI,Cardano [ADA] ranks first among cryptocurrencies in Github activity,0.0,1.0,0.0
2019-01-16 20:01:00,0,1,u_Dronmm,"Cardano, I still believe in you - BtcIndex",0.0,1.0,0.0
2019-01-16 20:15:36,0,1,Cryptochillout,"Bitcoin, Ripple, Ethereum, Bitcoin Cash, EOS, Stellar, Litecoin, Tron, Bitcoin SV, Cardano: Price Analysis, Jan. 16",0.0,1.0,0.0
2019-01-16 09:15:37,18,1,cardano,Vitalik says they should be like Cardano 👏,0.294,0.706,0.3612
2019-01-17 18:00:37,0,1,cryptoall,Will 2019 be the Year of Cardano?,0.0,1.0,0.0
2019-01-17 20:57:23,0,1,u_Dronmm,"Altcoins Daily Preview: Monero (XMR) and Cardano (ADA) Headwinds, Sellers Firm - BtcIndex",0.0,1.0,0.0
2019-01-16 04:06:43,22,1,cardano,Cardano ADA Review by an Ethereum Developer (I dig it),0.0,1.0,0.0
2019-01-18 10:10:25,0,1,fbitcoin,"Cardano Price Analysis: ADA/USD Trends of January 18–24, 2019",0.0,1.0,0.0
2019-01-19 13:46:33,1,1,cardano,Cardano (ADA) Roundup: Upcoming Shelley Upgrade Could Initiate a Strong Price Rally,0.248,0.752,0.5106
2019-01-18 23:14:19,10,1,cardano,Should I sell all my 0.1 Bitcoin for Cardano? Is it worth it?,0.17,0.83,0.3094
2019-01-15 08:31:22,1,1,cardano,"Lots of lowcap coins mentioned, but not Cardano... does nobody know about ADA?",0.0,1.0,0.0
2019-01-15 17:30:36,4,1,cardano,Cardano has great potential,0.577,0.423,0.6249
2019-01-22 00:08:58,1,1,cardano,"The Cardano Effect Episode 15 - Sidechains and Interoperability with Dionysis Zindros is now available on iTunes, Google Play Music, Soundcloud, and Spotify!",0.114,0.886,0.4003
2019-01-22 00:20:28,0,1,CoinPath,"Bitcoin, Ripple, Ethereum, Bitcoin Cash, EOS, Stellar, Litecoin, TRON, Bitcoin SV, Cardano: Price Analysis, Jan. 21",0.0,1.0,0.0
2019-01-21 15:21:32,4,1,cardano,(In Japanese) Good exposure in Japan! Top Japanese crypto influencer Shishin @silverfox789123 published his book and was positive about #Cardano #ADA. He noted Cardano's scientific approach and that some Dapps on Ethereum are considering moving to the Cardano blockchain after mainnet launch.,0.181,0.819,0.8221
2019-01-21 19:52:31,2,1,cardano,The Cardano Effect Episode 15 - Sidechains and Interoperability with Dionysis Zindros,0.0,1.0,0.0
