date,num_comments,score,subreddit,title,pos,neu,compound
2019-03-23 16:58:51,0,1,CryptoCurrency,"Cardano +25% on the weekly with most other coins a few percentage in the red. I thought it was sell the news, buy the rumor. What's with the buying after the news being out?",0.0,1.0,0.0
2019-03-24 07:30:18,0,1,cryptoall,Charles Hoskinson in Hong Kong on the Future of Cardano,0.0,1.0,0.0
2019-03-24 06:39:27,0,1,CryptoICONews,"Cardano, Tron, Ethereum Price Prediction For Next Week: Is Another Long-Term Resistance Approaching - Today's Gazette - Cryptocurrency, Bitcoin, Ripple, Tron, Verge, Cardano News",0.0,1.0,0.0
2019-03-24 08:30:18,0,1,atbitcoin,"Bitcoin Megabulls Call BTC at $100,000 to $400,000 – Plus Ripple and XRP, Ethereum, Tron, Litecoin, Cardano, Stellar",0.0,1.0,0.0
2019-03-25 02:16:30,1,1,cardano,Announcing Plutus Publisher-Subscriber: a way to communicate using Cardano and Plutus Smart Contracts,0.197,0.803,0.4019
2019-03-23 13:56:07,0,1,atbitcoin,"Bitcoin’s Massive Returns in 10 Days – Plus Ripple and XRP, Tron, Ethereum, Litecoin, Stellar, Cardano",0.0,1.0,0.0
2019-04-01 20:19:13,0,1,CryptoTrading24,"Bitcoin, Ethereum, Ripple, EOS, Litecoin, Bitcoin Cash, Binance Coin, Stellar, Cardano, TRON: Price Analysis April 1",0.0,1.0,0.0
2019-04-01 17:16:38,0,1,BitcoinExchangeGuide,"Cardano (ADA) Coin Grows Girthy Gains, But Can It Bully Bitcoin In The Battle Of Blockchain Assets?",0.153,0.532,-0.714
2019-04-01 17:29:13,0,1,cryptobots,Why is Cardano Full of Weird Names? https://goo.gl/rrALrd - Crypto Dynamic Info - Whales's,0.182,0.699,0.2263
2019-04-04 23:48:18,0,1,fbitcoin,"Crypto Analyst Targets Bitcoin (BTC) at $100000 – Plus Ripple and XRP, Litecoin, Ethereum, Tron, Stellar, Cardano - The Daily Hodl",0.0,1.0,0.0
2019-04-03 19:34:23,0,1,CryptoTrading24,"Bitcoin, Ethereum, Ripple, Litecoin, EOS, Bitcoin Cash, Binance Coin, Stellar, Cardano, TRON: Price Analysis April 3",0.0,1.0,0.0
2019-04-05 20:13:53,0,1,CryptoTrading24,"Bitcoin, Ethereum, Ripple, Litecoin, Bitcoin Cash, EOS, Binance Coin, Stellar, Cardano, TRON: Price Analysis April 05",0.0,1.0,0.0
2019-04-06 22:26:34,0,1,BitcoinExchangeGuide,CARDANO Price Prediction: Long-term (ADA) Value Forecast – April 6,0.255,0.745,0.34
2019-04-07 08:22:25,0,1,fbitcoin,"Crypto Trader Predicts Massive Bitcoin (BTC) Surge to $50K – Plus Ripple and XRP, Ethereum, Tron, Litecoin, Stellar, Cardano - The Daily Hodl",0.0,1.0,0.0
2019-04-05 11:05:55,0,1,CryptoMarkets,XRP-Based Trading Pair Launched For Cardano,0.231,0.769,0.128
2019-04-05 04:22:14,0,1,CryptocurrencyICO,Cardano provides new details on how users will earn Ada through staking pools,0.0,1.0,0.0
2019-04-04 03:21:49,0,1,CryptoMarkets,"Cardano (ADA) Price Prediction For April, May And June 2019. Will The Bull Last Till Q3?",0.0,1.0,0.0
2019-04-04 00:33:23,0,1,BitNewsLive,Cardano Price Analysis: ADA/USD surges by 7% and overtakes Stellar in CoinMarketCap,0.0,1.0,0.0
2019-04-04 10:09:25,0,1,Crypto_Daily,New Information Provided On Cardano Staking Pools,0.0,1.0,0.0
2019-04-05 07:47:23,0,1,CryptoMarkets,"Bitcoin (BTC), Tron (TRX), Cardano (ADA) Price Prediction: A Bullish Rally For The Weekend?",0.0,1.0,0.0
2019-04-06 05:13:40,2,1,cardano,"Hi all, can someone summarize usecase of cardano for long term?",0.0,1.0,0.0
2019-04-03 19:25:53,0,1,cryptoall,Cardano Progress Update by Sebastien Guillemot (April 2019),0.286,0.714,0.4215
2019-04-04 17:50:43,0,1,atbitcoin,"Crypto Analyst Targets Bitcoin (BTC) at $100,000 – Plus Ripple and XRP, Litecoin, Ethereum, Tron, Stellar, Cardano",0.0,1.0,0.0
2019-04-06 12:07:45,0,1,atbitcoin,"Crypto Bear Says Bitcoin (BTC) Poised for Parabolic Bull Run – Plus Ripple and XRP, Ethereum, Tron, EOS, Litecoin, Cardano, Dash, IOTA",0.091,0.909,0.25
2019-04-06 10:38:27,0,1,cryptonewswire,"Crypto Bear Says Bitcoin (BTC) Poised for Parabolic Bull Run – Plus Ripple and XRP, Ethereum, Tron, EOS, Litecoin, Cardano, Dash, IOTA - The Daily Hodl",0.08,0.92,0.25
2019-04-07 04:38:32,2,1,cardano,Cardano Stake Pool Desirability Estimation,0.0,1.0,0.0
2019-04-01 13:39:21,0,1,cardano,Cardano can now be bought on the instant exchange flyp.me,0.0,1.0,0.0
2019-04-02 21:05:59,0,1,BeInCrypto,How Long Will the Cardano Bulls Last? (ADA/USD Monthly Price Predictions: April 2019),0.0,1.0,0.0
2019-04-02 23:10:53,0,1,CryptocurrencyVideos,"Bitcoin ETF Delays, FaceCoin Tracking, Future Of Cardano, DASH Price Jump &amp; AltCoin Season",0.0,1.0,0.0
2019-04-01 16:07:27,0,1,cryptonewswire,"Crypto Analyst DataDash Says Bitcoin (BTC) Poised for Big Move – Plus Ripple and XRP, Ethereum, Tron, Litecoin, EOS, Stellar, Cardano - The Daily Hodl",0.083,0.917,0.25
2019-04-01 16:44:19,0,1,atbitcoin,"Crypto Analyst DataDash Says Bitcoin (BTC) Poised for Big Move – Plus Ripple and XRP, Ethereum, Tron, Litecoin, EOS, Stellar, Cardano",0.095,0.905,0.25
2019-04-02 17:58:34,0,1,uncensorship,"What is the size of Tezzos global Developers community? How is it in comparison with Ethereum, Cardano and EOS communities?",0.0,1.0,0.0
2019-04-04 04:58:42,2,1,CardanoCoin,Q2 2019: CARDANO (ADA),0.0,1.0,0.0
2019-04-03 06:17:23,0,1,Cryptochillout,"Ripple Joins IOTA, SWIFT, Cardano and Others to Propel Blockchain and Crypto Adoption",0.174,0.826,0.368
2019-04-03 21:52:36,5,1,noncensored_bitcoin,[uncensored-r/CryptoCurrency] Cardano has a marketcap of $2.5 billion and 8th biggest cryptocurrency without a fully functional...,0.0,1.0,0.0
2019-04-05 12:05:13,0,1,cardano,Cardano Blackboard Series #4: What is the transaction assurance level?,0.211,0.789,0.34
2019-04-05 19:32:39,0,1,BeInCrypto,(ADA) Cardano Price Prediction and Forecast 2019 / 2020 (New Updates: 04/05/19): Is ADA/USD Going to the Moon?,0.0,1.0,0.0
2019-04-07 13:53:06,0,1,coinatory,Flyp.me accountless exchanger adds Cardano (ADA) to growing list of cryptocurrencies,0.145,0.855,0.1779
2019-04-01 20:23:34,0,1,cryptobots,"Bitcoin, Ethereum, Ripple, EOS, Litecoin, Bitcoin Cash, Binance Coin, Stellar, Cardano, TRON: Price Analysis April 1 https://goo.gl/vtPjRE - Crypto Dynamic Info - Whales's",0.12,0.88,0.3818
2019-04-02 13:31:57,0,1,thrillerpodcast,CARDANO (ADA) Long-term Price Analysis- April 2,0.0,1.0,0.0
2019-04-05 16:24:07,1,1,cardano,Legal Contracts on Cardano?,0.333,0.667,0.128
2019-04-05 09:06:04,0,1,cryptoall,Cardano provides update on how to earn ADA through staking pools,0.0,1.0,0.0
2019-04-06 08:55:10,2,1,CryptoCurrency,"Looking for a safe mobile wallet for Cardano, Stellar, and Ripple",0.244,0.756,0.4404
2019-04-07 15:12:47,2,1,cardano,"When they say that Cardano is delaying to be built, I can only remember this little story",0.0,1.0,0.0
2019-04-03 13:06:02,0,1,BeInCrypto,(ADA) Cardano Price Prediction and Forecast 2019 / 2020 (New Updates: 04.03.2019): Cardano Following Bitcoin to New Heights?,0.0,1.0,0.0
2019-04-03 14:30:04,1,1,cardano,CARDANO (ADA) My Investment Position,0.0,1.0,0.0
2019-04-03 15:50:36,0,1,cardano,Bitcoin Broke Through 5k while Cardano surges | Could This Really Be A BULLRUN?,0.0,0.797,-0.4215
2019-04-03 16:46:26,0,1,CryptocurrencyVideos,Emurgo Teases CARDANO Ledger Wallet Integration,0.0,0.694,-0.296
2019-04-04 13:40:18,1,1,cardano,Cardano CEO: Not About Who's First to Market; South Africa Ripple Partner; Market Rally,0.0,1.0,0.0
2019-04-04 00:23:20,4,1,EnigmaProject,Any plans to use cardano under the hood?,0.0,1.0,0.0
2019-04-01 18:27:15,0,1,fbitcoin,"Cardano (ADA) Coin Grows Girthy Gains, But Can It Bully Bitcoin In The Battle Of Blockchain Assets? - Bitcoin Exchange Guide",0.137,0.583,-0.714
2019-04-01 21:11:58,0,1,BeInCrypto,"Cardano Outperforms Bitcoin, XRP, and Stellar Lumens! (ADA/USD Monthly Price Analysis: March 2019)",0.0,1.0,0.0
2019-04-01 09:37:23,0,1,fbitcoin,Forbes Article Says Cardano ADA Is A Bitcoin Rival - Is There a Chance For Cardano To Seriously Threaten Bitcoin? - Invest In Blockchain,0.086,0.73,-0.3182
2019-04-04 11:33:18,0,1,cryptoall,Cardano (ADA) Overtakes Tether (USDT) and Stellar Lumens (XLM) to Become Eighth Largest Crypto,0.0,1.0,0.0
2019-04-02 22:40:15,0,1,BitNewsLive,"Meet INATBA: A super team of Ripple, IOTA, Cardano, Consensys, R3, and others.",0.262,0.738,0.5994
2019-04-03 21:48:51,2,1,cardano,(ADA) Cardano Price Forecast and Forecast 2019/2020 (new updates: 04.03.2019): Cardano follows Bitcoin to new heights?,0.0,1.0,0.0
2019-04-04 15:17:06,0,1,CryptoStock,"Research: Current Surge Can Push Bitcoin Price Above Competitors in a Decade - Today's Gazette - Cryptocurrency, Bitcoin, Ripple, Tron, Verge, Cardano News",0.0,1.0,0.0
2019-04-02 11:14:19,0,1,stubfeed,"Ripple Teams Up With IOTA, Cardano, SWIFT ... New publication in StubFeed.com/crypto from oracletimes.com Come to see more... stubfeed.com • #stubfeed #stubfeedcrypto #crypto #cryptocurrency #latest #news #ripple #iota #swift #teams #with #more #boost #blockchain #drive #adoption #makes #another",0.066,0.934,0.368
2019-04-05 16:31:44,0,1,cryptoall,Blockchain - Africa Rising (Cardano); SEC Publishes Guidance Framework; Hypocritical Coinbase,0.0,0.75,-0.4588
2019-04-04 16:14:29,0,1,bitnewsbot,"Ledger adds support for Cardano, what took it so long?",0.231,0.769,0.4019
2019-04-11 13:08:26,0,1,CardanoCoin,"Cardano Founder Criticizes Ethereum and EOS Leadership: “Nothing Gets Done That Way"".",0.0,0.821,-0.34
2019-04-11 21:06:34,0,1,thrillerpodcast,"Cardano [ADA]: Proof of Stake [PoS] throws away expensive process &amp; advances the network, says Charles Hoskinson",0.0,1.0,0.0
2019-04-12 08:34:16,2,1,cardano,I have a few questions about Cardano coins.,0.0,1.0,0.0
2019-04-12 13:03:53,0,1,cardano,Cryptotown.io - Cardano Predictions,0.0,1.0,0.0
2019-04-12 13:35:20,0,1,CryptoCurrencies,Hoskinson Talks About The Future of Cardano,0.0,1.0,0.0
2019-04-10 08:04:09,0,1,fbitcoin,"EOS Founder Says Bitcoin (BTC) Will Beat $8 Trillion Gold – Plus Ripple and XRP, Ethereum, Litecoin, Cardano - The Daily Hodl",0.0,1.0,0.0
2019-04-11 11:08:32,0,1,BeInCrypto,(ADA) Cardano Price Prediction and Forecast 2019 / 2020 (New Updates: 04/11/19): ADA/USD,0.0,1.0,0.0
2019-04-10 22:16:42,0,1,BestBitcoinNews,Cardano Outperforming Rivals as Development Moves Forward,0.0,1.0,0.0
2019-04-10 19:39:23,0,1,fbitcoin,"Bitcoin, Ethereum, Ripple, Litecoin, Bitcoin Cash, EOS, Binance Coin, Stellar, Cardano, TRON: Price Analysis April 10",0.0,1.0,0.0
2019-04-08 19:13:06,0,1,fbitcoin,"Bitcoin, Ethereum, Ripple, Litecoin, Bitcoin Cash, EOS, Binance Coin, Stellar, Cardano, TRON: Price Analysis April 8",0.0,1.0,0.0
2019-04-08 12:32:19,0,1,AllThingsCrypto,Cardano Price Momentum Breaks Down as Losses Pile up,0.0,0.748,-0.4019
2019-04-09 01:08:27,0,1,BeInCrypto,(ADA) Cardano Price Prediction and Forecast 2019 / 2020 (New Updates: 04/08/19): ADA/USD Likely To See Gains,0.138,0.862,0.34
2019-04-10 01:23:10,0,1,CryptocurrencyVideos,"Cardano, What The Future Holds; Yahoo! Japan Crypto Exchange; Twitch Drops Bitcoin",0.0,1.0,0.0
2019-04-09 19:41:23,0,1,CryptoStock,Cardano CEO is all set to achieve the Perfect project goal - Hackerpost,0.252,0.748,0.5719
2019-04-13 05:08:45,2,1,cardano,"For a company built peer-reviewed science for technology, it’s surprising Cardano doesn’t take the same approach for marketing…",0.116,0.884,0.2732
2019-04-12 18:15:54,1,1,ethereum,"Charles Hoskinson, Cardano - Don't You Know Who I am",0.0,1.0,0.0
2019-04-08 08:20:27,0,1,cryptonewswire,"Crypto Analyst Says Bitcoin (BTC) Whales Are Back – Plus Ripple and XRP, Tron, Litecoin, Ethereum, Cardano, Stellar - The Daily Hodl",0.0,1.0,0.0
2019-04-08 23:08:17,0,1,fbitcoin,"Bitcoin Cash [BCH], Cardano [ADA] and Litecoin [LTC] fall by over 5% as market correction ensues - AMBCrypto News",0.0,1.0,0.0
2019-04-09 22:34:02,3,1,cardano,Cardano has broken out of a really good structure. It is already up more than 100% so might see a bigger pullback but it can continue to go higher. Watch the video to find out some of my targets. Comment Below your thoughts on ADA...,0.046,0.908,0.012
2019-04-09 06:14:19,0,1,CryptoCurrency,"Crypto Market In Corrective Decrease: Bitcoin Cash, Tron (TRX), XLM, ADA Analysis @newsbtc #Analysis #Technical #ADA #BCH #Bitcoin Cash #btc #Cardano #stellar #TRON #TRX #XLM",0.0,1.0,0.0
2019-04-10 00:16:24,0,1,bitnewsbot,Cardano approaches major upgrade with version 1.5,0.0,1.0,0.0
2019-04-09 15:49:00,0,1,BitNewsLive,Cardano Founder Charles Hoskinson Takes Aim at Ethereum and EOS,0.0,1.0,0.0
2019-04-14 07:18:48,0,1,CardanoSales,Cardano Sales link to Telegram group,0.0,1.0,0.0
2019-04-15 02:41:24,2,1,cardano,New to Cardano. Can someone explain Shelley?,0.0,1.0,0.0
2019-04-14 17:00:01,0,1,BitcoinAll,CARDANO: Most Decentralized Blockchain by 2020; A.I. &amp; Robotics Taking Over Jobs /r/BitcoinBeginners,0.0,1.0,0.0
2019-04-14 16:57:37,0,1,CardanoCoin,CARDANO: Most Decentralized Blockchain by 2020; A.I. &amp; Robotics Taking Over Jobs,0.0,1.0,0.0
2019-04-12 18:49:15,0,1,Cryptochillout,"Bitcoin, Ethereum, Ripple, Litecoin, EOS, Bitcoin Cash, Binance Coin, Stellar, Cardano, TRON: Price Analysis April 12",0.0,1.0,0.0
2019-04-10 21:57:25,0,1,BitNewsLive,Cardano Price Continues Push to $0.1 Without Much Resistance,0.0,1.0,0.0
2019-04-10 12:21:59,1,1,cardano,IOHK/Charles Hoskinson to continue with Cardano until at least 2020 but then what?,0.0,1.0,0.0
2019-04-11 04:45:25,0,1,altcoin_news,"Incredible Panel with EOS VC, Cardano, Neo, Ontology and SVK Crypto at Token2049",0.0,1.0,0.0
2019-04-10 19:08:17,0,1,BeInCrypto,Will Cardano Rise to Reach $0.1 Again? (ADA/USD Price Prediction for 04/10/2019),0.091,0.909,0.0258
2019-04-11 00:37:03,0,1,noncensored_bitcoin,"[uncensored-r/CryptoCurrency] Hot babe using ADA card live, and giving her feedback, BULLISH ON CARDANO! 30,000+ stores in Sout...",0.137,0.863,0.4003
2019-04-11 10:45:05,4,1,cardano,TOKEN2049 - The Path Ahead - Charles Hoskinson (Cardano),0.0,1.0,0.0
2019-04-13 14:38:16,0,1,BitcoinExchangeGuide,CARDANO Price Prediction: Long-term (ADA) Value Forecast – April 13,0.231,0.769,0.34
2019-04-10 19:25:03,0,1,CryptoCurrency,Who else bought some cardano before the recent bullish trends?,0.0,1.0,0.0
2019-04-08 07:59:03,1,1,cardano,ADABTC - Break down support | Cardano news,0.351,0.649,0.4019
2019-04-08 23:09:00,0,1,BeInCrypto,Will Cardano Reclaim Highs Over $0.1 This Week? (ADA/USD Price Prediction: 04/08/19),0.0,1.0,0.0
2019-04-08 18:45:22,0,1,cryptoeconomynet,Why Cardano [ADA] Need Two Hardforks to Upgrade Its Ecosystem to Shelley?,0.0,1.0,0.0
2019-04-09 21:57:19,0,1,Stellar,"Litecoin (LTC), Stellar (XLM), Cardano (ADA) Price Prediction for Week 15 and 16: A Strong Bull to Be Maintained",0.163,0.837,0.5106
2019-04-12 18:06:30,11,2,eos,"Sure it's not eos but it sure is funny - Charles Hoskinson, Cardano - Don't You Know Who I am",0.376,0.624,0.8151
2019-04-12 16:10:06,0,2,cardano,The Cardano Update Mechanism. - Brunch Pool,0.0,1.0,0.0
2019-04-10 21:19:07,3,2,cardano,Cardano wallet on Linux,0.0,1.0,0.0
2019-04-08 16:00:54,1,2,cardano,Understanding cardano and peer review,0.0,1.0,0.0
2019-04-08 08:00:31,0,3,cardano,$ADA 1D FYI this pattern leads to bul | Cardano news,0.22,0.78,0.368
2019-04-14 22:01:38,0,3,CardanoMarkets,CARDANO PRICE RUN ISN’T OVER YET,0.0,1.0,0.0
2019-04-09 23:56:12,1,3,cardano,"The pamp will coincide with the Cardano Summit, making it an optimal time to travel to the moon. He's left us with this chart to show the way.",0.085,0.915,0.3612
2019-04-11 07:29:32,1,3,cardano,Have you seen the Cardano Community Code of Conduct? This code applies to all of our official community channels and helps us keep a safe and welcoming space for Cardano community members to come together.,0.213,0.787,0.8126
2019-04-13 09:38:03,3,4,cardano,"Why IOTA (MIOTA), Cardano (ADA) Will Stay Steadfast Among Top 10 in 2019",0.257,0.743,0.4215
2019-04-10 10:58:27,11,5,eos,"Charles Hoskinson was trash talking EOS saying ""nothing is getting done"" - Cardano Epic Fail",0.0,0.788,-0.5423
2019-04-09 14:03:05,2,9,cardano,"EMURGO: Wondering what EMURGO looks for when taking an Advisory or Investment role in a blockchain company or project? Watch EMURGO's CIO Manmeet Singh as he covers the Investment and Consulting side of EMURGO, the official commercial arm of Cardano",0.0,1.0,0.0
2019-04-15 22:03:46,0,1,ICOinfo,"Bitcoin, Ethereum, Ripple, Bitcoin Cash, Litecoin, EOS, Binance Coin, Stellar, Cardano, TRON: Price Analysis April 15",0.0,1.0,0.0
2019-04-15 15:39:28,0,1,cryptoall,What Happens With Cardano?,0.0,1.0,0.0
2019-04-15 23:10:52,2,1,CryptoCurrency,Cardano Explained in 12 Minutes,0.0,1.0,0.0
2019-04-16 21:42:27,0,1,BlockChain,Cardano (ADA) Explained in 12 Minutes,0.0,1.0,0.0
2019-04-16 04:49:05,0,1,cardano,Cardano (ADA) Explained in 12 Minutes - Ultimate Review,0.0,1.0,0.0
2019-04-17 22:52:42,0,1,Crypto_Currency_News,"Bitcoin, Ethereum, Ripple, Bitcoin Cash, EOS, Litecoin, Binance Coin, Stellar, Cardano, TRON: Price Analysis April 17",0.0,1.0,0.0
2019-04-17 13:29:26,2,1,cardano,Seriously Cardano? Only a $300 Cash Price for the winner of the Miami Hackaton? Is this a joke?,0.318,0.604,0.7303
2019-04-18 05:03:48,0,1,WorldWeeklyNews1,Cardano (ADA)CEO Charles Hoskinson has announced the completion of a significant roadmap goal.,0.141,0.859,0.2023
2019-04-17 20:13:18,0,1,cryptocurrencytopnews,Major Milestone for Cryptocurrency Cardano ADA With the Upgrade “Shelley”,0.0,1.0,0.0
2019-04-17 13:23:25,0,1,altcoin,"Cardano (ADA) Security Levels Up With Bitcoin’s PoW Protocol, Courtesy Of Latest Upgrade",0.308,0.692,0.5994
2019-04-17 20:51:10,0,1,LunarCRUSH,‪Cardano is today’s Coin of the Day. Access all collected data + Galaxy Score at https://lunarcrush.com/coins/ada/cardano/insights.‬,0.0,1.0,0.0
2019-04-18 22:19:56,1,1,cardano,Most of the Cardano team at the IOHK Summit 2019 in Miami,0.0,1.0,0.0
2019-04-20 11:10:49,0,1,CryptoCurrency,Cardano ADA Staking Pool... But ADA will still be?,0.0,1.0,0.0
2019-04-20 11:31:28,1,1,cardano,Cardano Price Prediction : (ADA) Price Expected to Surge With the Upgrade “Shelley”,0.0,1.0,0.0
2019-04-20 17:59:08,0,1,cryptonewswire,"Crypto Trader's Bullish Bitcoin (BTC) Call Goes Viral – Plus Ripple and XRP, Ethereum, Tron, Litecoin, Stellar, Cardano - The Daily Hodl",0.0,1.0,0.0
2019-04-19 19:16:43,0,1,cryptocurrencytopnews,"Bitcoin, Ethereum, Ripple, Bitcoin Cash, Litecoin, EOS, Binance Coin, Stellar, Cardano, TRON: Price Analysis April 19",0.0,1.0,0.0
2019-04-19 10:32:50,0,1,Tronix,"Now that project CARDANO is officially dead, will the TRON community take me back?",0.0,0.751,-0.6486
2019-04-19 10:39:02,0,1,altcoin,Cardano is now available to buy at ICONOMI!,0.0,1.0,0.0
2019-04-18 12:47:55,0,1,fbitcoin,"Cardano Moves Closer to Full Decentralization, Completes ‘Shelley’ Upgrade",0.0,1.0,0.0
2019-04-20 10:17:42,2,1,cardano,"Scatter connects you to Cardano in a simple and straightforward package. It is internationalized, sleek, and powerful.",0.157,0.843,0.4215
2019-04-21 13:07:57,1,1,noncensored_bitcoin,[uncensored-r/CryptoCurrency] Iota and cardano the future of blockchain? A view from weiss analysis,0.0,1.0,0.0
2019-04-21 21:19:36,1,1,cardano,Cardano Stake Pool Desirability Estimation,0.0,1.0,0.0
2019-04-16 20:33:04,0,1,tribetica,Will Cardano (ADA) Rally Above 9.5 Cents? Fireworks After Goguen,0.0,1.0,0.0
2019-04-16 18:39:25,0,1,algotrading,"Bitcoin (BTC), XRP, Tron (TRX) Price Prediction for 2019/2020: Aroon Indicator Says The Bear Is At The Bottom - Today's Gazette - Cryptocurrency, Bitcoin, Ripple, Tron, Verge, Cardano News",0.0,1.0,0.0
2019-04-16 18:08:46,0,1,cryptoall,Cardano (ADA) Perfectly Placed to challenge Tron (TRX) and Ethereum (ETH) dominance in Smart Contracts.,0.476,0.524,0.8402
2019-04-17 11:36:27,2,1,cardano,Cardano Price Analysis: $0.088 Resistance Is the Target for ADA Bulls,0.0,1.0,0.0
2019-04-18 14:22:28,2,1,cardano,Cardano ADA is UNSTOPPABLE and ready to MOON!!,0.215,0.516,-0.1573
2019-04-20 11:01:49,1,1,cardano,How do you think of investing (buying) on Cardano at this time?,0.0,1.0,0.0
2019-04-21 13:09:31,0,1,CryptoCurrency,Echo chamber subreddits: Maker and Cardano,0.0,1.0,0.0
2019-04-20 19:37:04,0,1,BitcoinExchangeGuide,CARDANO Price Prediction: Long-term (ADA) Value Forecast – April 20,0.231,0.769,0.34
2019-04-21 20:12:14,3,1,cardano,Is Cardano immune from competition?,0.355,0.645,0.296
2019-04-21 22:12:13,16,1,cardano,Cardano Puzzle #1 | by Ruslan,0.0,1.0,0.0
2019-04-15 16:24:10,0,1,cryptoall,Cardano (ADA) Technical Analysis: Will ADA Move Ahead of IOHK Summit?,0.0,1.0,0.0
2019-04-16 19:44:22,0,1,atbitcoin,"Massive $1 Million Bitcoin (BTC) Bounty Revealed – Plus Ripple and XRP, Ethereum, Tron, Litecoin, Cardano, IOTA",0.0,1.0,0.0
2019-04-17 01:29:02,0,1,BitcoinAll,"Massive $1 Million Bitcoin (BTC) Bounty Revealed Plus Ripple and XRP, Ethereum, Tron, Litecoin, Cardano, IOTA",0.0,1.0,0.0
2019-04-18 16:03:49,1,1,CryptoCurrency,"Best cryptocurrency to HODL in 2019 in my opinion, the most important things you need to know about it, best exchanges, best wallets, real-time price widget, and a few use cases. https://cryptosignal.rocks/cardano/",0.352,0.648,0.9402
2019-04-19 17:13:28,0,1,EximChain,"No update anymore, yoosourcing partnership gone to cardano hopeless MIA",0.0,0.463,-0.7983
2019-04-19 11:02:52,0,1,AllThingsCrypto,Cardano Price Hits a Roadblock as Value Drops Below $0.08,0.231,0.769,0.34
2019-04-17 16:54:59,0,1,tribetica,Major Cardano (ADA) Milestone: How Shelley Improves Stability and Decentralization,0.237,0.763,0.4215
2019-04-18 05:01:10,0,1,u_Cbanx_CryptoExchange,Check Out The Cardano Price &amp; Start Trading It On CBANX.com!,0.0,1.0,0.0
2019-04-17 11:06:54,0,1,CardanoCoin,Cardano Founder Charles Hoskinson: ‘The Soul of Shelley Is Out’,0.0,1.0,0.0
2019-04-17 21:15:47,0,1,TrendsProject,Cardano debuts IOHK Summit in Miami as new Shelley specifications released,0.0,1.0,0.0
2019-04-18 23:37:11,0,1,BitcoinExchangeGuide,EMURGO Showcases Its Brand New Blockchain Explorer Based on Cardano,0.0,1.0,0.0
2019-04-19 03:18:49,9,1,cardano,Cardano development to 2020 funded - but delays out the wazoo...,0.0,1.0,0.0
2019-04-15 21:18:34,0,1,BeInCrypto,Higher Highs May In Store for a Bullish Cardano (ADA/USD Price Prediction: 04/15/2019),0.0,1.0,0.0
2019-04-16 02:45:49,0,1,CryptoCurrencies,"Bitcoin, Ethereum, Ripple, Bitcoin Cash, Litecoin, EOS, Binance Coin, Stellar, Cardano, TRON: Price Analysis April 15 http://dlvr.it/R2tBb1 #Bitcoin #Ethereum $Cryptopic.twitter.com/qdgnNIc4D7",0.0,1.0,0.0
2019-04-15 09:55:16,0,1,u_amuseworld,"System extensibility is too low in Bitcoin and Ether, said founder of Cardano.",0.0,0.851,-0.2732
2019-04-16 11:17:08,0,1,BeInCrypto,(ADA) Cardano Price Prediction and Forecast 2019 / 2020 (Updated 04/16/19): ADA/USD,0.0,1.0,0.0
2019-04-21 06:09:26,0,1,altcoin_news,"Serena Williams Invests in Cryptocurrency Exchange Coinbase. What Does this Mean to Global Adoption? - Today's Gazette - Cryptocurrency, Bitcoin, Ripple, Tron, Verge, Cardano News",0.0,1.0,0.0
2019-04-18 03:36:09,0,1,BeInCrypto,(ADA) Cardano Price Prediction and Forecast 2019 / 2020 (Updated 04/17/19): ADA/USD Falling Toward Support,0.166,0.736,0.2732
2019-04-17 10:31:38,0,1,BitcoinExchangeGuide,CARDANO Price Prediction Today: Daily (ADA) Value Forecast – April 17,0.211,0.789,0.34
2019-04-21 06:56:56,1,1,cardano,Cardano going to jump up to 300% this year keep hold! watch Trading Charts / Trading Signals ofor Cardano,0.0,1.0,0.0
2019-04-17 19:37:14,0,1,BeInCrypto,Will The Price of Cardano Drop Below $0.08? (ADA/USD Price Prediction: 04/17/2019),0.0,0.84,-0.2732
2019-04-19 06:25:06,0,1,ProBitcointrading,Cardano Price Analysis: ADA/USD Remains in Range above...,0.0,1.0,0.0
2019-04-22 22:52:56,0,1,BitNewsLive,Cardano ADA/USD Returning to $0.0800: Going for Stellar XLM Position after Reaching $2 bln market cap,0.107,0.893,0.2023
2019-04-23 04:53:23,0,1,BlockChain,"Crypto Market, Bitcoin Surging: Bitcoin Cash, ADA, Litecoin (LTC), TRX Analysis @newsbtc #Analysis #Technical #ADA #BCH #Bitcoin Cash #btc #Cardano #Litecoin #ltc #TRON",0.0,1.0,0.0
2019-04-23 10:27:17,0,1,CoinPath,"Bitcoin Cash [BCH], Cardano [ADA] and Tezos [XTZ] Becomes Top Gainers to Jump on New Highs",0.107,0.893,0.2023
2019-04-23 10:31:42,2,1,cardano,Cardano (ADA) Price Prediction : The Price of Cardano (ADA) Surge by 9% in 24 Hours,0.0,1.0,0.0
2019-04-23 12:01:17,0,1,cryptoeconomynet,Cardano [ADA] Ethiopia Sign an MOU with Charles Hoskinson to Develop a Digital Payment Platform,0.0,1.0,0.0
2019-04-24 00:00:39,0,1,BeInCrypto,(ADA) Cardano Price Prediction and Forecast 2019 / 2020 (Updated 04/23/19): ADA/USD Dropping to Support?,0.172,0.828,0.4019
2019-04-22 15:30:43,0,1,u_diversecrypto,"Cardano Weekly Discussion - April 22, 2019",0.0,1.0,0.0
2019-04-22 18:59:09,0,1,CryptoTrading24,"Bitcoin, Ethereum, Ripple, Bitcoin Cash, EOS, Litecoin, Binance Coin, Stellar, Cardano, TRON: Price Analysis April 22",0.0,1.0,0.0
2019-04-22 11:37:09,0,1,AllThingsCrypto,Cardano Price Rebounds Strongly After Weekend Dip,0.259,0.741,0.2732
2019-04-29 22:44:32,0,1,CryptoCurrencyTrading,"Bitcoin, Ethereum, Ripple, Bitcoin Cash, Litecoin, EOS, Binance Coin, Stellar, Cardano, TRON: Price Forecast",0.0,1.0,0.0
2019-04-30 08:22:08,0,1,CoinPath,"Top losers: IOTA falls by 7% as Jaguar integration hype fades; Bitcoin Cash [BCH], BNB and Cardano follow suit",0.081,0.766,-0.3818
2019-05-01 02:09:01,0,1,CryptoCurrency,What Makes Cardano A Third Generation Blockchain,0.0,1.0,0.0
2019-04-30 17:10:50,1,1,cardano,A Sobering Reality for Cardano Stake Pool Operators &amp; Owners,0.0,0.816,-0.2023
2019-04-29 19:17:53,0,1,BitNewsLive,"Bitcoin, Ethereum, Ripple, Bitcoin Cash, Litecoin, EOS, Binance Coin, Stellar, Cardano, TRON: Price Analysis April 29",0.0,1.0,0.0
2019-04-29 19:19:20,0,1,CryptoStock,"Scammers Haunt Tron (TRX) Network With Fake Liverpool Partnership Invitation - Today's Gazette - Cryptocurrency, Bitcoin, Ripple, Tron, Verge, Cardano News",0.0,0.746,-0.7003
2019-04-29 19:49:55,0,1,fbitcoin,"Binance Reveals Bitcoin and Crypto Correlations – BTC, Ethereum, XRP, Litecoin, EOS, Bitcoin Cash, Binance Coin, Stellar, Tron, Cardano - The Daily Hodl",0.0,1.0,0.0
