date,num_comments,score,subreddit,title,pos,neu,compound
2018-09-09 12:05:17,0,1,Crypto_Currency_News,"Bitcoin, Ethereum, Ripple, Bitcoin Cash, EOS, Stellar, Litecoin, Cardano, Monero, IOTA: Price Analysis.",0.0,1.0,0.0
2018-09-09 12:07:23,0,1,cryptoall,Ethereum Crash: ETH Breaks Down Below $200 on ICO Selling Spree,0.0,0.787,-0.4019
2018-09-09 11:23:22,0,1,CryptoCurrency,"Bitcoin, Ethereum, Ripple Price Analysis for the Week August 27 to September 02",0.0,1.0,0.0
2018-09-09 11:27:54,0,1,cryptobots,Ethereum (ETH) Has A Bright Future According To Morgan Creek Ca... #bitcoin #ethereum #crypto Mark Yusko… https://t.co/nS4lsF9ROp - Crypto Insider Info - Whales's,0.132,0.868,0.4404
2018-09-10 05:18:22,0,1,CryptoStock,"Ethereum (ETH) Continues To Underperform, Are ICOs To Blame? - Ethereum World News",0.0,0.821,-0.34
2018-09-10 05:35:25,0,1,cryptobots,Quantstamp Betanet is Live on Ethereum Mainnet #bitcoin #altcoins #fintech News https://t.co/nhqvpz9GiM - Crypto Insider Info - Whales's,0.0,1.0,0.0
2018-09-10 03:17:19,0,1,cryptobots,Palazzo in Malta Valued at $3m Can Only be Paid for With Bitcoi... #blockchain #ethereum #crypto bitcoin… https://t.co/hVYeWw090o - Crypto Insider Info - Whales's,0.121,0.879,0.4404
2018-09-10 04:18:30,0,1,ethereum,Ethereum Obscurest Art,0.0,1.0,0.0
2018-09-10 04:22:24,0,1,MOAC,Ugoyoung7@gmail.com+ The Mother Of All Chains (MOAC) Is The Infrastructure Blockchain That Can Outperform EthereUM,0.0,1.0,0.0
2018-09-10 02:55:21,0,1,ethereum,"Ethereum Whitepaper, explained (Part 1)",0.0,1.0,0.0
2018-09-10 03:00:14,0,1,cryptobots,Ethereum Price Forecast: Ether Vulnerable Below $200 #eth #altcoin #fintech ETH/USD Forecast https://t.co/6VHDvo8zXm - Crypto Insider Info - Whales's,0.0,0.894,-0.2263
2018-09-09 04:33:27,0,1,atbitcoin,"The Ledger: Goldman’s Bitcoin Fake-Out, Elon Musk High on Ethereum, Tezos Gets Gaming",0.0,1.0,0.0
2018-09-09 04:17:25,0,1,ICOAnalysis,"Recap: Organising the Jakarta Blockchain Meetup, hosted by Ethereum Indonesia • r/swipecrypto",0.0,1.0,0.0
2018-09-09 06:38:44,0,1,cryptobots,Should I buy Ethereum now? #ethereum #altcoin #ico september https://t.co/CUG7mGlNYh - Crypto Insider Info - Whales's,0.0,1.0,0.0
2018-09-09 05:52:50,0,1,ethtrader,Ethereum Price Weekly Analysis: ETH/USD Remains Sell on Rallies,0.0,1.0,0.0
2018-09-09 20:34:56,0,1,ICOCryptoInfo,Twogap platform is Dapp base on Ethereum blockchain infrastructure. TGT token is ERC20 token. It is good that the team chose ERC20 platform for their coin. #ico #Tgt #TwoGap #eth https://twogap.com/,0.088,0.912,0.4404
2018-09-09 20:37:57,0,1,noncensored_bitcoin,[uncensored-r/CryptoCurrency] top ethereum dapps by the number of daily active users,0.42,0.58,0.5859
2018-09-14 18:58:58,0,1,cryptobots,CryptoCann Report: IBM to set up blockchain project dir... #bitcoin #ethereum #altcoins blockchaproject… https://t.co/0MaDv5rfsT - Crypto Insider Info - Whales's,0.0,1.0,0.0
2018-09-15 02:20:40,0,1,ethereum,Schedule Your Ethereum Transactions Now On MyCrypto,0.0,1.0,0.0
2018-09-15 02:33:42,0,1,u_SludgeFeed,EOS Surpasses Ethereum in Daily DApp Users and Transaction Volume,0.0,1.0,0.0
2018-09-17 03:20:41,0,1,u_ffersondeborahje,Boldman Capital Airdrop - Earn Ethereum Every Month,0.0,1.0,0.0
2018-09-17 02:12:58,0,1,u_patroypatterson,"CoTrader sets $3M hardcap for its live blockchain Uber of Hedge Funds, Democratizing the $85 Trillion Investment Funds Industry On Ethereum",0.0,1.0,0.0
2018-09-15 15:19:57,0,1,u_Logan_Ward,Google Adds Ethereum Blockchain Dataset to Its Big Data Analytics Platform,0.0,1.0,0.0
2018-09-15 18:18:24,0,1,cryptoall,"Crypto Markets Recover Slightly, Ethereum, Tezos See Largest Gains",0.231,0.769,0.34
2018-10-01 00:01:16,1,1,noncensored_bitcoin,"[uncensored-r/CryptoCurrency] Chinese Bitcoin Billionaire Unexpectedly Exits Crypto Industry, Controversy Ensues - Ethereum Wor...",0.0,1.0,0.0
2018-10-01 01:40:16,0,1,CryptoNewsandTalk,"""Cryptocurrencies Are The Inevitable Future of Money,"" Malta Says At The U.N General Assembly - Ethereum World News",0.0,1.0,0.0
2018-10-01 01:14:29,0,1,CryptoNewsandTalk,Ethereum (ETH) and Ripple (XRP) Jockey for 2nd Place - Less than 3% Market Cap Difference • Live Bitcoin News,0.0,1.0,0.0
2018-10-01 02:49:47,0,1,Crypto_General,"KuCoin - Bitcoin Exchange: Bitcoin, Ethereum, Litecoin, KCS",0.0,1.0,0.0
2018-09-28 16:10:27,0,1,u_Bitcoin-ETH,Buy Bitcoin (BTC) &amp; ETHEREUM (ETH) With Credit Card Instantly,0.224,0.776,0.3818
2018-09-28 13:52:22,1,1,u_DeanShiers,Market Rebounds: Ethereum Soars,0.0,1.0,0.0
2018-09-29 10:03:09,0,1,cryptoall,Why would anyone want to buy old empty Ethereum wallets?,0.117,0.721,-0.128
2018-09-29 09:19:10,0,1,newsbotTMT,@TheNextWeb: Opera rolls out its Ethereum-based desktop browser (but only to testers) https://t.co/u2ruRV5ZNv,0.0,1.0,0.0
2018-09-29 14:59:03,0,1,Bitcoin,"Bitcoin, Ethereum, Ripple, and Bitcoin Cash storm higher after bulls predict strong gains ahead",0.322,0.678,0.6908
2018-09-29 15:16:33,0,1,fbitcoin,Ethereum Market Report: $ETH Trends Down,0.0,1.0,0.0
2018-09-30 09:41:19,0,1,XRP,"Bitcoin (BTC), Ethereum (ETH), Ripple and XRP, Augur, 0x, Basic Attention Token – The Daily Hodl fb.me/bitsecret",0.0,1.0,0.0
2018-09-30 10:07:02,0,1,cryptovideos,"The Crypto Lark - Ethereum Price Reversal? SEC Hurts Innovation, Facebook Hack &amp; StellarX - Bitcoin &amp; Crypto News",0.126,0.725,-0.128
2018-09-30 10:17:29,0,1,cryptonewswire,"China's Crypto Market is Thriving: Ethereum Hotel, Exchanges, and OTC Trading",0.0,1.0,0.0
2018-09-29 23:01:30,0,1,BTCNN,The Austrian Government To Issue Bonds Worth $1.35 Billion On The Ethereum Blockchain Network,0.128,0.872,0.2263
2018-09-29 23:32:24,0,1,u_income2me,Ethereum,0.0,1.0,0.0
2018-09-29 13:03:00,1,1,CryptoCurrency,Opera becomes first major browser with built-in support for Ethereum + Web 3.0,0.197,0.803,0.4019
2018-09-29 21:57:58,1,1,altcoin,ethereum,0.0,1.0,0.0
2018-09-29 20:14:18,0,1,ethereum,Ethereum Can Scale to 500 TX/S Without Using Second Layer Solutions,0.145,0.855,0.1779
2018-09-29 20:52:30,0,1,cryptoall,Doomsday for Ethereum? Why Some Analysts Are Shorting ETH,0.0,0.678,-0.5859
2018-09-29 19:57:35,0,1,u_dailycoinfo,Ethereum Security Lead Joins Effort to Oust Blockchain’s Big Miners,0.211,0.789,0.34
2018-09-30 14:07:43,0,1,Ether,Ethereum to EOS: First Signs Of Mutiny,0.0,1.0,0.0
2018-09-30 13:01:48,0,1,fbitcoin,"Ripple Overtakes Ethereum Once Again With 7% Surge, Bitcoin Stable at $6,600",0.167,0.833,0.296
2018-09-30 08:05:32,0,1,Altcoins2k18,"China’s Crypto Market is Thriving: Ethereum Hotel, Exchanges, and OTC Trading",0.0,1.0,0.0
2018-09-30 08:11:35,0,1,u_BitratesNews,Ethereum Developer Promotes ASIC-Resistant Algorithm Just Before Hard Fork,0.222,0.648,0.25
2018-09-30 08:28:22,0,1,CryptoCurrency,Best New – Ethereum Price Weekly Analysis: ETH/USD Consolidating Above $225,0.318,0.682,0.6369
2018-09-30 00:27:08,0,1,u_Unlianime,💰Read the post to get BTC Bonus: Doomsday for Ethereum? Why Some Analysts Are Shorting ETH https://www.pivot.one/share/post/5bafce246c20cd323b8da98b?uid=5bb001f55be18e4c1ac5b404&amp;invite_code=EGZSLI,0.154,0.662,-0.168
2018-09-26 08:04:27,0,1,CryptoCurrencies,Ethereum Price Analysis: Scalability Problems Impeding ETH Bulls as Prices Drop 9%,0.0,0.676,-0.5859
2018-09-26 08:18:23,0,1,CryptoCurrencies,0x v2.0 Launches On Ethereum Mainnet,0.0,1.0,0.0
2018-09-26 11:13:23,1,1,Ripple,XRP overtakes Ethereum!!,0.0,1.0,0.0
2018-09-26 11:22:31,1,1,CryptoCurrency,"eLYQD is a decentralized ecosystem market of ethereum, the basis for the entire vaping industry.eLYQD uses blockchain technology, the platform is transparent, open and secure, transaction and business costs are lower, the purchase process is simplified.",0.064,0.878,0.0516
2018-09-26 10:20:58,1,1,CryptoCurrencyTrading,Ethereum Digest: Two weeks before Constantinople testnet (Biweekly update 11th September — 25th September),0.0,1.0,0.0
2018-09-26 10:21:21,0,1,BTCNATIVE,Ethereum Co-founder: Cryptocurrency Next Logical Step in Evolution of Money,0.0,1.0,0.0
2018-09-26 10:02:11,0,1,ethereum,Ethereum-based blockchain protocol DAO.Casino is launching Sandbox for game developers,0.0,1.0,0.0
2018-09-26 03:16:56,0,1,CryptoCurrency,Taiwan Politician Receives Cryptocurrency Donation In First-Ever - Ethereum World News,0.0,1.0,0.0
2018-09-26 13:13:30,0,1,CryptoNull,"Bitcoin, Ethereum, Ripple, Bitcoin Cash, EOS, Stellar, Litecoin, Cardano, Monero, Dash: Price Analysis, September 24",0.0,1.0,0.0
2018-09-26 13:15:19,0,1,altcoin,"Bullish week for crypto: Bakkt confirms Bitcoin product, Coinbase opening gates for altcoins and Ethereum futures by LedgerX",0.0,1.0,0.0
2018-09-26 13:44:35,0,1,ethereum,LedgerX to Introduce Ethereum (ETH) Futures. Other exchanges such as Cboe Global Markets are also working on Ether Futures,0.0,1.0,0.0
2018-09-26 13:58:05,0,1,Stellar,"Cryptos in Red | Ethereum (ETH), Ripple (XRP), and Stellar (XLM)",0.0,1.0,0.0
2018-09-26 14:00:08,0,1,ethereum,"Ethereum Summary, creating history via revolutionary technology.",0.268,0.732,0.296
2018-09-26 13:45:15,0,1,CoinTelegraph,Ripple Briefly Overtakes Ethereum Again to Become Largest Altcoin By Market Cap,0.0,1.0,0.0
2018-09-26 13:25:21,0,1,cryptoall,JPMorgan’s Ethereum-Based Blockchain Payments Trial Adds 75 Banks,0.0,1.0,0.0
2018-09-25 20:21:16,0,1,BitcoinExchangeGuide,"University of Sydney’s Red Belly Blockchain Sees 30,000 TPS, Boasts Being 1500x Faster Than Ethereum",0.0,1.0,0.0
2018-09-25 20:22:52,1,1,ethereum,Vitalik Buterin Says Ethereum Can Scale To 500 tx/s Using Zcash Technology,0.0,1.0,0.0
2018-09-25 21:29:51,0,1,CryptoCurrency,ConsenSys Has Begun Using Ethereum to Supply Electricity to Texas,0.0,1.0,0.0
2018-09-25 21:31:03,0,1,BitcoinAll,Vitalik Buterin Says Ethereum Can Scale To 500 tx/s Using Zcash Technology /r/BitcoinMarkets,0.0,1.0,0.0
2018-09-25 21:36:20,1,1,u_faizan400,"CoTrader sets $3M hardcap for its live blockchain Uber of Hedge Funds, Democratizing the $85 Trillion Investment Funds Industry On Ethereum",0.0,1.0,0.0
2018-09-25 21:49:31,0,1,ethtrader,Loyalty 3.0 : URP &amp; ConsenSys combine their efforts through Ethereum Technology to engage the consumer,0.312,0.688,0.7096
2018-09-25 23:24:23,0,1,CryptoMarkets,Google Search Trends Behind Bitcoin and Ethereum,0.0,1.0,0.0
2018-09-26 14:20:10,0,1,ethereum,"It is Ethereum era - ""ØxMiner"" by Nelly Baksht, oil on canvas",0.0,1.0,0.0
2018-09-26 14:30:54,0,1,Ripple,Ripple beats Ethereum,0.0,1.0,0.0
2018-09-26 19:51:07,0,1,BitcoinExchangeGuide,Ethereum vs EOS: Can ETH Blockchain Endure the $4 Billion ICO Token?,0.0,1.0,0.0
2018-09-26 19:52:32,0,1,bitnewsbot,Vitalik co-authors research showing how Ethereum can scale securely https://ift.tt/2Ijt7Kq,0.211,0.789,0.34
2018-09-26 20:00:05,0,1,CryptoStock,Stellar's Jed McCaleb Reportedly Selling over 499k XRP a Day - Ethereum World News,0.0,1.0,0.0
2018-09-24 08:25:45,0,1,ethereum,Is Ethereum or Other Blockchains Cryptographically Safe Against Light-Based Hardware?,0.244,0.756,0.4404
2018-09-24 10:36:43,0,1,cryptobots,Juventus Soccer Club Is Launching a Crypto Token to Give Fans a 'Voice' #ethereum #altcoin #fintech… https://t.co/7CaM3mVN93 - Crypto Insider Info - Whales's,0.0,1.0,0.0
2018-09-24 10:39:09,0,1,ethereum,Ethereum on ARM. NanoPC-T4 image with official Armbian support. Lots of stability improvements and clients upgrade. Geth and Parity sync metrics. Documentation update.,0.192,0.808,0.6124
2018-09-24 10:40:22,0,1,Bitcoin,ODEM now has Blockchain-based Ethereum Smart Contracts,0.31,0.69,0.4019
2018-09-24 10:47:31,0,1,BitcoinAll,Ethereum Managed to Reclaim Its Second Place From XRP /r/BitcoinSerious,0.0,1.0,0.0
2018-09-24 09:34:21,0,1,u_SmartContractCompare,Case Study: Benchmarking the Ubiq Network Against Ethereum,0.0,1.0,0.0
2018-09-26 17:49:09,0,1,GGCrypto,"On Tuesday, Austria will borrow 1.15 billion euros in new debt. The auction of federal bonds will be handled by means of the Ethereum blockchain.(Article in german sorry)",0.0,0.915,-0.3612
2018-09-26 12:21:41,0,1,ethtrader,XRP overtakes Ethereum [ETH] again on the high of 23% hike,0.0,1.0,0.0
2018-09-26 12:42:07,0,1,TheColorIsRed,Ripple (XRP) Overtakes Ethereum As Second Largest Cryptocurrency On CEO's Bullish Bet,0.0,1.0,0.0
2018-09-26 12:49:17,0,1,Ripple,XRP Surpasses Ethereum (ETH) Again And Not Showing Signs Of Retreat,0.153,0.847,0.2023
2018-09-26 05:50:21,0,1,CryptoStock,Dogecoin (DOGE) Attempt to Not Obey the Bearish Market Trend: Latest News/Price Prediction - Ethereum World News,0.0,1.0,0.0
2018-09-26 07:47:14,0,1,Bitcoin,Bitcoin and Ethereum Price Forecast – BTC Prices Correct Lower,0.0,0.784,-0.296
2018-09-26 07:47:46,4,1,CryptoCurrency,According to Vitalik tweet Eos is a trash and non-governance so should I invest in EOS or Ethereum more?,0.0,1.0,0.0
2018-09-22 19:27:20,1,1,Crypto_Currency_News,"Crypto Markets See Mixed Signals, Ethereum Beats Ripple by Market Cap",0.0,1.0,0.0
2018-09-22 19:32:39,0,1,ethereum,I Built a Politically Incorrect Ethereum Quiz Game - It's Already Live on Mainnet,0.0,1.0,0.0
2018-09-22 19:47:15,0,1,cryptobots,Co-Founder of Gulf Blockchain Foundation Doesn’t See Strong Future... #ethereum #eth #ico Supply Chains… https://t.co/p2VJEjxtk7 - Crypto Insider Info - Whales's,0.155,0.845,0.5106
2018-09-22 19:51:50,0,1,CryptoStock,It’s Not Another Vaporware ICO — How I Built a Ethereum Quiz Game Without any Investment,0.0,1.0,0.0
2018-09-22 12:17:12,0,1,cryptobots,+10 Tron [TRX]’s Justin Sun shows his unwavering support for XRP and Ripple $ETH #ethereum #altcoin $XRP $TRX https://t.co/s5P7yLl9Y5 - Crypto Insider Info - Whales's,0.109,0.891,0.4019
2018-09-22 12:27:58,0,1,CryptoCurrency,PTON Token an ethereum coin that is built on ERC-20.,0.0,1.0,0.0
2018-09-22 12:29:32,0,1,ethereum,We're utilizing Ethereum and the ERC-721 standard to bring real memorabilia and prizes to the ~$1.5bn esports industry.,0.15,0.85,0.4588
2018-09-22 12:37:29,0,1,Crypto_News,Ripple Passes Ethereum to Claim Number Two Ranking on CoinMarketCap,0.126,0.874,0.0772
2018-09-22 12:12:08,0,1,BTCNews,Momentum Is Building to Block Ethereum ASICs,0.0,0.674,-0.4404
2018-09-22 12:12:08,0,1,eos,"Ethereum (ETH) Top 5 Rivals: Tron (TRX), EOS, Stellar (XLM), NEO and Cardano (ADA)",0.13,0.87,0.2023
2018-09-23 17:03:09,0,1,Neotrader,"""Ethereum meets NEO"" featuring Da Hongfei and Virgil Griffith @ Consensus Singapore on 20th September 2018",0.0,1.0,0.0
2018-09-23 17:45:17,1,1,Vechain,i have vechain tokens in my ethereum adress how do i convert them into vet?,0.0,1.0,0.0
2018-09-23 17:28:10,0,1,tribetica,Weiss Ratings: Bitcoin Will Lose 50% of Its Market Share to Ethereum in 5 Years,0.13,0.71,-0.128
2018-09-23 16:59:12,0,1,globelivenews,‘Turbo Geth’ Seeks to Scale Ethereum And It’s Already in Beta,0.0,1.0,0.0
2018-09-22 23:02:24,0,1,cryptobots,The Revolution Will Not Be Linear: Blockchain’s Unsustainable D... #cryptocurrency #ethereum #btc worlds… https://t.co/k2OrRYiPGE - Crypto Insider Info - Whales's,0.0,1.0,0.0
2018-09-22 21:38:11,0,1,TrendsProject,Ethereum (ETH) Could Bear Down To $140 And Turn Into A Bull Run In A Surprise Market Dynamic - Ethereum World News,0.217,0.783,0.5719
2018-09-22 21:38:24,0,1,newsbotTMT,@slashdot: NSA's 'Codebreaker Challenge' Features Exploiting Blockchain To Steal Ethereum https://t.co/0FPdp4taxA,0.084,0.519,-0.7003
2018-09-22 21:47:04,0,1,cryptobots,Can Tron (TRX) follow in the Ripple (XRP) footsteps? #ethereum #eth #ico Tron (TRX) https://t.co/Q2tFgWLOUM - Crypto Insider Info - Whales's,0.0,1.0,0.0
2018-09-22 05:09:19,0,1,CryptoCurrency,When will 🇨🇦 Canada 🇨🇦 get it's Ethereum killer?,0.0,0.65,-0.6486
2018-09-22 19:15:47,0,1,EthereumClassic,Why Ethereum Classic (ETC) Is The Next Bitcoin (BTC),0.0,1.0,0.0
2018-10-01 05:36:15,0,1,XRP,"This Week In Crypto – Google Reaccepts Crypto Ads, Ethereum and Ripple Battle It Out fb.me/bitsecret",0.0,0.843,-0.3818
2018-10-01 05:53:12,0,1,CryptoNewsandTalk,Ethereum Foundation Security Head Echos Removal of ASIC Mining Hardware from ETH,0.179,0.821,0.34
2018-10-01 09:44:37,0,1,CryptoTrading24,(+) Is Ethereum Ready to Play Catch Up With Bitcoin?,0.38,0.62,0.5994
2018-10-01 10:35:50,0,1,cryptocurrencynewico,"KuCoin - Bitcoin Exchange: Bitcoin, Ethereum, Litecoin, KCS",0.0,1.0,0.0
2018-10-01 08:07:47,0,1,bprogramming,Etherscan – The Ethereum Block Explorer,0.0,0.58,-0.4404
2018-10-01 07:12:13,0,1,iCenter,"36% of BTC in Circulation Is Lost, Making Bitcoin Technically More Scarce - Ethereum World News",0.0,0.859,-0.3182
2018-10-01 07:23:53,0,1,CryptoNewsandTalk,"Chinese Bitcoin Billionaire Unexpectedly Exits Crypto Industry, Controversy Ensues - Ethereum World News",0.0,1.0,0.0
2018-10-01 15:26:12,0,1,fbitcoin,Ethereum Price Decline Hasn’t Hurt ICO-Funded Startups: BitMEX Research,0.0,0.702,-0.5267
2018-10-01 15:45:41,0,1,CryptoTrading24,Ethereum Startup Parity Adds Casper Code to Custom Blockchain Toolbox,0.0,1.0,0.0
2018-10-01 15:50:28,0,1,btc,Ethereum holdings in the ICO treasury accounts,0.231,0.769,0.2023
2018-10-01 14:51:03,0,1,ethtrader,"Opera Browser Operator to Explore New Applications of Blockchain -FFS CoinDesk, it's on Ethereum!!!",0.0,0.706,-0.7513
2018-10-01 15:13:55,0,1,EthereumClassic,New Community Pool | Miner-Hash | Mining Pool for Ethereum Classic,0.0,1.0,0.0
2018-10-01 15:32:16,0,1,BitcoinAll,"Bitcoin mentioned around Reddit: MState’s first investment in New York-based Blockdaemon is designed to give its clients point-and-click deployment of applications powered by Bitcoin, Ethereum, Stellar, Aion, Corda, Hyperledger Fabri /r/AionNetwork",0.0,1.0,0.0
2018-10-01 14:13:49,1,1,AionNetwork,"MState’s first investment in New York-based Blockdaemon is designed to give its clients point-and-click deployment of applications powered by Bitcoin, Ethereum, Stellar, Aion, Corda, Hyperledger Fabric, Multichain and Quorum.",0.0,1.0,0.0
2018-10-01 16:06:02,0,1,cryptoall,Can Ethereum (ETH) Actually Go To Zero?,0.0,1.0,0.0
2018-10-01 13:49:34,2,1,CryptoCurrency,Ethereum Co-Founder Invests $6.5 Million In Former Competitors,0.0,1.0,0.0
2018-10-01 14:14:12,0,1,CryptoCurrencies,Real World Use Cases of the Ethereum Blockchain Plateaued? IOST v1.0 Everest Supports JavaScript for “Mass Adoption”,0.135,0.865,0.3612
2018-10-01 15:55:42,0,1,BitcoinExchangeGuide,Ethereum Co-Founder Says Outdated Technologies Are Based On “Subjective Trust”,0.0,1.0,0.0
2018-10-01 16:01:38,0,1,Bitcoin,"Bitcoin, Ethereum and Monero at the core of a new cryptocurrency money-laundering scheme",0.0,1.0,0.0
2018-10-04 11:12:18,0,1,Crypto_Currency_News,EOS Dapps are Gaining More Traction than Ethereum Dapps,0.259,0.741,0.4215
2018-10-04 12:58:48,0,1,CryptocurrencyICO,Executive Phase Sale is LIVE !! Avail 12.5% #BONUS to #BuyNow ➡️Latest review by @criptomonedaico https://t.co/TmfCQARsDt #criptonoticias #criptomonedas #BTC #TRX #EOS #ETH #LTC #XRP #crypto #bitcoin #cryptocurrency #btc #blockchain #ethereum #eth #trading #xrp #ico #Tokens,0.0,1.0,0.0
2018-10-04 13:51:36,1,1,ethereum,Quarry App Review Earn Free Ethereum | Earn Daily 10$ To 15$ Live in Urd...,0.202,0.798,0.5106
2018-10-04 13:46:36,0,1,cryptoall,"""When it comes to developers, transactions, and DApps, no other platform compares to Ethereum. Of the top 100 tokens by market capitalization, 94 % were built on Ethereum – $13 billion in capital was generated through Ethereum in this way.""",0.045,0.9,-0.1027
2018-10-03 22:23:44,0,1,CryptoCurrencyTrading,"Bitcoin, Ethereum, Ripple, Bitcoin Cash, EOS, Stellar, Litecoin, Cardano, Monero, IOTA: Price Analysis, October 3",0.0,1.0,0.0
2018-10-03 22:26:09,0,1,ProBitcointrading,Ethereum Price Analysis: ETH/USD Holding $450...,0.0,1.0,0.0
2018-10-03 22:26:43,0,1,BitcoinExchangeGuide,Ethereum Blockchain Developer Activity Remains the Highest Ranked Crypto Project,0.0,1.0,0.0
2018-10-04 00:12:42,0,1,Bitcoin,Luxury Condo in Manhattan Will be ‘Tokenized’ on the Ethereum Blockchain,0.0,1.0,0.0
2018-10-03 23:37:37,1,1,Crypto_Currency_News,"*LIVE* Bitcoin, Bitcoin Cash, Ethereum and Ripple XRP Technical Analysis + Market Update",0.0,1.0,0.0
2018-10-03 23:35:19,0,1,ico,"EtherInc is a fork of Ethereum to power the future of organizations. Rated 4,4/5 on ICObench. In collaboration with Wificoin they are airdropping ETI. AIRDROP, click on “Claim ETI Partner Reward” , sign up, join telegram and twitter+ 1 retweet for 52 ETI:",0.053,0.947,0.296
2018-10-03 23:57:10,0,1,bitnewsbot,Ethereum Ranking as the Most Actively Developed Blockchain https://ift.tt/2PajqAO,0.245,0.755,0.3804
2018-10-04 00:57:21,0,1,BitcoinBeginners,"Bitcoin, Bitcoin Cash, Ethereum and Ripple XRP Technical Analysis + Market Update #17",0.0,1.0,0.0
2018-10-04 14:55:27,0,1,cryptoall,A $30 Million Manhattan Condo Was Just Tokenized on Public Ethereum Blockchain,0.0,1.0,0.0
2018-10-04 15:11:34,0,1,FreeETH,Earn Free Ethereum / Best New App For Earn Eth,0.517,0.483,0.8176
2018-10-04 14:40:59,0,1,CryptoCurrencies,Ethereum Mining Is A Profitable Business?,0.42,0.58,0.4404
2018-10-04 14:10:13,0,1,EthAnalysis,Ethereum Price Analysis - 10/04/2018,0.0,1.0,0.0
2018-10-04 14:20:20,0,1,CryptoCurrencies,Ethereum (ETH) Tops the Chart of Most Active Blockchain for Developers,0.411,0.589,0.7425
2018-10-04 08:01:38,0,1,btc,Big News: Swiss Bank Wants to Conduct ICO on Ethereum Blockchain,0.0,1.0,0.0
2018-10-04 07:46:37,0,1,BitcoinSerious,"Bitcoin [BTC], Ethereum [ETH], Bitcoin Cash [BCH] &amp; Litecoin [LTC] to be traded on TD Ameritrade’s backed crypto-market.",0.061,0.939,0.0258
2018-10-04 07:49:17,1,1,ethereum,"The ""X Protocol"" will allow exchanges between EOS and Ethereum tokens. Will all future blockchains be stringed together by one interoperable protocol?",0.083,0.917,0.2263
2018-10-04 07:55:14,0,1,cryptoall,"Bitcoin [BTC], Ethereum [ETH], Bitcoin Cash [BCH] &amp; Litecoin [LTC] to be traded on TD Ameritrades backed crypto-market.",0.061,0.939,0.0258
2018-10-04 07:55:15,0,1,cryptoall,Ethereum Price Analysis: ETH/USD Recovering Towards $230 | NewsBTC,0.0,1.0,0.0
2018-10-04 07:20:59,0,1,CryptoNewsandTalk,"Bitcoin [BTC], Ethereum [ETH], Bitcoin Cash [BCH] &amp; Litecoin [LTC] to be traded on TD Ameritrade’s backed crypto-market",0.061,0.939,0.0258
2018-10-04 07:24:14,0,1,ethereum,"Opening An Ethereum Hotel In China, Is It Really A Wise Move?",0.253,0.747,0.5256
2018-10-04 06:01:24,0,1,ethereum,Ethereum Co-founder: Cryptocurrency Next Logical Step in Evolution of Money,0.0,1.0,0.0
2018-10-04 11:30:07,0,1,CryptoCurrencies,Ethereum Plasma – Ethereum’s New Scaling Strategy and Design Space,0.0,1.0,0.0
2018-10-04 11:56:14,1,1,ethtrader,Ethereum price prediction - 10x before 2019? Possible?,0.0,1.0,0.0
2018-10-04 12:04:41,0,1,ethereum,"Multicoin Capital Leads $10 Million SAFT Sale for Ethereum Scaling Startup, Skale",0.0,1.0,0.0
2018-10-04 13:10:32,2,1,ProjectOblio,Gemini Stable Coin on Ethereum “Ode to Decentralization - Stellar and the consumer/everyday market Dstorq security exchange on stellar X?,0.213,0.787,0.5574
2018-10-04 14:35:35,0,1,CryptoCurrencies,"Bitcoin [BTC], Ethereum [ETH] and Litecoin [LTC] can now be ‘purchased’ by Brazilian investment funds",0.0,1.0,0.0
2018-10-03 14:03:56,0,1,TheCoinShark_,Bitcoin and Ethereum Are Not In Trend Anymore? Google Shows Disappointing Data,0.0,0.775,-0.4939
2018-10-03 09:37:55,0,1,CryptoCurrencies,Why You Should Expect Ethereum to Eventually Hit “Zero”: The Ultimate ETH Bear Case,0.0,1.0,0.0
2018-10-03 09:58:49,0,1,CryptoCurrencies,Chinese Court Rules that Ethereum [ETH] is a Property Protected by Law,0.225,0.775,0.4404
2018-10-03 13:40:56,0,1,BlockChain,What are the merits of Cardano vs. Ethereum?,0.278,0.722,0.4019
2018-10-03 12:19:48,0,1,ethtrader,Ethereum Classic trading &amp; deposits finally enabled on Forex Club libertex!,0.0,1.0,0.0
2018-10-03 16:27:37,0,1,ethtrader,"Introducing The Hard Spoon – COSMOS Blog - ""We do not want to compete with or take market share from Ethereum. However, with this hard spoon, we do intend to invite the Ethereum development community onto our platform, as we offer performance boosts that complement Ethereum.""",0.126,0.788,0.4548
2018-10-03 14:54:51,0,1,ethereum,Beautiful Ethereum Wallet Now Launched (Open-Source),0.574,0.426,0.6597
2018-10-02 17:24:03,3,1,ethereum,Ethereum 2.0 Casper+Sharding Development Update #14 — Prysmatic Labs,0.0,1.0,0.0
2018-10-03 15:32:39,0,1,CryptoCurrency,A Simple Explanation To Ethereum Casper V2 ---&gt; Beacon Chain &amp; Shard Chains!,0.0,1.0,0.0
2018-10-03 14:28:22,0,1,Crypto_General,Ethereum Smart Contract Support in Bluzelle’s Lovelace Release,0.474,0.526,0.6597
2018-10-03 15:55:16,0,1,noncensored_bitcoin,[uncensored-r/CryptoCurrency] GitHub - DreammyOrg/Karatcoin: Blockchain Ethereum Public Repository,0.0,1.0,0.0
2018-10-03 15:45:07,0,1,BankofHodlers,Can Ethereum Smart Contracts Make Trading Efficient?,0.524,0.476,0.6705
2018-10-03 15:49:00,0,1,CryptoCurrency,Ethereum the most actively developed blockchain,0.341,0.659,0.3804
2018-10-03 11:17:38,0,1,CryptoCurrency,built to be a fully decentralized open source platform. The community can track the development and promotion of the coin.https://tokensale.w12.io/ru/ #W12 #Crowdsale #Bitcoin #Blockchain #Token #ETH #Ethereum #TokenSale,0.0,1.0,0.0
2018-10-03 10:29:14,0,1,CryptoCurrencies,Bitcoin and Ethereum Price Forecast – BTC Prices Unable to Make Headway,0.0,1.0,0.0
2018-10-03 10:59:40,0,1,giveaways,PTMX Lucky Draw for $100 worth of Ethereum (10/31/2018) {ww},0.37,0.63,0.5719
2018-10-03 10:36:08,0,1,CryptoCurrencies,Google Trend Analysis Shows Bitcoin and Ethereum Keyword Searches See Lowest Point in 18 Months,0.0,0.843,-0.3818
2018-10-03 11:31:45,0,1,CryptocurrencyICO,Ethereum on the Rise? - Good News for GODcoin Investors — Steemit,0.244,0.756,0.4404
2018-10-03 18:03:58,0,1,ethereum,5 legit ways to earn ethereum - Best ethereum faucet 2018,0.344,0.656,0.6369
2018-10-01 19:57:17,1,1,PolymathNetwork,Ethereum (ETH) Blockchain Protocol Vies For Best Security Token Creation Platform,0.521,0.479,0.8271
