date,num_comments,score,subreddit,title,pos,neu,compound
2018-04-11 19:33:38,0,1,NETCOINnews,"DC Forecasts: Bitcoin, Ethereum, ICO, Blockchain &amp;amp; Cryptocurrency News",0.0,1.0,0.0
2018-04-11 14:07:58,0,1,passive_income,"Earn passive income through dividends simply for holding/staking your Ethereum into this smart contract! Depending on the traffic, I get about a 1% return on investment per day.",0.179,0.821,0.639
2018-04-11 18:03:15,0,1,cryptovideos,"Coin Mastery - Bitcoin Battles The Shorts! Ethereum Moving, Altcoin Accumulation, Bubble Theories - Ep181",0.0,0.806,-0.4389
2018-04-11 19:11:51,0,1,BitcoinAll,"Bitcoin mentioned around Reddit: Upvoted: Gymrewards is airdropping 50,000,000 Gym tokens to 10,000 participants. via /r/GYMRewards http://ift.tt/2IBVK58 #ico #tokensale #ethereum #cryptocurrency #bitcoin #fit #fitnes #gymbase /r/GYMRewards",0.0,1.0,0.0
2018-04-11 19:59:14,0,1,ethereum,Buy Wood Design Products - Pay With Ethereum,0.0,0.811,-0.1027
2018-04-11 19:57:51,2,1,CryptoCurrency,GoChain's TestNet is live -&gt; join their Telegram group and see for yourself why it's better/faster than Ethereum!,0.128,0.872,0.3595
2018-04-14 14:50:07,0,1,Cryptoalert,Skycoin Announces Obelisk Protocol to Fix Present Flaws in Bitcoin and Ethereum,0.0,1.0,0.0
2018-04-14 18:35:12,0,1,BtcForum,Ethereum • Ethereum Wallet,0.0,1.0,0.0
2018-04-14 00:31:28,0,1,cryptobots,"Bitcoin Unexpectedly Maintains its 13% Gain, Remains Above $7800 as Marke... #ethereum #altcoin #fintech… https://t.co/f0Gma7SgEn - Crypto Insider Info - Whales's",0.159,0.841,0.5267
2018-04-14 18:21:17,1,1,ethereum,Are Ethereum developers incentivized enough?,0.0,1.0,0.0
2018-04-13 21:10:38,0,1,MagicPoopCannon,Ethereum Reverses With The Market! (ETH),0.0,1.0,0.0
2018-04-13 23:06:45,0,1,ethtrader,INS Ecosystem (Groceries on Blockchain) Joins The Enterprise Ethereum Alliance,0.0,1.0,0.0
2018-04-13 14:13:16,0,1,ethereum,"Upcoming Event: Ethereum Berlin Meetup, Germany - April 13, 2018",0.0,1.0,0.0
2018-04-13 16:01:02,0,1,Cryptoalert,Luxury Pen Manufacturer Ancora1919 Offers Bitcoin and Ethereum Fountain Pens,0.0,1.0,0.0
2018-04-13 15:56:18,0,1,ethereum,What is Ethereum Price Predictions by 2018,0.0,1.0,0.0
2018-04-13 08:03:31,0,1,CryptocurrencyICO,Ethereum Cash Pro ICO!! 1ECP = $2 Exchange launch; May Price: $0.05 Turn $50 into $6000 in less than a month!!,0.0,1.0,0.0
2018-04-13 21:34:25,0,1,ethereum,Ethereum Shirt,0.0,1.0,0.0
2018-04-13 18:10:14,0,1,noncensored_bitcoin,[uncensored-r/CryptoCurrency] ??ETHLend Expands to FIAT Lending: Licensing Process Has Initiated - Bringing Ethereum closer to ...,0.112,0.888,0.1926
2018-04-13 17:59:48,0,1,cryptobots,"Lead Ethereum, Ethereum Lead the Way https://goo.gl/smZBBR - Crypto Insider Info - Whales's",0.0,1.0,0.0
2018-04-11 21:24:22,0,1,Bitcoin,The Ethereum Classic Blockchain Is INCOMPLETE &amp; Why That Is OK,0.227,0.773,0.4466
2018-04-15 01:37:01,1,1,noncensored_bitcoin,"[uncensored-r/CryptoCurrency] Ever heard about Omnia-Tech? They provide a massive mining space for Bitcoin, Ethereum, Z cash, a...",0.0,1.0,0.0
2018-04-15 01:45:37,0,1,cryptobots,Company Aims To Become ‘Amazon Of Sharing Economy’ With Blockchain App #ethereum #crypto #ico… https://t.co/lrOOinkWW2 - Crypto Insider Info - Whales's,0.135,0.865,0.4215
2018-04-13 14:25:13,1,1,JordanShackelford,Ethereum Games Explained,0.0,1.0,0.0
2018-04-13 19:47:15,0,1,AllThingsCrypto,"Bitcoin, Ethereum, Bitcoin Cash, Ripple, Stellar, Litecoin, Cardano, NEO, EOS: Price Analysis, April 13",0.0,1.0,0.0
2018-04-13 17:30:15,0,1,cardano,Will Cardano dApps be able to communicate with Ethereum dApps?,0.0,1.0,0.0
2018-04-13 13:21:33,0,1,crypto_currency,Ripple's (XRP) Liquidity To Increase With New Exchanges By SBI Holdings - Ethereum World News,0.15,0.85,0.3182
2018-04-13 19:34:15,0,1,ethereum,[Help] Ethereum wallet won't update after losing geth.,0.238,0.762,0.2924
2018-04-14 02:20:14,0,1,CryptoAirdrop,AIRDROP] PARIS coin 10pcs worth 10$ FREE Pariscoin VISION: The PARISCOIN platform is a recent generation of blockchain technology built to enhance on the bitcoin and ethereum technologies and provide enhancements,0.243,0.757,0.8256
2018-04-14 06:07:43,0,1,cryptobots,Bitcoin investors cheer best week of the year #bitcoin #ethereum #fintech https://t.co/ls8jnssNtn - Crypto Insider Info - Whales's,0.349,0.651,0.8176
2018-04-14 06:49:18,0,1,Bitcoin,"Cosmic market in Greeley Colorado now accepts Bitcoin, Litecoin, Ethereum. and Bitcoin cash thanks to the new super easy Coinbase commerce api.",0.4,0.6,0.9001
2018-04-13 23:29:20,1,1,altcoin,Ethereum Classic Trading Up 22.1% Over Last Week,0.0,1.0,0.0
2018-04-13 20:15:33,0,1,EthereumETH,LocalEtherWallet Probably the Best Ethereum Wallet in the World,0.344,0.656,0.6369
2018-04-12 20:50:37,0,1,cryptobots,This is how Bitcoin works #ethereum #btc #eth https://t.co/lILliRNc3t - Crypto Insider Info - Whales's,0.0,1.0,0.0
2018-04-12 16:45:22,0,1,u_etherstars_dev,EtherStars Ethereum App,0.0,1.0,0.0
2018-04-12 16:48:21,0,1,cryptobots,"Conquer Ethereum with Capture the Ether, an Ethereum Hacking Game! https://goo.gl/h185df - Crypto Insider Info - Whales's",0.0,1.0,0.0
2018-04-12 18:01:16,0,1,ethereum,[ADOPTION] BEDLAM THREADZ now accepting Ethereum.,0.342,0.658,0.3818
2018-04-12 19:06:45,0,1,cryptobots,Dean Sutton Breaks Down Crypto and Blockchain Holistically #ethereum #crypto #altcoins https://t.co/NmQ6kHn9U7 - Crypto Insider Info - Whales's,0.0,1.0,0.0
2018-04-10 17:21:40,0,1,ethtrader,Ethereum Pre-sale Taxes in the USA?,0.0,1.0,0.0
2018-04-10 09:45:44,1,1,CryptoCurrency,Ethereum! Always and forever!,0.0,1.0,0.0
2018-04-10 09:08:48,0,1,BitcoinAll,"Bitcoin mentioned around Reddit: There are now more than 6,000,000 individual wallets. #btc #bitcoin #ltc #litecoin #eth #ethereum #blockchain /r/SocialWalletInc",0.0,1.0,0.0
2018-04-10 18:00:46,0,1,AllThingsCrypto,"Golem, the ""Airbnb for Computers,"" Launches on Ethereum Mainnet in Beta",0.0,1.0,0.0
2018-04-10 20:33:05,1,1,BitcoinAll,"Why games are important - 7 y/o girl talks about ethereum, metamask, and angelbattles. (repost from r/ethereum, what do you think ?)",0.087,0.913,0.2023
2018-04-10 19:47:25,0,1,ethereum,My Beef Jerky company now accepts Ethereum,0.277,0.723,0.3182
2018-04-10 20:17:00,0,1,bitcoins,Reinventing the Charity Run with Thomas Vanderstraeten and Ethereum,0.259,0.741,0.4215
2018-04-11 11:42:39,0,1,EthereumClassic,Cap on Ethereum More Than Just a Joke?,0.291,0.709,0.3535
2018-04-16 06:18:55,1,1,u_Cryptofont,"IS ETHEREUM GOING TO 2,000$?",0.0,1.0,0.0
2018-04-18 18:05:16,0,1,Airdrop,"Sancoj: The World's First Opportunity Supermarket built on the Ethereum blockchain utilizing Suggestive Artifical Intelligence Agent Zingo with 0% commission fees. Airdrop: Approx 15,000 SANC coins Free.",0.277,0.723,0.8481
2018-04-16 01:29:06,2,1,xyMarket,"[H] Lots of Leftovers [W] Paypal, Good offers, BTC/Ethereum",0.266,0.734,0.4404
2018-04-17 14:38:46,1,1,u_cryptocurrencyBTC,"free 99$ to 1000$ just signup in this #tokens #airdrop #cryptocurrency , earn free money #Airdrop #ICO #cryptocurrency #altcoin #tokens #Bounty #airdropalert #bitcoin #ethereum »steemit: https://goo.gl/shzNZR »telegram: https://goo.gl/YGHCXb",0.209,0.791,0.765
2018-04-17 04:29:16,0,1,Airdrop,"What is VVCoin? VVCOIN is an ethereum blockchain based ERC20 created for facilitating tourists all across the globe. VVCOIN aims to make the paying process such as hoteling, transformation and online booking easier for the tourism industry.",0.121,0.879,0.5859
2018-04-17 21:27:29,1,1,u_cryptocurrencyBTC,"free 88$ to 1000$ just signup in this #tokens #airdrop #cryptocurrency , earn free money #Airdrop #ICO #cryptocurrency #altcoin #tokens #Bounty #airdropalert #bitcoin #ethereum »steemit: https://goo.gl/shzNZR »telegram: https://goo.gl/YGHCXb",0.209,0.791,0.765
2018-04-20 21:07:47,0,1,u_doyler79,BITCOIN LITECOIN &amp; ETHEREUM GIVEAWAY ~ FINAL STEPS!,0.0,1.0,0.0
2018-04-19 13:18:25,0,1,u_thecoinshark,NASA Will Explore the Space Using Ethereum Blockchain,0.0,1.0,0.0
2018-04-15 04:05:26,1,1,BitcoinAll,"Comparison Bitcoin,Ethereum and Ripple percentage growth /r/BitcoinMarkets",0.302,0.698,0.3818
2018-04-15 05:12:27,0,1,giveaways,$500 of Ethereum (ETH) Cryptocurrency Giveaway! (06/08/2018) {US},0.0,1.0,0.0
2018-04-16 00:03:48,1,1,Ripple,RIPPLE CLOSING THE 2x GAP on Ethereum Market Cap,0.0,1.0,0.0
2018-04-16 04:23:27,0,1,bitcoins,Ancora Luxury Italian Company Offers Ethereum Pens,0.0,1.0,0.0
2018-04-15 15:09:06,0,1,Cryptoalert,An Ethereum Blockchain Is Restoring the Identity of Syrian Refugees,0.196,0.804,0.296
2018-04-15 16:50:23,0,1,Cryptoalert,SkyCoin Aims to Fix Various Flaws in Bitcoin and Ethereum Blockchain Networks with Blockchain 3.0,0.0,1.0,0.0
2018-04-15 07:41:35,0,1,CoinBusinessReports,Coinbase Aquires Ethereum Wallet Cipher.,0.0,1.0,0.0
2018-04-16 05:26:53,0,1,cryptobots,"Cryptocurrencies Rise; Bitcoin Prices Recover Above $8,000 Level #ethereum #crypto #ico https://t.co/81ky1GHCnh - Crypto Insider Info - Whales's",0.0,1.0,0.0
2018-04-16 04:53:00,0,1,cryptobots,Emirates NBD rolls out blockchain solution 'Cheque Chain' at scale #blockchain #ethereum #altcoin… https://t.co/ggun9zz70Z - Crypto Insider Info - Whales's,0.25,0.75,0.6523
2018-04-16 17:58:20,0,1,LeveragePlatform,❤️ Vote for @LeverageToken (#LVP) on @TrackICO to become #ICO of the week! https://t.co/ywplXeTDvG #tokens #BTC #LVP #Airdrops #freetoken #Coins #ICO #BountyProgram #bounty #Bitcointalk #ETH #ethereum #Airdrop,0.0,1.0,0.0
2018-04-17 01:29:53,0,1,CryptoMarkets,Just bought some #ethereum for a trade,0.0,1.0,0.0
2018-04-17 02:26:02,0,1,cryptobots,Malaysians will be able to pay bills with cryptocurrency soon — Everus #ethereum #btc #fintech https://t.co/Wl2jYbjJi4 - Crypto Insider Info - Whales's,0.0,0.928,-0.1027
2018-04-17 02:46:18,0,1,LeveragePlatform,Thanks for the mention freecryptokens. https://t.co/tlGnUNQ4uX #tokens #BTC #LVP #Airdrops #freetoken #Coins #ICO #BountyProgram #bounty #Bitcointalk #ETH #ethereum #Airdrop,0.139,0.861,0.4404
2018-04-17 02:46:18,0,1,LeveragePlatform,Thanks for the mention freecryptokens. https://t.co/EwzFvY2VjM #tokens #BTC #LVP #Airdrops #freetoken #Coins #ICO #BountyProgram #bounty #Bitcointalk #ETH #ethereum #Airdrop,0.139,0.861,0.4404
2018-04-17 01:36:17,0,1,atbitcoin,"Crypto Price Watch: Bitcoin, Ethereum, Litecoin and Ripple Experience Minor Drawbacks",0.0,1.0,0.0
2018-04-17 03:11:14,1,1,u_flight90,Ethereum Investors Announced. 16/04/18,0.0,1.0,0.0
2018-04-16 09:31:20,0,1,cryptobots,Crypto Technical Analysis Review: A Recap Of What Happened Last Week Apri... #bitcoin #ethereum #fintech… https://t.co/sdQ67rWHF1 - Crypto Insider Info - Whales's,0.0,1.0,0.0
2018-04-16 06:14:36,0,1,u_AlKasirPortal,"Pre-launch of Al Mas, Al Falah &amp; Al Haqeek Blockchain-Assets starts today. All the 3 Blockchain-Assets are built upon the Ethereum Blockchain. Know more at http://www.alkasirportal.com #AlKasirPortal #Prelaunch #BlockchainAssets #Bonus #Diamonds #AlMas #AlFalah #AlHaqeek #Blockchain",0.0,1.0,0.0
2018-04-16 06:57:25,0,1,BtcForum,Ethereum • local ether wallet,0.0,1.0,0.0
2018-04-17 00:43:13,1,1,GGCrypto,my Ethereum white paper typographical art printed on Metal. Check out how reflective it is!,0.0,1.0,0.0
2018-04-17 02:17:06,0,1,Denton,[x-post] Intro to Ethereum Workshop,0.0,1.0,0.0
2018-04-16 13:53:27,0,1,BTCNews,Vitalik's Serious Joke: The Case for Ending Ethereum Inflation,0.21,0.667,0.2263
2018-04-16 15:38:55,0,1,ethereum,"NASA project: ""Ethereum blockchain technology will be exploited to develop a decentralized, secure, and cognitive networking and computing infrastructure for deep space exploration”",0.094,0.787,-0.1531
2018-04-16 22:36:03,0,1,CoinTelegraph,"Bitcoin, Ethereum, Bitcoin Cash, Ripple, Stellar, Litecoin, Cardano, NEO, EOS: Price Analysis, April 16",0.0,1.0,0.0
2018-04-16 22:56:54,1,1,CryptoCurrency,Someone got extremely lucky selling some EOS for Ethereum. MASSIVE GAINZ [NOT CLICKBAIT],0.205,0.795,0.4754
2018-04-16 22:51:32,0,1,cryptobots,"+8 Cardano VS Ethereum, How Far UP? $ETH #ethereum $ADA #cardano #altcoin #cryptocurrency https://t.co/MJvTB3dBId - Crypto Insider Info - Whales's",0.0,1.0,0.0
2018-04-17 05:17:27,0,1,ethereum,Vitalik’s April Fool’s Ethereum Proposal Could Save the Cryptocurrency,0.286,0.714,0.4939
2018-04-16 16:08:41,0,1,Buttcoin,Beanie babies for the digital age: Lucky trader makes $210k selling Ethereum-based digital cats prior to price crashing.,0.141,0.859,0.4215
2018-04-16 18:31:13,0,1,ethereum,"CryptoHashMemes - Create, display and ""own"" memes in Ethereum blockchain",0.208,0.792,0.2732
2018-04-16 15:09:58,0,1,BlockChain,Why I changed my mind about Ethereum: The world needs Proof of Stake! with Douglas Pike (Vericoin dev),0.0,1.0,0.0
2018-04-16 15:11:25,3,1,noncensored_bitcoin,"[uncensored-r/CryptoCurrency] NASA project: ""Ethereum blockchain technology will be exploited to develop a decentralized, secur...",0.0,0.8,-0.4588
2018-04-16 14:46:57,0,1,ethereum,The first successful transfer of DNA Sequence over the Ethereum Blockchain,0.275,0.725,0.5859
2018-04-16 20:26:40,0,1,CryptoCurrency,Ethereum Based Scam: Gifts can be Dangerous,0.0,0.424,-0.7783
2018-04-16 20:43:18,0,1,Denton,Intro to Ethereum Workshop,0.0,1.0,0.0
2018-04-16 18:14:17,2,1,Egretia,"Egretia will be providing, will not only supports our own #Egretia chain, but also be extended to support Ethereum, EOS and other public chains",0.131,0.812,0.4579
2018-04-15 18:44:18,1,1,noncensored_bitcoin,[uncensored-r/CryptoCurrency] Scam New Ethereum Wallet,0.0,0.519,-0.5719
2018-04-15 23:18:04,0,1,ico,Crystalreign.io - Ethereum based strategy mmo ICO ends next week,0.0,1.0,0.0
2018-04-15 17:14:38,0,1,cryptobots,"3 Altcoins Likely to Outperform Bitcoin for the Week of April 16, 2018 #ethereum #crypto #altcoins… https://t.co/Av9ZJtWlVU - Crypto Insider Info - Whales's",0.0,1.0,0.0
2018-04-16 19:48:17,0,1,CryptoCurrency,Coinbase Acquires Cipher Ethereum Mobile Browser,0.0,1.0,0.0
2018-04-16 10:07:12,0,1,ethereum,Analysis: Ethereum seems to have More Recognition than Bitcoin In India,0.0,1.0,0.0
2018-04-16 10:18:12,1,1,CryptoCurrency,"NASA project: ""Ethereum blockchain technology will be exploited to develop a decentralized, secure, and cognitive networking and computing infrastructure for deep space exploration” https://ift.tt/2HvKnOu https://ift.tt/2HvKnOu https://ift.tt/2EOrZLH",0.085,0.81,-0.1531
2018-04-16 10:24:29,0,1,cryptobots,Psst! A Top Tip Social Network Maybe about to Launch an ICO #ethereum #eth #altcoin https://t.co/3Mjpmgvl2p - Crypto Insider Info - Whales's,0.104,0.896,0.2714
2018-04-16 10:37:40,0,1,cryptobots,Resistance Ahead: Bitcoin Bulls Seek Move Above $8500 #blockchain #ethereum #crypto https://t.co/LISv8evJOM - Crypto Insider Info - Whales's,0.0,1.0,0.0
2018-04-19 09:11:47,0,1,cryptobots,Ethereum (ETH) Chart Nears Potential Upside Breakout #blockchain #bitcoin #fintech https://t.co/hjUESByaqY - Crypto Insider Info - Whales's,0.0,1.0,0.0
2018-04-19 09:20:00,0,1,BlockChain,Why does Abra choose Litecoin instead of Ethereum?,0.0,1.0,0.0
2018-04-19 11:10:42,0,1,CryptoCurrencies,Ethereum: We need cryptocurrency wallets that are both user-friendly and secure,0.194,0.806,0.34
2018-04-19 18:08:06,0,1,cryptobots,Chinese Bazaars in Moscow are Home to Some of the Most Active Crypto Traders #ethereum #crypto #ico https://t.co/4dzBxSmHr4 - Crypto Insider Info - Whales's,0.125,0.875,0.4576
2018-04-19 18:08:33,0,1,readit,New Ethereum Recovery Proposal Heralds Some Interesting Changes,0.278,0.722,0.4019
2018-04-19 18:19:58,0,1,CryptoCurrencies,Safer Smart Contracts for Ethereum with Perun,0.524,0.476,0.6705
2018-04-18 13:43:18,1,1,AlternativeCoin,"As Yours.org , CoinText.io &amp; Memo.cash attest, instant, reliable, super-cheap microtransactions are one of the killer apps for Bitcoin Cash (BCH). This is something BTC can not compete with. Neither can Litecoin. Neither can Ethereum.",0.0,0.885,-0.6486
2018-04-18 13:44:48,0,1,CryptoCurrency,"Talao is the first Ethereum-based DAO for Talent, which introduces a unique way for users to own their data thanks to a secure digital vault storing their certificates on the blockchain.",0.238,0.762,0.7964
2018-04-19 15:29:41,1,1,CryptoCurrency,A leap towards Blockchain Adoption. Enigma $ENG has joined Enterprise Ethereum Alliance and Decentralized Identity Foundation .,0.0,1.0,0.0
2018-04-19 16:59:58,0,1,AlternativeCoin,Blockchain Marketing Platform SETHER Joins The Enterprise Ethereum Alliance,0.0,1.0,0.0
2018-04-19 16:19:41,0,1,ethdev,"We're been working on Sybil, or ""Gravatar for Ethereum."" Here's a sneak peek.",0.0,1.0,0.0
2018-04-19 20:15:26,0,1,EthereumClassic,NASA Researches Ethereum Blockchain Tech for Deep Space Exploration,0.192,0.808,0.2263
2018-04-20 07:53:01,0,1,cryptobots,Swing #ethereum #altcoins #altcoin https://t.co/DrUWuiZ2l6 - Crypto Insider Info - Whales's,0.0,1.0,0.0
2018-04-20 06:42:05,0,1,Ripple,$1 per Ripple (XRP) Might Be Around The Corner - Ethereum World News,0.0,1.0,0.0
2018-04-19 14:28:29,0,1,CarVDB,CarVDB Mobile Application and car diagnostics tool presented for the first time! #CarVDB #ICO #Crowdsale #ETH #Ethereum #Token #Crypto #Bitcoin #Micochenuevo,0.0,1.0,0.0
2018-04-19 10:53:13,0,1,coinzine,"Bitcoin Back to $8,250, Ethereum and ERC20 Tokens Secure Momentum",0.211,0.789,0.34
2018-04-19 14:20:17,0,1,ethereum,Ethereum Has The Potential To Break $600 Today! – Crypto Daily,0.0,1.0,0.0
2018-04-19 10:22:39,0,1,cryptobots,NASGO Invited to Speak at First World Blockchain Conference #ethereum #altcoin #fintech https://t.co/EQz7IhqEsg - Crypto Insider Info - Whales's,0.0,1.0,0.0
2018-04-19 10:24:58,1,1,CryptoCurrency,What was the attitude when Ethereum was released?,0.0,1.0,0.0
2018-04-19 14:00:24,0,1,cryptobots,Thinking About Starting Your Own Online Casino? It’s Easier than You Think #ethereum #altcoins #ico… https://t.co/mFJJj6R2RL - Crypto Insider Info - Whales's,0.128,0.872,0.4215
2018-04-19 21:36:25,0,1,cryptobots,GIFcoin Moon-Bound as Stage Three of Their TokenSale Sells Out #cryptocurrency #ethereum #altcoins… https://t.co/iefTQzfjZA - Crypto Insider Info - Whales's,0.0,1.0,0.0
2018-04-19 23:22:10,0,1,ethereum,"I'm interested in the ""Scorched earth contract"" Vitalik talks about in this tweet and linked article. Anyone know of anything similar to this using Ethereum smart contracts?",0.178,0.822,0.6597
2018-04-19 22:48:18,0,1,ethdev,Building an Ethereum Firebase User profile Dapp (Part 2),0.0,1.0,0.0
2018-04-20 12:36:59,0,1,ethereum,Avoid Evil Twins: every ethereum app pays the price of a chain split,0.0,0.602,-0.765
2018-04-20 08:41:17,0,1,InitialCoinOfferings,TalaoDAO is the first Ethereum-based Talent Autonomous Organisation dedicated to talent who seek to be truly independent!,0.476,0.524,0.8955
2018-04-20 11:50:37,0,1,Crypto_Currency_News,IAGON Joins The Enterprise Ethereum Alliance,0.0,1.0,0.0
2018-04-20 11:55:58,0,1,CryptoCurrencies,A fork of Ethereum to power the future of organizations - First live project to create digital organizations,0.123,0.877,0.2732
2018-04-21 22:28:48,0,1,XRP,"Proof Of Weak Hands Tutorial (Earn Free Ethereum, No Risk Of Exit Scam)",0.169,0.462,-0.4404
2018-04-21 15:36:12,0,1,cryptobots,Litecoin Weekly Price Analysis – April 21 #cryptocurrency #ethereum #altcoins https://t.co/IUEuftfaOw - Crypto Insider Info - Whales's,0.0,1.0,0.0
2018-04-20 19:00:50,0,1,AlternativeCoin,Ethereum based coins (ERC20) and the switch to ERC223,0.0,1.0,0.0
2018-04-20 21:42:16,0,1,ICOinfo,Amazon Web Services Releases Blockchain Frameworks For Ethereum And Hyperledger Fabric,0.145,0.855,0.1779
2018-04-20 21:21:20,0,1,cryptobots,We're giving away $500 of Ethereum to one lucky reader #bitcoin #crypto #eth https://t.co/yUqvTNNAbC - Crypto Insider Info - Whales's,0.245,0.755,0.6369
2018-04-20 23:05:20,0,1,GGCrypto,"We Met The Founder Of Ethereum, VICE on HBO.",0.0,1.0,0.0
2018-04-22 23:37:40,0,1,u_Wavygravy89,"We Met The Founder Of Ethereum, VICE on HBO",0.0,1.0,0.0
2018-04-24 06:49:04,2,1,Biotron,"BTRN listed on IDEX, Ethereum based decentralized smart contract exchange!",0.249,0.751,0.4574
2018-04-30 03:08:13,0,1,krownio,Is Nicehash More Profitable Than Ethereum Mining?,0.347,0.653,0.4927
2018-04-24 20:15:59,0,1,GDAX,Support for Ethereum forks and the like,0.51,0.49,0.6369
2018-04-25 23:48:47,0,1,u_SangCrypto,#Crypto #Bitcoin #ICO #bounty #altcoins #bitcointalk #1DDriv #IFB #followme #followback #follow4follow #BTC #Ethereum #ETH #Airdrop #Cryptocurrency,0.0,1.0,0.0
2018-04-26 14:54:23,0,1,educationvideos,[Download] Bitcoin &amp; Ethereum Course (2 Course Bundle) by Saad Tariq,0.0,1.0,0.0
2018-04-26 14:50:37,0,1,BestLifeHack,ơGET] Bitcoin &amp; Ethereum Course (2 Course Bundle) by Saad Tariq,0.0,1.0,0.0
2018-04-26 14:58:42,0,1,u_EventHacks06,[Download] Bitcoin &amp; Ethereum Course (2 Course Bundle) Last updated 3/2018,0.0,1.0,0.0
2018-04-26 03:25:03,1,1,Bitconnect,Interview With Pooh Coin Developer Kenny Pacheco - EARN ETHEREUM PASSIVELY ON A SMART CONTRACT!,0.217,0.641,0.3164
2018-04-28 12:50:12,0,1,GDAX,(4/28/18) Bitcoin/LiteCoin/Ethereum Chart Analysis! (BotMentality),0.0,1.0,0.0
2018-04-27 18:18:36,1,1,infura,Is there a way to deploy a contract on Ethereum blockchain using Infura? Me and my team are trying to do it using raw transactions but we are struggling.,0.0,0.875,-0.5719
2018-04-26 19:32:25,0,1,u_mrrobot827297,Parity Has ‘No Intention’ to Split Ethereum over $320 Million in Frozen ETH,0.0,1.0,0.0
2018-04-26 20:07:24,0,1,XLNT,Cryptopurr — Facebook for CryptoKitties built on Ethereum,0.0,1.0,0.0
2018-04-27 01:59:12,2,1,xyMarket,"[H] Rocket League (Global), Age of Empires II HD (SEA Region) [W] Bitcoin / Ethereum / Icon / PUBG Keys",0.0,1.0,0.0
2018-04-22 21:54:34,0,1,AlternativeCoin,Ethereum creator Vitalik Buterin featured on HBO's VICE...,0.0,1.0,0.0
2018-04-23 07:48:11,0,1,cryptobots,Food Is the Next Frontier on the Blockchain Horizon #bitcoin #ethereum #ico https://t.co/h3tknr2iUu - Crypto Insider Info - Whales's,0.0,1.0,0.0
2018-04-23 08:07:36,0,1,ethereum,Amazon Web Services Introduces Ethereum and Hyperledger Blockchain Templates,0.175,0.825,0.1779
2018-04-23 08:10:49,0,1,misc,Im sure it will succeed! Great startup. This is a project that will grow and bring benefits to investors! Project have been nominated as one of the most promising upcoming ICO's. #ethereum Do not miss the news and follow the updates!,0.34,0.66,0.9478
2018-04-23 08:53:14,0,1,CryptoCurrency,"Which Altcoin Could Hit $20 First? – Ethereum Classic (ETC), OmiseGo (OMG), Qtum (QTUM)",0.0,1.0,0.0
2018-04-23 03:45:48,0,1,ethereum,"Bitcoin, Ethereum, Ripple and Other Cryptos Zooming Higher",0.0,1.0,0.0
2018-04-23 06:49:57,0,1,AlternativeCoin,Why This Company Aiming to Raise Over $25million Chose Stellar (XLM) Over Ethereum,0.0,1.0,0.0
2018-04-23 05:22:09,0,1,cryptobots,No token effort: Blockchain can make esports more transparent #blockchain #bitcoin #ethereum https://t.co/nMDypEQmoc - Crypto Insider Info - Whales's,0.0,0.879,-0.296
2018-04-23 09:21:15,0,1,cryptobots,AI Crypto Aims to Put AI Industry on the Blockchain #ethereum #eth #altcoin https://t.co/u4Q1mR5Zk2 - Crypto Insider Info - Whales's,0.0,1.0,0.0
2018-04-23 09:45:21,1,1,noncensored_bitcoin,[uncensored-r/CryptoCurrency] Tron is getting ready to fight Ethereum...launches $1 Billion fund,0.177,0.638,-0.0258
2018-04-23 09:08:47,0,1,cryptobots,Iran bans banks from cryptocurrency trading #bitcoin #ethereum #eth https://t.co/wWRThVD95g - Crypto Insider Info - Whales's,0.0,1.0,0.0
2018-04-22 09:27:09,1,1,CryptoCurrency,TRON’s $1.7M Airdrop To Ethereum Community Is A Potential Killer,0.0,0.65,-0.6486
2018-04-22 05:06:06,0,1,cryptobots,Considers Bitpay as Coinbase Terminates Merchant Proc... #cryptocurrency #ethereum #altcoin… https://t.co/ax9Lf8tiFQ - Crypto Insider Info - Whales's,0.0,1.0,0.0
2018-04-22 05:17:32,1,1,ethereum,A promising Ethereum Trading Indicator,0.474,0.526,0.4019
2018-04-22 15:59:01,0,1,u_JohnPNjui,The Case For Bitcoin Cash (BCH) Is Still Strong - Ethereum World News,0.231,0.769,0.5106
2018-04-22 16:06:11,0,1,SAtechnews,Beware dodging SARS on your Bitcoin and Ethereum mining profits,0.236,0.65,0.3612
2018-04-22 15:38:22,0,1,ethereum,"Hi everyone, would like to know how ethereum works from the view point of a Entrepreneur who would like to start start-up.",0.208,0.792,0.6124
2018-04-23 01:14:07,0,1,bitnewsbot,"Ethereum Takes $620, How Might the Parity Vote Affect Markets?",0.0,1.0,0.0
2018-04-23 01:52:07,0,1,TheCryptoTips,DAO 2.0 is here. @eIncHQ is a fork of ethereum that lets you setup a decentralized autonomous organization. Signup for the Airdrop and Whitelist yourself for ICO. https://t.co/IHscymsZ2u #dao #ethereumfork #etherinc #einc #ICO,0.0,1.0,0.0
2018-04-23 01:59:28,0,1,cryptobots,Ethereum ERC721 token for software licensing – Ravikant Agrawal – Medium #bitcoin #eth #ico https://t.co/xlZ3hCO4fg - Crypto Insider Info - Whales's,0.0,1.0,0.0
2018-04-22 16:28:43,0,1,Cryptoalert,Genesis London Conference: Study Shows Ethereum is More Decentralized Than Bitcoin,0.0,1.0,0.0
2018-04-22 19:13:33,0,1,CryptoCurrencies,Amazon Web Services Brings Blockchain Templates for HyperLedger and Ethereum,0.159,0.841,0.1779
2018-04-22 17:20:39,0,1,cryptobots,Kraken Considers the NYAG Investigation “Unfair” due to Schneidermann’s Lack... #ethereum #btc #altcoins… https://t.co/Ig4ia22b6l - Crypto Insider Info - Whales's,0.0,1.0,0.0
2018-04-22 04:02:39,1,1,altcoin,Altcoins Igniting But Ethereum Founder Isn’t Ready for Liftoff,0.289,0.711,0.5023
2018-04-23 03:31:40,0,1,Elysian_ELY,Check out our $1500 Ethereum Giveaway on the Gleam platform this week!,0.0,1.0,0.0
2018-04-23 00:01:58,0,1,cryptobots,Do Crypto Trading Bots Really Work? #blockchain #ethereum #ico https://t.co/rFvFvi2jey - Crypto Insider Info - Whales's,0.0,1.0,0.0
2018-04-23 06:16:28,0,1,u_Berithcoin,[ANN]Berith Ethereum Hackathon a runner-up,0.0,1.0,0.0
2018-04-24 07:33:30,1,1,altcoin,TRON Launches Generous Airdrop for the Ethereum Community,0.32,0.68,0.5106
