date,num_comments,score,subreddit,title,pos,neu,compound
2018-06-15 13:25:22,0,1,BitcoinDayTrade,"""EOS mainnet goes live, after the 150 mln token vote threshold was hit to validate the EOSIO blockchain https://t.co/BJZhiSrhSc"" $btc $ltc $neo $eth #btc #bitcoin #crypto #ethereum",0.088,0.912,0.3612
2018-06-15 14:10:17,0,1,BitcoinDayTrade,"""William Shatner is the spokesperson for the Bitcoin mining startup Solar Alliance. https://t.co/ckTnonaRpn"" $btc $ltc $neo $eth #btc #bitcoin #crypto #ethereum",0.0,1.0,0.0
2018-06-15 13:36:07,0,1,CryptoCurrency,"Bitcoin and Ethereum ‘Not a Security’ explains SEC, causing prices to rebound",0.0,1.0,0.0
2018-06-15 05:21:56,0,1,u_alexsafadeeva,#ethereum #bitcoinsallday #bitcoinvalue #bitcoinprice #bitcoinminer,0.0,1.0,0.0
2018-06-15 05:01:48,0,1,bprogramming,Ethereum is not a security?,0.0,0.596,-0.2584
2018-06-16 08:17:01,0,1,CryptoNull,Crypto Markets Rebound After News the US SEC Will not Consider Ethereum a Security,0.0,0.855,-0.2584
2018-06-16 08:18:23,0,1,ambcrypto,ICYMI: Bitcoin [BTC] was created by NSA says Co-Founder of Ethereum [ETH],0.154,0.846,0.25
2018-06-16 08:20:10,0,1,BitcoinDayTrade,"""#CT_index Meet fresh new BTC ETH Price Index provided specially for you by Cointelegraph https://t.co/5VJgoU26GB https://t.co/eHXO1TQLJP"" $btc $ltc $neo $eth #btc #bitcoin #crypto #ethereum",0.091,0.909,0.3182
2018-06-16 08:51:18,0,1,CryptoCurrencyTesting,ICYMI: Bitcoin [BTC] was created by NSA says Co-Founder of Ethereum [ETH] (AMBCrypto) - (CC News Feed),0.118,0.882,0.25
2018-06-16 07:49:21,0,1,ethereum,"Paxos To Add Ethereum, Litecoin, Bitcoin Cash And Stellar – Crypto Daily™",0.0,1.0,0.0
2018-06-16 10:11:17,0,1,Bitcoin,Ethereum [ETH] on the rise assures Brian Kelly,0.247,0.753,0.3182
2018-06-16 12:22:17,0,1,BitcoinDayTrade,"""The Tezos Foundation will start imposing know-your-customer and anti-money laundering (KYC/AML) checks on all its investors. https://t.co/HOA6xQ6kAo"" $btc $ltc $neo $eth #btc #bitcoin #crypto #ethereum",0.0,0.945,-0.1027
2018-06-16 11:34:31,0,1,ethereum,Ethereum to Launch Casper and Sharding Upgrades at the Same Time,0.0,1.0,0.0
2018-06-16 14:06:37,0,1,cryptobots,Top Management for International Blockchain Capital (IBC) Join... #ethereum #altcoin #fintech Hada DBank… https://t.co/7HnDkVNF2L - Crypto Insider Info - Whales's,0.096,0.904,0.2023
2018-06-16 14:14:35,1,1,ethtrader,Crypto trader explains 3 reasons ethereum is a better bet than bitcoin,0.244,0.756,0.4404
2018-06-15 22:46:37,0,1,cryptovideos,Tone Vays - Bitcoin &amp; Ethereum - How Will SEC Regulations Affect Crypto,0.0,1.0,0.0
2018-06-15 22:48:25,0,1,dapps,"The sidebar says, ""Below you have an overview of all players on the market"" but then only lists Ethereum and Lisk. Where are the rest?",0.0,1.0,0.0
2018-06-16 01:24:46,0,1,cryptobots,"Stocks, Bitcoin Aren't As Tied as Market Thinks #ethereum #crypto #ico nasdaq news https://t.co/Rs2Z1HOmGp - Crypto Insider Info - Whales's",0.0,1.0,0.0
2018-06-16 01:27:16,0,1,ethos_io,SEC deems Bitcoin and Ethereum not a security!,0.0,0.72,-0.3244
2018-06-16 00:50:32,0,1,CryptoCurrencyTesting,"Bitcoin, Ethereum, Ripple, Bitcoin Cash, EOS, Litecoin, Cardano, Stellar, IOTA: Price Analysis, June 15 (Cointelegraph) - (CC News Feed)",0.0,1.0,0.0
2018-06-16 03:50:31,0,1,CryptoCurrencyTesting,Ethereum to Combine Casper and Sharding Upgrades (Cointelegraph) - (CC News Feed),0.0,1.0,0.0
2018-06-26 20:12:58,0,1,u_Kxlebsama,Ethereum and Bitcoin,0.0,1.0,0.0
2018-06-23 04:44:33,0,1,u_coinmonks,Build a DApp using Ethereum and Angular 6 – Coinmonks – Medium,0.0,1.0,0.0
2018-06-25 18:00:48,0,1,ethtrader,Daily Ethereum Update (6/25/18) + Technical Analysis,0.0,1.0,0.0
2018-06-25 22:08:31,0,1,CryptoCurrency,Ethereum Classic (ETC) Might Soon End Up On The Top 10 List Of Cryptocurrencies!,0.139,0.861,0.2714
2018-06-25 20:09:29,0,1,BitcoinDayTrade,"""It’s more difficult to spot fake reviews on shopping websites than you might think. Blockchain technology could mean you wouldn’t have to #CT_sponsored https://t.co/36LFpDaWcY"" $btc $ltc $neo $eth #btc #bitcoin #crypto #ethereum",0.0,0.836,-0.7089
2018-06-25 23:20:20,0,1,cryptobots,Andreessen Horowitz Hires First Female General Partner for Crypto Fund #ethereum #btc #ico Blockchain… https://t.co/HbdIL5DAZF - Crypto Insider Info - Whales's,0.0,1.0,0.0
2018-06-25 23:24:36,0,1,BitcoinDayTrade,"""Venture capital firm Andreessen Horowitz hires first woman as a general partner for its newly formed cryptocurrency fund https://t.co/8O7apKgftY"" $btc $ltc $neo $eth #btc #bitcoin #crypto #ethereum",0.0,1.0,0.0
2018-06-25 23:56:42,0,1,CryptoCurrency,"Bitcoin, Ethereum, Ripple, Bitcoin Cash, EOS, Litecoin, Cardano, Stellar, IOTA, Tron: Price Analysis, June 25",0.0,1.0,0.0
2018-06-25 19:23:52,2,1,CryptocurrencyICOs,LockTrip is first with 0% commission on bookings. With 30% cheaper prices a true competitor to bookingcom expedia airbnb etc. This project on the Ethereum blockchain already has a working product. New accounts will receive LOC tokens and an affiliate program will start soon to receive more rewards.,0.123,0.877,0.7346
2018-06-26 09:28:23,0,1,Cryptalk,Ethereum (ETH): Losing 50% Against Bitcoin Since Last Summer,0.0,0.755,-0.3818
2018-06-26 09:46:25,0,1,BitcoinExchangeGuide,"Enjin Creates, Launches ERC-1155 Ethereum Token For Gaming Blockchain Standard",0.189,0.811,0.2732
2018-06-26 09:53:21,0,1,Bitcoin,"Ethereum, Zcash, Monero | Mining Rig Farm In India | Technical Bhardwaj",0.0,0.857,-0.128
2018-06-26 10:58:39,0,1,CryptoCurrencies,"Europe’s Canabis Company, Royal Queen, Adopts Verge (XVG) - Ethereum World News",0.145,0.855,0.1779
2018-06-26 13:46:25,0,1,BitMarket,"[WTS] Adobe Creative Cloud All Apps upgrade service [W] Bitcoin, Litecoin, Dash, Ethereum",0.195,0.805,0.4404
2018-06-26 15:17:57,0,1,Cryptoalert,Ethereum Analysis: ETH/USD Back in Downtrend,0.0,1.0,0.0
2018-06-26 15:35:47,0,1,u_Airalab,How can Ethereum be used in industry 4.0?,0.0,1.0,0.0
2018-06-26 15:23:43,0,1,TREZOR,Need to access private ethereum key but lost seed.,0.0,0.731,-0.4497
2018-06-26 15:26:35,0,1,thrillerpodcast,"Ethereum Classic (ETC) is Moving Up with RADEX, Coinbase and New Listings",0.0,1.0,0.0
2018-06-26 15:09:29,8,1,noncensored_bitcoin,"[uncensored-r/CryptoCurrency] iExec and Engima, Does ethereum need them?",0.0,1.0,0.0
2018-06-26 15:28:23,0,1,cryptos,Ethereum Price BOOST: Crypto value ROCKETS nearly 10% TODAY,0.455,0.545,0.7034
2018-06-23 08:06:09,0,1,ethereum,"Chinese Police Seize 200 Bitcoin, Ethereum Mining Rigs Over Electricity Theft",0.0,1.0,0.0
2018-06-23 08:57:17,0,1,BitcoinExchangeGuide,Ethereum (ETH) Long-Term Price Forecast,0.0,1.0,0.0
2018-06-23 08:31:56,0,1,crypto_currency,Here Is Your Official Guideline to the Tron (TRX) Super Representative Elections - Ethereum World News,0.218,0.782,0.5994
2018-06-26 15:53:05,0,1,ethtrader,Melon Live Bug Bounty #2 starts TODAY: We put MLN 5 000 (app. CHF 130 000) into a live Melon fund on the ethereum main net. We invite you to find vulnerabilities!,0.051,0.897,0.0
2018-06-26 07:06:32,0,1,Crypto_Currency_News,Komorebi Alliance Detaching from Ethereum &amp; Price Volatility,0.0,1.0,0.0
2018-06-26 07:17:28,0,1,u_BitratesNews,Can NEO Deliver on its Promise of Being the True ‘Ethereum Killer’ Platform?,0.317,0.683,0.6249
2018-06-26 10:34:02,0,1,Tether,"Tether (USDT) Brings Another 250 Million, Funds Flow into Ethereum",0.0,1.0,0.0
2018-06-26 14:22:51,0,1,ethereum,My Ethereum Contract Boat,0.0,1.0,0.0
2018-06-26 14:08:44,0,1,ethereum,"Ethereum Community - Thanks for all the love! - I have received overwhelming support from Ethereum fans. Due to popular demand, I have expanded my Ethereum themed apparel/accessory selection! You can even pay with ETH! Check it out!",0.308,0.627,0.9164
2018-06-26 13:33:39,0,1,Cryptalk,Ethereum Price Analysis - June 26,0.0,1.0,0.0
2018-06-26 08:07:15,0,1,CryptoCurrency,Ethereum Classic Price Analysis: Can ETC/USD Continue Higher?,0.0,1.0,0.0
2018-06-26 08:12:28,0,1,todayilearned,"TIL In the crypto world, you really need to know how and where to store your cryptocurrencies to be able to safeguard your money. Boy its REALLY COMPLEX! I'm glad someone summarised what a newbie should look out for when sourcing for a crypto wallet to participate in the bitcoin, ethereum hype...",0.124,0.876,0.7792
2018-06-26 12:57:03,0,1,u_winlotto2018,What are Ethereum games and how can you benefit from it?,0.231,0.769,0.4588
2018-06-26 12:32:17,0,1,Dota2Trades,[H] TI5 TI6 TI7 Cache &amp; TI7 Immortals and Collector's Aegis [W] TF2 Keys / CS GO Keys / Bitcoin BTC / ETH Ethereum / Icon ICX / Dota 2 Items,0.0,1.0,0.0
2018-06-26 12:12:33,0,1,u_Bitball,‪Bitball new You tube Video channel ! ‬ ‪#YouTube #video #channel #social #media #crypto #currency #coin #altcoin #airdrop #bounty #live #channel #free #token #ethereum #based #erc20 #Bitball #btb #Airdropalert ‬ ‪https://www.youtube.com/channel/UCshc0oNpahxoulOhe5WwT-Q‬,0.0,1.0,0.0
2018-06-26 12:17:50,0,1,cryptos,Ethereum price drop today: Is ethereum dead? Will the crypto go back,0.0,0.61,-0.7506
2018-06-26 07:38:58,2,1,EthereumClassic,‘Ethereum Killer’ TRON’s Mainnet Activated,0.0,1.0,0.0
2018-06-26 07:39:39,1,1,BitcoinAll,Ethereum Killer TRONs Mainnet Activated,0.0,0.482,-0.6486
2018-06-26 11:26:38,0,1,thrillerpodcast,EOS (EOS) and Ethereum (ETH) Rank Highest In New Rankings by China,0.0,1.0,0.0
2018-06-26 11:26:44,0,1,thrillerpodcast,Ethereum [ETH] and Blockchain sets its tune in sync to empower music industry,0.0,1.0,0.0
2018-06-26 05:47:56,0,1,u_sravaniray,"Bitcoin, Ethereum, Ripple, Bitcoin Cash, EOS, Litecoin, Cardano, Stellar, IOTA, Tron: Price Analysis",0.0,1.0,0.0
2018-06-26 05:53:50,0,1,u_mvlchain,Register your Ethereum Wallet to Metamask,0.0,1.0,0.0
2018-06-26 06:46:01,0,1,AllThingsCrypto,Tron (TRX) Independence Day Was a Success! Eyes On Today's Super Representative Elections - Ethereum World News,0.378,0.622,0.8356
2018-06-26 17:23:59,0,1,u_cpclos,Vitalik Buterin and Vlad Zamfir -- The Ethereum Roadmap and Solving the Blockchain Scalability Problem [Hidden Forces Podcast Ep 49],0.104,0.779,-0.0772
2018-06-24 05:25:24,0,1,cryptos,"Cryptocurrency news: Cryptos PLUNGE today - why are Bitcoin, Ripple and Ethereum down? | City &amp;amp; Business | Finance",0.0,1.0,0.0
2018-06-24 07:41:09,0,1,cryptos,Ethereum &amp; Bitcoin: First Sign of Unravelling Cryptos,0.0,1.0,0.0
2018-06-24 13:32:44,0,1,AllStocksNetwork,Strong Indications from U.S. Officials that Ethereum Is Not a Security,0.247,0.6,0.3103
2018-06-24 09:44:14,0,1,Bitcoin,"Bitcoin below $6,000 as markets fall to lowest level this year - Ethereum World News",0.0,0.833,-0.3818
2018-06-24 16:57:40,0,1,BitcoinExchangeGuide,Saturn Wallet Supports Ethereum (ETH) &amp; Ethereum Classic (ETC) DApps,0.217,0.783,0.3612
2018-06-24 17:38:06,0,1,crypto,"DON'T BE A #PANICSELLER, #KeepCalm and get YOUR $QRX #tokens https://qurrex.com #Qurrex #TokenSale #bitcoin #crypto #blockchain #exchange #ICO #EOS #TRX #ADA #trading #Binance #NowPlaying #fifa #Now #freedom #money #ethereum #Sales #NY #discount",0.0,1.0,0.0
2018-06-25 03:19:18,0,1,BitcoinDayTrade,"""Ukraine’s State Service of Special Communication and Information Protection said obtaining a license is not a requirement to mine cryptocurrencies in the nation. https://t.co/nC9oNG3rQN"" $btc $ltc $neo $eth #btc #bitcoin #crypto #ethereum",0.085,0.915,0.4019
2018-06-25 03:46:11,0,1,BTCNews,Ethereum Price Drops to 2.5-Month Low Below $430,0.0,0.769,-0.2732
2018-06-23 22:19:27,0,1,BitcoinDayTrade,"""Mining industry leaders who are not afraid of high energy costs, ASIC resistance and market crashes https://t.co/szBNeElN6o"" $btc $ltc $neo $eth #btc #bitcoin #crypto #ethereum",0.08,0.92,0.2732
2018-06-23 22:06:32,0,1,cryptobots,Top Five Biggest Crypto Mining Areas: Which Farms Are Pushing Forw... #ethereum #fintech #ico Blockchain… https://t.co/UZmLG4e4WP - Crypto Insider Info - Whales's,0.087,0.913,0.2023
2018-06-24 01:53:39,0,1,cryptobots,"Crashed Monero [XMR] still breathing, added on Edge Wallet! #bitcoin #ethereum #fintech news https://t.co/wvGufpSv1I - Crypto Insider Info - Whales's",0.0,1.0,0.0
2018-06-24 06:55:51,0,1,u_Future1coinToken,"Making Money in Cryptocurrency by Shorting Bitcoin, Ethereum, Ripple, Dash etc in a Bearish Market. To Trade Cryptocurrency go to http://www.fxprimus.com/specialincentive … #Forex #cryptocurrency #trading #signals #ForexExpertDubai #KishoreMForex #ForexTrading #ForexMarket",0.0,1.0,0.0
2018-06-24 15:28:18,0,1,cryptobots,"Nebulas mainnet transaction volume exceeds Ethereum, reaching nearly 700,0... #blockchain #ethereum #eth… https://t.co/2z5jb3tu1o - Crypto Insider Info - Whales's",0.101,0.899,0.2023
2018-06-25 05:07:23,0,1,CryptoCurrency,Ethereum Price Analysis: Can ETH/USD Recover Further,0.0,1.0,0.0
2018-06-25 04:27:51,0,1,Altcoins2k18,Vitalik Buterin and Vlad Zamfir — The Ethereum Roadmap and Solving the Blockchain Scalability Problem [Hidden Forces Podcast Ep 49],0.109,0.769,-0.0772
2018-06-24 22:45:36,0,1,bitnewsbot,The Ethereum Foundation Supports Stanford Blockchain Research Center,0.263,0.737,0.3612
2018-06-25 11:39:05,0,1,BitcoinDayTrade,"""Alibaba’s Ant Financial new blockchain remittances begin with Philippines https://t.co/jdGgREO1Tw"" $btc $ltc $neo $eth #btc #bitcoin #crypto #ethereum",0.0,1.0,0.0
2018-06-25 07:04:05,0,1,BitcoinDayTrade,"""After China's ban on cryptocurrencies and cryptocurrency mining, mining firms are looking for alternative places to set up their operations such as Iceland and Kosovo. https://t.co/iCVGTzCt6w"" $btc $ltc $neo $eth #btc #bitcoin #crypto #ethereum",0.0,0.902,-0.5574
2018-06-25 07:09:17,0,1,BitcoinDayTrade,"""#CT_index Special from Cointelegraph BTC - https://t.co/5VJgoU26GB ETH - https://t.co/a2309TWpCZ https://t.co/RDMSlN8uKq"" $btc $ltc $neo $eth #btc #bitcoin #crypto #ethereum",0.144,0.856,0.4019
2018-06-25 13:18:30,0,1,Cryptalk,"Ethereum Classic [ETC] support with Metamask coming soon, says ECC Director",0.213,0.787,0.4019
2018-06-25 13:21:08,0,1,ethdev,Web3.js Intro · #1 Ethereum Blockchain Developer Crash Course | Dapp University,0.0,0.769,-0.4019
2018-06-25 13:50:49,0,1,Blockchain_Healthcare,Ethereum,0.0,1.0,0.0
2018-06-25 08:35:44,0,1,CryptoCurrencies,"The “future is bright”: Charles Hoskinson, a co-founder of Ethereum, Talked about Cryptocurrencies",0.0,1.0,0.0
2018-06-25 08:37:46,0,1,cryptos,Crypto Cult? Augur Founder Creates Ethereum-based Religion Called ...,0.208,0.792,0.2732
2018-06-25 12:20:38,0,1,Monero,EOS and Ethereum Top the Latest Chinese Government Crypto Ratings,0.167,0.833,0.2023
2018-06-25 12:48:43,0,1,cryptobots,’s Clemens Ley demonstrates how to simulate Turing machi... #bitcoin #ethereum #btc Clemens… https://t.co/HJINfqIYsy - Crypto Insider Info - Whales's,0.0,1.0,0.0
2018-06-25 06:58:13,0,1,ethereum,"Markets Shoot Up In Time For The Weekend, Bitcoin, Ethereum And Ripple Up – Crypto Daily™",0.0,0.854,-0.34
2018-06-25 06:02:32,0,1,cryptobots,Why Blockchain Asset Tracking Is Not Just for the Super-Rich #ethereum #btc #ico Articles https://t.co/YNT6cG0jYj - Crypto Insider Info - Whales's,0.122,0.878,0.3612
2018-06-25 06:10:49,0,1,AllThingsCrypto,"China’s New Crypto Rankings – EOS First, Ethereum Second, Bitcoin Drops to 17th",0.0,1.0,0.0
2018-06-25 06:42:50,1,1,BitcoinAll,"China's New Crypto Rankings - EOS First, Ethereum Second, Bitcoin Drops to 17th",0.0,1.0,0.0
2018-06-25 11:34:26,0,1,Crypto_Daily,Can This ‘New Ethereum’ Change The Face Of Altcoins?,0.0,1.0,0.0
2018-06-25 11:43:35,0,1,Bitcoin,PR: Tron Celebrates It’s Independence from Ethereum,0.381,0.619,0.5719
2018-06-25 15:49:52,0,1,cryptobots,"TOP 3 Bitcoin, Ethereum, Ripple Price Analysis: Cryptos Knocked Down To T... #bitcoin #ethereum #fintech… https://t.co/jYc8NKLiZP - Crypto Insider Info - Whales's",0.123,0.877,0.368
2018-06-25 15:54:05,0,1,BitcoinDayTrade,"""A group of European financial bodies “successfully” test a blockchain system for registering the issuance of warrants https://t.co/cqJg4OGKU1"" $btc $ltc $neo $eth #btc #bitcoin #crypto #ethereum",0.0,1.0,0.0
2018-06-25 15:01:51,0,1,u_cpclos,Vitalik Buterin and Vlad Zamfir | The Ethereum Roadmap and Solving the Blockchain Scalability Problem,0.14,0.702,-0.0772
2018-06-25 10:04:04,0,1,BitcoinDayTrade,"""John McAfee claimed on Twitter that he had been poisoned. Five hours later, he announced the launch of the Bitfi Wallet. https://t.co/Z2ETJtuZAY"" $btc $ltc $neo $eth #btc #bitcoin #crypto #ethereum",0.0,0.901,-0.4939
2018-06-25 09:20:09,0,1,CryptoCurrency,Ethereum [ETH] becomes more video-game friendly through ERC-1155 token standard,0.279,0.721,0.539
2018-07-06 21:04:37,0,1,u_StrokenTokens,How much #Cryptocurrency are you willing to put up for your #boob #fetish??? #FlashUsFriday #StrokenBounty #StrokenTokens #Stroken #StrokenDotCom #StrokenPlatform #ethereum #bitcoin #pr0n #blockchain,0.0,1.0,0.0
2018-07-03 11:37:13,1,1,u_Jesusservant,Why WONO doesn’t use Ethereum?,0.0,1.0,0.0
2018-07-05 15:32:44,0,1,u_StrokenTokens,Meet the #StrokenTokens Superhero!! 💪 @TekCEOJames ow.ly/2ePD30kJ5f5 #Stroken #StrokenDotCom #StrokenPlatform #Cryptocurrency #ethereum #bitcoin #cryptolife #hodl #Adultfun,0.0,1.0,0.0
2018-07-05 15:40:41,0,1,u_StrokenTokens,The #strokenplatform will be accepting #ethereum!💰💰 #blockchain #crypto #coins #ETH #moresoon,0.224,0.776,0.4389
2018-07-02 17:23:51,0,1,u_nhinhi8888,"#BuddyICO #ICO #Crypto #Automation #DevOps #bitcoin, r / #ethereum, r / #ethtrader, r / #Tokensalecrypto, r / #cryptocurrency",0.0,1.0,0.0
2018-07-04 03:52:52,1,1,u_thuyduongxamy,buglab Cybersecurity Penetration Testing on the Ethereum Blockchain • r/buglabProject,0.0,1.0,0.0
2018-07-05 12:37:42,0,1,RubiusICO,MUST READ: Ethereum is Cheaper and Faster than Bitcoin – Rubius Inc. – Medium,0.0,1.0,0.0
2018-07-01 20:23:18,0,1,Crypto_Curency_News,Move over CryptoKitties - FCoin listing vote takes over 40% of the Ethereum network,0.0,1.0,0.0
2018-07-02 06:28:16,2,1,CryptoNews,Ethereum Price Analysis: ETH/USD Could Break Higher,0.0,1.0,0.0
2018-07-02 05:36:52,0,1,CryptoTechnology,What's this person trying to do? (Ethereum),0.0,1.0,0.0
2018-07-02 05:54:06,2,1,SigloCoin,SIGLO - Platform Baru pada Blockchain Ethereum,0.0,1.0,0.0
2018-07-02 15:26:00,1,1,CryptoCurrency,Is Ethereum a better long term investment (10 year horizon) than Bitcoin?,0.225,0.775,0.4404
2018-07-02 15:32:30,1,1,ethereum,Most commonly used/recognized identicon in the Ethereum comunity?,0.0,1.0,0.0
2018-07-02 14:02:27,0,1,EthereumClassic,Ethereum Classic (ETC) Announcements for the last 7 days,0.0,1.0,0.0
2018-07-02 14:13:14,0,1,ethereum,FIFA World cup Ethereum memorabilia,0.0,1.0,0.0
2018-07-02 13:52:53,0,1,cryptobots,"-10 Ethereum Fees Spike to $1 Even as Transactions Fall to 600,000 $ETH #ethereum #cryptocurrency https://t.co/tRhWbZ2muI - Crypto Insider Info - Whales's",0.0,1.0,0.0
2018-07-02 14:38:09,0,1,Cryptalk,Ethereum (ETH) Co-Founder Vitalik Buterin Attacks Apple for Its Attitude Towards Cryptocurrency Apps,0.0,0.805,-0.4404
2018-07-02 15:44:44,0,1,Bitcoin,Over $1 Million Stolen Fund: ICO Influencer Ian Balina Revealing Identities Of Hackers - Ethereum World News,0.0,0.824,-0.4939
2018-07-02 16:43:25,0,1,BlockchainStartups,Ethereum Developers: Tips To Hiring The Right Choice,0.0,1.0,0.0
2018-07-02 21:43:37,0,1,Cryptalk,Ethereum Classic as one of seven officially recognized cryptocurrency in Thailand,0.0,1.0,0.0
2018-07-04 23:41:22,0,1,cryptobots,AI Feeds on 100 ICO Papers to Publish One of its Own #blockchain #ethereum #altcoin ico https://t.co/IMYgkMPcJs - Crypto Insider Info - Whales's,0.0,1.0,0.0
2018-07-03 15:09:37,0,1,Crypto_General,"Coinbase Custody Officially Launched, Offering a Gateway For Institutional Investors into Crypto - Ethereum World News",0.103,0.897,0.128
2018-07-03 13:52:20,0,1,Bitcoin,"Ripple and Bitcoin in rallies after rebound from the supports, ethereum, eos, bitcoin cash, litecoin, tron and cardano increase in value",0.286,0.714,0.7351
2018-07-02 16:58:33,0,1,CCnews24,Ethereum Sharding and Raiden network are inevitable for continuous growth,0.224,0.776,0.3818
2018-07-02 17:05:31,6,1,ethtrader,Ethereum - Where The Price is Heading Next? Technical Analysis 7/2/18,0.0,1.0,0.0
2018-07-02 17:07:39,1,1,CryptoCurrencies,"NEO vs Ethereum vs Cardano - Battle of the ""Me Too"" Platforms",0.0,0.794,-0.3818
2018-07-03 18:41:26,0,1,zerohedge,Why Are The Sacramento Kings Mining Ethereum?,0.0,1.0,0.0
2018-07-05 05:12:10,0,1,Cryptalk,Ethereum Price Analysis: ETH/USD Holding 100 SMA,0.0,1.0,0.0
2018-07-05 05:43:55,1,1,ethereum,"Ethereum Price Analysis, July 5. ETH/USD Bullish Pattern",0.0,1.0,0.0
2018-07-03 13:38:32,0,1,Cryptalk,"ChainSecurity releases full version of Securify, advanced security scanner for Ethereum",0.328,0.672,0.5267
2018-07-03 08:17:43,0,1,cryptobots,Blockchain Summit London 2018 recap #blockchain #ethereum #altcoin Bitcoin Cash https://t.co/i9abAGIss3 - Crypto Insider Info - Whales's,0.0,1.0,0.0
2018-07-04 08:41:17,0,1,airdrops,"Mobile virtual network operator (MVNO) that provides high- quality international call and browsing services in one SIM card, making it possible for its clients to retain their privacy rights and earn biweekly rewards thanks to the tokenization of the company’s assets in Ethereum blockchain.",0.158,0.842,0.7717
2018-07-03 22:13:35,0,1,CryptoCurrency,"Crypto Market Jumps $40 Billion in 2 Days – Bitcoin, Ethereum and XRP Record Major Gains",0.156,0.844,0.34
2018-07-04 07:58:22,0,1,cryptobots,Eligma in Silicon Valley: A meeting with key figures of the crypto univer... #ethereum #crypto #altcoins… https://t.co/X5pA5YgruH - Crypto Insider Info - Whales's,0.0,1.0,0.0
2018-07-04 04:37:18,0,1,BitcoinExchangeGuide,MIMIR Blockchain Solutions Announces Eth-Mail Private Ethereum Messaging Protocol,0.175,0.825,0.1779
2018-07-04 01:36:20,0,1,Birrency,"Bitcoin, Ethereum, Ripple, Bitcoin Cash, EOS, Litecoin, Cardano, Stellar, IOTA, Tron: Price Analysis, July 2",0.0,1.0,0.0
2018-07-04 08:34:34,0,1,CryptoComes,"Bitcoin, Ethereum, Ripple, EOS, NEM Stop Growing, But Bullish Look Remains: Price Analysis, July 4",0.09,0.803,-0.0644
2018-07-04 19:53:32,0,1,ethereum,From people thinking I was crazy 6 years ago to Ethereum being mentioned in the Nathan's Hot Dog Eating Contest on ESPN. I've never felt more validated in my life!,0.0,0.85,-0.5536
2018-07-04 17:02:10,1,1,CryptoCurrency,The Request Network Foundation Joins The Enterprise Ethereum Alliance https://ift.tt/2lVuNQ0 https://ift.tt/2lVuNQ0 https://ift.tt/2No8bEp,0.0,1.0,0.0
2018-07-04 18:04:24,0,1,GGCrypto,The Request Network Foundation Joins The Enterprise Ethereum Alliance,0.0,1.0,0.0
2018-07-04 19:05:41,0,1,Bitcoin,It's really great !!! free ethereum mining,0.639,0.361,0.87
2018-07-04 20:41:55,0,1,cryptobots,The Cryptocurrency Market Upticks Today: The Technicals Look Favorable #blockchain #ethereum #crypto… https://t.co/spuDyZNTUb - Crypto Insider Info - Whales's,0.162,0.838,0.4767
2018-07-04 20:49:05,0,1,CryptoCurrency,We Are Giving Away 20.000 Ethereum!!!,0.396,0.604,0.5067
2018-07-02 19:45:45,0,1,ethereum,The Truth about Ethereum,0.434,0.566,0.3182
2018-07-02 17:38:43,0,1,ethereum,Spectrocoin eth withdrawals are indefinitely pending / They are blaming the Ethereum blockchain,0.0,0.775,-0.4939
2018-07-02 19:22:16,0,1,CoinsCalendar,Ethereum Classic (ETC) - ETC/USDT Pair on CoinTiger - 02 Jul 2018,0.0,1.0,0.0
2018-07-03 07:21:32,0,1,ethtrader,Ethereum Transaction Fees Increase by 7000% Due to Network-Clogging Airdrops,0.204,0.796,0.3182
2018-07-03 07:33:27,0,1,cryptobots,Crypto PowerRanks: Build your crypto trading plan #bitcoin #ethereum #ico https://t.co/2QnWXMgMj6 - Crypto Insider Info - Whales's,0.0,1.0,0.0
2018-07-03 07:41:27,0,1,u_winlotto2018,Online Ethereum Game allowed speculators to make a lot of money.,0.0,1.0,0.0
2018-07-03 09:08:16,1,1,BitcoinAll,Ethereum Transaction Fees Increase by 7000% Due to Network-Clogging Airdrops - Chainstate,0.187,0.813,0.3182
2018-07-05 19:29:05,0,1,CryptoCurrency,"Vitalik thoughts of NEO and ""Ethereum of China""",0.0,1.0,0.0
2018-07-06 06:46:06,0,1,ethereum,What does the Ethereum community think of ICX?,0.0,1.0,0.0
2018-07-06 06:56:08,0,1,cryptobots,6 Crypto Investing Principles #bitcoin #ethereum #ico https://t.co/C70DyPhJQG - Crypto Insider Info - Whales's,0.0,1.0,0.0
2018-07-06 06:36:00,2,1,ethereum,Details for private testing of Trinity (TNC) pilot project Blockchain game WOB based on Ethereum coming soon!,0.0,1.0,0.0
2018-07-06 00:30:46,0,1,ethereum,Viewly built on Ethereum technology.,0.0,1.0,0.0
2018-07-06 03:13:22,0,1,BitcoinAll,Bitcoin mentioned around Reddit: Buying Bitcoin or ethereum. /r/CryptoCurrencies,0.0,1.0,0.0
2018-07-06 10:10:38,1,1,CryptoCurrency,What is the difference between bitcoin and ethereum?,0.0,1.0,0.0
2018-07-06 10:33:43,0,1,Crypto_Daily,"Ethereum Classic Runs Away From Market Decline, Is A Coinbase Listing Imminent?",0.0,1.0,0.0
2018-07-06 10:42:16,0,1,Cryptalk,Digital Collectible on Ethereum Network Sold For $1 Million on Valentine’s Day,0.0,1.0,0.0
2018-07-06 11:23:56,0,1,cryptobots,Leadership means “People who join Ethereum are joining a Community they can trust to advance efficiencies and evolu… https://t.co/OJ0TPnxUZ5 - Crypto Insider Info - Whales's,0.299,0.701,0.7964
2018-07-06 11:26:34,0,1,CryptoCurrencies,Cardano (ADA) vs. Ethereum: What’s the Situation Between These Two? | Oracle Times,0.0,1.0,0.0
2018-07-06 11:56:26,0,1,cryptobots,Ethereum Classic price analysis: ETC/USD picks up the pace defyin... #cryptocurrency #fintech #ico forex… https://t.co/khFiPBwAe4 - Crypto Insider Info - Whales's,0.0,1.0,0.0
2018-07-06 11:57:11,0,1,ethereum,Japanese Employee takes advantage of his company's free electricity to mine Ethereum,0.346,0.654,0.6486
2018-07-06 08:46:55,0,1,cryptobots,'A new era for capital markets': The Swiss stock exchange... #cryptocurrency #ethereum #ico Thomas Zeeb… https://t.co/oeiRIkyPZ4 - Crypto Insider Info - Whales's,0.0,1.0,0.0
