date,num_comments,score,subreddit,title,pos,neu,compound
2019-09-05 12:50:54,0,1,cryptonewswire,Cardano: The True Potential Of Crypto For The REAL WORLD - Benzinga,0.219,0.781,0.4215
2019-09-02 15:24:29,0,2,UpholdOfficial,We’re excited to announce that Cardano is LIVE on Uphold!,0.23,0.77,0.4003
2019-09-06 04:49:20,2,3,cardano,Would love to see some colab between Cardano and Librem 5. Both built from the ground up. Any thoughts CF?,0.181,0.819,0.6369
2019-09-02 00:18:10,1,4,thecardanoeffect,The Cardano Effect Ep.44 audio is now available!,0.0,1.0,0.0
2019-09-07 15:56:30,5,6,cardano,Roadmap for Cardano Foundation and Emurgo,0.0,1.0,0.0
2019-09-04 12:37:04,3,8,cardano,Governance on Cardano,0.0,1.0,0.0
2019-09-08 20:39:29,0,1,u_libr_co,"Cardano Wallet Upgrade, how moneygram is using xrp, Tezos , livestream recap",0.0,1.0,0.0
2019-09-08 17:59:11,0,1,cryptocurrencynews,CARDANO (ADA) - Cryptocurrency Project Review! ETHEREUM competitor?,0.0,1.0,0.0
2019-09-10 15:14:09,0,1,u_libr_co,Bitcoin Full-blown FOMO at $10k or retrace? Cardano&amp;#39;s Charles Hoskinson&amp;#39;s Many AMA&amp;#39;s ...,0.0,1.0,0.0
2019-09-11 11:34:37,0,1,BCryptoNews,An ADA Cardano Bullrun Could be Bad News For Bitcoin And Ethereum Here is Why,0.0,0.8,-0.5423
2019-09-11 15:05:14,0,1,EestiMentioned,[/r/cardano] EMURGO To Join Blockchain For Europe Association On European Tour,0.18,0.82,0.296
2019-09-11 06:31:28,0,1,TheCoinRepublic,Cardano continuously climbs up the price chart and now there is no turning back,0.0,0.855,-0.296
2019-09-13 04:46:12,0,1,Layer,ADA Cardano,0.0,1.0,0.0
2019-09-13 05:37:41,0,1,BCryptoNews,"XRP is not Manipulated by Ripple, Vanguard/XRP comments, Cardano, livestream recap",0.179,0.821,0.2924
2019-09-13 18:23:55,0,1,CoinPath,"Ethereum, Litecoin, Tron, Monero, Cardano Price Analysis: 13/09",0.0,1.0,0.0
2019-09-14 08:13:07,0,1,AllThingsCrypto,"IOTA, Cardano and Monero Price Analysis and Prediction for September 14th 2019: IOTA, ADA, and, XMR",0.0,1.0,0.0
2019-09-14 13:32:33,0,1,Crypto_Currency_News,Cardano Staking in Yoroi; CashApp Free Trading; Binance Futures &amp; 20X; Germany Fighting Libra,0.185,0.674,0.2023
2019-09-09 20:05:54,0,1,u_libr_co,"Stellar, Cardano and Binance Coin Price Analysis and Prediction for September 7th 2019: XLM ...",0.0,1.0,0.0
2019-09-14 10:11:41,1,1,worldnews,Cardano (ADA) Price Analysis: Bulls Likely to Push Price above $0.050 Mark,0.0,1.0,0.0
2019-09-14 13:54:15,0,1,altcoin,Cardano - Banking the unbanked - NostrADAmus,0.0,1.0,0.0
2019-09-13 06:06:34,0,1,TheCoinRepublic,Ada Price Analysis: Cardano Astonishes The Market With Its Massive Hike Of 4.5%,0.0,1.0,0.0
2019-09-13 15:02:56,0,1,crypto_currency,"DASH on Coinbase; Projects on Stellar; Cardano Community Manager; Cubans + Bitcoin, Gold Buying",0.0,1.0,0.0
2019-09-14 17:12:52,0,1,CupOcrypto,Breaking down the Cardano Roadmap!,0.0,1.0,0.0
2019-09-11 21:42:27,0,1,cardano,"Emurgo Releases Cardano Chain Data-importer, the 3rd Product after ADA Blockchain Explorer",0.0,1.0,0.0
2019-09-11 15:49:42,0,1,u_libr_co,"BTC prices at a premium in Argentina and HK, TRON based USDT&amp;#39;s surge, Cardano 1.6, livestream recap",0.0,1.0,0.0
2019-09-13 07:39:07,0,1,u_cryptonetworkco,Will Cardano Maintain the Recent Hike it Achieved?,0.0,1.0,0.0
2019-09-11 14:19:58,0,1,crypto_currency,Cardano 2nd Anniversary AMA Contest,0.0,1.0,0.0
2019-09-09 21:06:53,0,1,u_libr_co,You NEED To Think Bitcoin Big Picture! DigiByte | Cardano | Crypto News,0.0,1.0,0.0
2019-09-10 08:45:04,0,1,u_libr_co,"Phase 2 of Binance Lending: Support Added for Bitcoin, Ether, and Cardano",0.213,0.787,0.4019
2019-09-10 14:08:50,0,1,ABCC,Cardano (ADA) Price Hits $0.0475 on Top Exchanges,0.205,0.795,0.2023
2019-09-10 21:44:52,0,1,CryptoNews,BOLT Winners Announced ! UPDATES on ONTOLOGY | BLACAT | PHANTASMA | ELASTOS | CARDANO,0.274,0.726,0.5255
2019-09-10 13:03:21,0,1,kryptocal,"Add to your calendar Cardano (ADA) event: Croatia Meetup - September 21, 2019",0.0,1.0,0.0
2019-09-12 15:37:55,0,1,CryptoCurrency,Cardano price rose above the twenty (20) day exponential moving average (EMA) but the traders were not able to keep it there till closing time on September...Read more: https://t.co/QSsu9sKduu,0.0,1.0,0.0
2019-09-09 11:16:11,0,1,cryptolobe,Cardano Poised For An Explosive Surge As ADA Confirms Bottom,0.182,0.818,0.25
2019-09-09 10:03:53,1,1,cardano,Cryptotown.io - Realtime Price Prediction Videos For Cardano,0.0,1.0,0.0
2019-09-08 13:37:09,0,1,CryptoCurrency,"#ADA #BTC After a spectacular decline in 2019, Cardano (ADA) has likely bottomed and may soon post a major reversal. Noted cryptocurrency analyst Crypto Loomdart (@l...Read more: https://t.co/ZLLqUacawC",0.0,1.0,0.0
2019-09-13 02:02:29,1,1,cardano,Brief &amp; simple video on how a company could benefit using the Cardano platform.,0.2,0.8,0.4588
2019-09-12 01:03:57,1,2,cardano,Binance Will Launch Sept 18 w/ 6 Coins - No Cardano and No BNB :(,0.0,0.578,-0.743
2019-09-12 20:16:41,9,5,AlgorandOfficial,Cardano fan here,0.535,0.465,0.3182
2019-09-09 06:34:12,5,9,cardano,"Cardano Weekly Discussion and Question Thread - September 09, 2019",0.0,1.0,0.0
2019-09-10 13:00:36,0,10,cardano,"Add to your calendar Cardano (ADA) event: Cardano 2nd Anniversary - September 28, 2019",0.0,1.0,0.0
2019-09-12 20:35:33,4,10,thecardanoeffect,Red Team Penetration Testers and IT professionals will be joining us on The Cardano Effect this weekend. Please leave questions for them in this thread to be asked on the podcast.,0.071,0.892,0.2732
2019-09-12 17:20:08,31,10,cardano,Elevator pitch for Cardano,0.0,1.0,0.0
2019-09-12 05:56:08,7,12,cardano,Cardano is the Polis Our World Needs,0.0,1.0,0.0
2019-09-12 20:45:58,0,18,cardano,Red Team Penetration Testers and IT professionals will be joining us on The Cardano Effect podcast this weekend.,0.0,1.0,0.0
2019-09-11 02:29:24,9,20,cardano,Potential Cardano/EOS interoperability revealed -- Asterius: A Haskell to WebAssembly compiler,0.0,1.0,0.0
2019-09-12 17:01:00,11,27,cardano,Why are there so many cardano websites?,0.0,1.0,0.0
2019-09-09 02:03:39,5,41,cardano,The Cardano Effect Ep.45 audio is now available!,0.0,1.0,0.0
2019-09-12 13:00:10,8,77,cardano,EMURGO: Cardano Progress Update by Sebastien Guillemot (Sept 2019),0.259,0.741,0.4215
2019-09-14 09:16:11,8,86,cardano,"""The most promising language I’m aware of right now is the Haskell-based Plutus language developed by IOHK for the Cardano platform, but it hasn’t yet gone live on mainnet, so it’s impossible to tell yet how much traction it will get.""",0.048,0.952,0.2492
2019-09-13 01:34:18,52,123,cardano,"""The most promising language I’m aware of right now is the Haskell-based Plutus language developed by IOHK for the Cardano platform, but it hasn’t yet gone live on mainnet, so it’s impossible to tell yet how much traction it will get."" - Eric Elliott",0.045,0.955,0.2492
2019-09-15 15:11:23,0,1,cryptoall,Cardano ADA Merchants; ADA Stake Pool Node; DASH + NovaDAX; Pomp on Cash; Crypto Exchange Breach,0.0,1.0,0.0
2019-09-16 16:32:14,0,1,crypto_currency,Cardano Staking Pool UI; Bitcoin Universal Basic Income; Dashpay Mobile,0.0,1.0,0.0
2019-09-16 21:20:45,0,1,CoinPath,"Cardano devs focus on newer implementations on Daedalus, Cardano Explorer",0.0,1.0,0.0
2019-09-18 01:05:05,1,1,Wavesplatform,"Waves Ranked First by Commits in Blockchain Development, Ethereum and Cardano Follow",0.091,0.909,0.0258
2019-09-18 10:46:46,0,1,CryptoCurrency,Cardano price had been moving in an upward wedge with 0.0440 dollars being a great support mark from which the price hasn’t yet stayed low for long in the ...Read more: https://t.co/0X7eJlR6am,0.184,0.759,0.6908
2019-09-17 15:33:04,0,1,cryptosignals,Cardano Technical Analysis: Chart Patterns and Bullish Bias.,0.0,0.833,-0.1027
2019-09-18 01:38:34,0,1,TRXtrader,"Latest Price Analysis : Tron, Bitcoin Cash , Stellar , Dogecoin and Cardano",0.0,1.0,0.0
2019-09-18 01:58:33,0,1,DogeTrader,"Latest Price Analysis : Dogecoin, TRON , Bitcoin Cash , Stellar and Cardano",0.0,1.0,0.0
2019-09-19 16:15:24,0,1,cryptotrading,"Latest price analysis AND NEWS : EOS, CARDANO , Bitcoin and Tron",0.0,1.0,0.0
2019-09-20 10:24:44,0,1,CryptoCurrency,Cardano: EMURGO Releases New Open Source Product Called Tangata Manu,0.0,1.0,0.0
2019-09-20 10:33:41,3,1,cardano,is cardano the futur3,0.0,1.0,0.0
2019-09-21 17:14:52,0,1,cardano,Benefits of the Newly Released Tangata Manu to Cardano Blockchain’s Growth and Adoption,0.321,0.679,0.6369
2019-09-15 06:03:22,0,1,cryptovideos,The Crypto Lark - Cardano Evolution A Step Closer to Passive Income Crypto Rewards,0.329,0.671,0.5994
2019-09-15 16:33:52,1,1,cardano,Cryptotown.io - Cardano Price Predictions,0.0,1.0,0.0
2019-09-15 06:25:47,0,1,cryptolobe,Cardano Evolution A Step Closer to Passive Income Crypto Rewards,0.412,0.588,0.5994
2019-09-19 16:45:50,0,1,TCCP,"New The Cardano Community Podcast video: Marin Kramaric | Cardano Meetup Zagreb, Croatia",0.0,1.0,0.0
2019-09-18 14:49:50,1,1,cardano,Best exchange to buy cardano?,0.512,0.488,0.6369
2019-09-21 07:27:38,0,1,CryptoMarkets,"LATEST PRICE ANALYSIS ; NEO , VERGE , ZRX (0x) , DASH AND CARDANO (ADA)",0.0,1.0,0.0
2019-09-17 15:17:54,0,1,u_Cryptotrader029,Cardano Analysis: Bullish Bias and Chart Patterns,0.0,0.811,-0.1027
2019-09-17 14:39:53,0,1,cardano,EMURGO launches new 3rd party developer toolbox for Cardano (ADA),0.231,0.769,0.4019
2019-09-18 02:13:15,1,1,CardanoMarkets,"Latest Price Analysis : Cardano, Tron, Bitcoin Cash , Stellar and Dogecoin",0.0,1.0,0.0
2019-09-17 20:04:08,0,1,u_aminefx12,"Latest Price Analysis : TRON , Bitcoin Cash , Stellar , Dogecoin and Cardano(ADA)",0.0,1.0,0.0
2019-09-16 19:33:53,1,1,cardano,Cryptotown.io - Realtime Price Prediction Videos For Cardano,0.0,1.0,0.0
2019-09-18 23:45:40,0,1,OnlyInfotech,"Bitcoin, Ethereum, Ripple, Bitcoin Cash, EOS, Stellar, Litecoin, Cardano, Monero, IOTA: Price Analysis, August 31 | Crypto",0.0,1.0,0.0
2019-09-21 08:34:45,0,1,TalkativePeople,"/u/markstopka on Sorry if this has been asked already, but is Cardano quantum-resistant?",0.0,0.913,-0.0387
2019-09-20 19:22:13,1,1,CryptoMarkets,cardano fights over key support,0.321,0.357,0.0
2019-09-15 19:10:28,0,2,thecardanoeffect,"Cardano Community Weekly Recap September 15, 2019 | TCE 46",0.0,1.0,0.0
2019-09-16 02:38:04,1,2,thecardanoeffect,The Cardano Effect Ep. 46 audio is now available!,0.0,1.0,0.0
2019-09-18 01:47:15,0,3,xlm,"Latest Price Analysis : Stellar, TRON , Bitcoin Cash , Dogecoin and Cardano",0.0,1.0,0.0
2019-09-19 16:37:15,0,3,CardanoMarkets,"Latest price analysis AND NEWS : CARDANO , EOS, Bitcoin and Tron",0.0,1.0,0.0
2019-09-16 11:34:26,3,3,cardano,A guide into cardano world for beginners,0.0,1.0,0.0
2019-09-21 16:54:55,0,7,thecardanoeffect,"Cardano Community Weekly Recap September 21, 2019 | TCE 48",0.0,1.0,0.0
2019-09-18 22:33:03,1,8,thecardanoeffect,The Cardano Effect Ep. 47 audio is now available!,0.0,1.0,0.0
2019-09-20 16:54:06,3,10,cardano,Are there plans for a cardano blockchain dataset to be available on kaggle?,0.0,1.0,0.0
2019-09-16 16:31:00,8,11,cardano,SSI and Decentralized ID's on Cardano - Who is working on this?,0.0,1.0,0.0
2019-09-16 06:33:24,12,13,cardano,"Cardano Weekly Discussion and Question Thread - September 16, 2019",0.0,1.0,0.0
2019-09-20 14:44:09,0,19,cardano,20 / Sep 2019 - IOHK Cardano Weekly technical report,0.0,1.0,0.0
2019-09-16 12:19:35,18,20,cardano,State of Cardano Foundation,0.0,1.0,0.0
2019-09-17 14:56:12,0,23,dashpay,Cardano or Bitcoin; DASH 12X Faster Than Bitcoin; EOS 2nd Layer Funding Short,0.0,1.0,0.0
2019-09-20 22:14:51,45,25,cardano,"Sorry if this has been asked already, but is Cardano quantum-resistant?",0.0,0.897,-0.0387
2019-09-16 22:02:36,30,27,cardano,Cardano+POS proven less secure than proof-of-work?,0.296,0.704,0.2748
2019-09-16 02:40:31,22,47,cardano,EOS smart contract exploit allow hacker to to cash in - How Do Cardano Smart contacts avoid the same fate?,0.293,0.562,0.5719
2019-09-16 19:09:53,1,52,cardano,Nightly Jormungandr packages for Cardano Shelley testnet,0.0,1.0,0.0
2019-09-19 20:40:40,35,74,cardano,Could Cardano Become The ‘King Of DApps’ In The Near Future?,0.0,1.0,0.0
2019-09-17 15:23:34,12,75,cardano,Tremendous News for Cardano: Former CFTC Chair Joins Organization where Cardano is an Executive Member.,0.0,1.0,0.0
2019-09-22 15:51:18,0,1,TalkativePeople,/u/ThePsychoCrypto on 🛑 CARDANO Use Cases - Crypto Mass Adoption,0.0,1.0,0.0
2019-09-22 15:53:30,0,1,removalbot,09-22 15:53 - '🛑 CARDANO Use Cases - Crypto Mass Adoption' (youtube.com) by /u/ThePsychoCrypto removed from /r/Bitcoin within 4-14min,0.0,1.0,0.0
2019-09-27 22:50:59,0,1,CoinPath,"Trading indicators show EOS, Cardano, and TRON dropping further",0.0,1.0,0.0
2019-09-27 10:48:49,0,1,u_moneyshouters,Cardano launches the Shelley testnet website,0.0,1.0,0.0
2019-09-28 15:21:29,0,1,CryptoCurrency,"#ADA After the launch of the Shelley testnet successfully, it is reported that users holding Cardano will be able to earn ADA tokens from November onwards. It i...Read more: https://t.co/F1rYq1E4rt",0.099,0.901,0.4939
2019-09-28 21:41:08,0,1,CryptoCurrency,"#ADA Cardano [ADA] was trading at $0.0394, at press time, with a 3.91% gain over the 24-hour period. The 12th ranked altcoin by market cap needs to break throug...Read more: https://t.co/HpIMfWz3cV",0.105,0.895,0.5267
2019-09-23 18:32:23,0,1,cryptoall,Cardano ADA on Binance.US; Bakkt Launches; VeChain on Blockchain; Digibyte Follow up,0.0,1.0,0.0
2019-09-25 05:54:16,0,1,CryptoCurrencies,A Beginner's Guide to Cardano (ADA),0.0,1.0,0.0
2019-09-23 13:40:08,0,1,BATProject,"Binance usvwill start accepting deposits of five additional cryptocurrencies - Stellar, Cardano, Ethereum Classic, BAT and 0x.",0.148,0.852,0.3818
2019-09-23 13:51:38,0,1,CoinPath,"Binance.US officially launches, introduces fiat on-ramp and opens deposits for Cardano, Basic Attention Token, Ethereum Classic, Stellar and 0x",0.0,1.0,0.0
2019-09-24 12:58:39,0,1,cardano,Cardano Founder Charles Hoskinson: My Proudest work is with Cardano,0.286,0.714,0.5574
2019-09-24 18:18:29,0,1,AllThingsCrypto,"Cardano, Ethereum Classic and Tezos Price Analysis and Prediction: Bears Continue to Dominate the Crypto Market",0.0,0.909,-0.128
2019-09-26 14:52:43,0,1,cryptoall,Cardano Shelley Testnet Launching; DASH InstantSend 2 seconds; Litecoin's Founder on Proof of Stake,0.0,1.0,0.0
2019-09-29 17:56:08,0,1,BitcoinExchangeGuide,New Balance to Use Cardano Blockchain to Verify the Origins of a Range of Its Products,0.0,1.0,0.0
2019-09-29 01:56:33,0,1,bitcoin_is_dead,New Balance to Use Cardano Blockchain to Confirm Product Authenticity,0.0,1.0,0.0
2019-09-30 00:46:17,0,1,CryptoCurrency,#ADA Popular American footwear brand New Balance will join an increasing number of fashion brands and corporate giants looking to leverage the power of Cardano’...Read more: https://t.co/fXO37MK5s1,0.208,0.792,0.6486
2019-09-29 11:07:08,0,1,bitnewsbot,Cardano celebrates testnet launch with New Balance partnership,0.346,0.654,0.5719
2019-09-30 12:56:57,0,1,TheCoinRepublic,Cardano (ADA) Price Analysis: Bullish or Bearish Territory?,0.0,1.0,0.0
2019-09-30 15:17:57,0,1,crypto_currency,Cardano &amp; New Balance; Crypto Security Ratings; SEC Grilled By 'Crypto Congress',0.179,0.821,0.34
2019-09-30 14:56:46,0,1,ethereum,Why did New Balance pick Cardano and not Ethereum for authenticity verification? So upsetting! ETH has the alliance but it didn't include New Balance? WHY???!!,0.0,0.856,-0.6165
2019-09-30 17:16:46,0,1,CoinPath,Cardano and New Balance Will Team up to Stop Counterfeit Kicks,0.0,0.82,-0.296
2019-09-30 21:32:30,0,1,CardanoCoin,"ADA cryptocurrency advantages, disadvantages in USA &amp; Who Founded Cardano ADA?",0.176,0.634,-0.0516
2019-09-30 21:22:12,0,1,CryptoCurrency,"#ADA Charles Hoskinson, CEO of IOHK, the company behind Cardano, recently announced that its users will receive staking rewards. Cardano has just celebrated its...Read more: https://t.co/3mEok1df1Q",0.221,0.779,0.7783
2019-09-30 10:18:20,0,1,CoinPath,Charles Hoskinson Says Cardano Will Be the Most Useful Cryptocurrency As Shelley Testnet Launches,0.197,0.803,0.4927
2019-09-23 11:20:56,0,1,CoinPath,Cardano releases two versions and fixes a bug as it preps to launch testnet this week,0.0,1.0,0.0
2019-09-23 13:03:22,0,1,AllThingsCrypto,"Binance.US to start accepting deposits for Stellar, Cardano, Ethereum Classic, BAT and 0x",0.178,0.822,0.3818
2019-09-25 04:17:37,0,1,altcoin,A Beginner's Introduction/Overview of Cardano ADA,0.0,1.0,0.0
2019-09-26 22:18:15,0,1,HoverTechnology,Cardano (ADA) Reverses Tuesday's Dramatic Fall; Hovers Around $0.039,0.0,1.0,0.0
2019-09-27 07:06:08,0,1,CryptoCurrency,"&amp;#8220;Boom. Welcome to the Networked Testnet,&amp;#8221; tweeted Charles Hoskinson, CEO of IOHK on 27 September as Cardano announced the launch of the much-aw...Read more: https://t.co/tXZPP6QS3G",0.111,0.889,0.4588
2019-09-27 07:21:37,0,1,CoinPath,Cardano takes the next step towards a decentralized future as Shelley testnet makes its network debut,0.0,1.0,0.0
2019-09-27 08:51:39,0,1,Bitcoin_2019,"Cardano SHELLEY Update, Binance Futures ATTACK, REAL ESTATE on blockchain, TEZOS XTZ – bitcoin information",0.0,0.772,-0.5904
2019-09-28 06:56:14,0,1,CryptoCurrency,"#ADA #DTA #BTC Cardano (ADA), the 12th largest distributed ledger technology (DLT) project in the world, has achieved another significant milestone in its journey towards...Read more: https://t.co/wuRgXHffvR",0.065,0.935,0.2023
2019-09-28 15:21:30,0,1,CryptoCurrency,"#ADA #BTC IOHK has announced a strategic partnership with the leading sneaker brand, New Balance to use the Cardano (ADA) blockchain to authenticate its range of pre...Read more: https://t.co/DEBU783pi8",0.0,1.0,0.0
2019-09-28 09:16:07,0,1,CryptoCurrency,"The blockchain by far can be divided into three generations: Bitcoin &amp;#38; money transfer, Ethereum &amp;#38; smart contracts, and then the third one: “Cardano...Read more: https://t.co/khitcPf6qI",0.097,0.903,0.4019
2019-09-28 21:44:01,0,1,noncensored_bitcoin,[uncensored-r/CryptoCurrency] Cardano celebrates testnet launch with New Balance partnership,0.316,0.684,0.5719
2019-09-29 13:56:15,0,1,CryptoCurrency,"Cardano has lost over 23% over a period of seven days and at the time of writing, the altcoin was priced at $0.037 after a decline of 4.10% in the last hou...Read more: https://t.co/c6Uyuycsmp",0.0,0.931,-0.3182
2019-09-29 08:34:12,0,1,TrendsProject,New Balance To Implement Cardano Blockchain And Confirm Authenticity Of Its Products,0.0,1.0,0.0
2019-09-29 09:08:41,0,1,BitNewsLive,Report: Athletics Giant to Pilot Use of Cardano Blockchain,0.0,1.0,0.0
2019-09-29 06:55:21,0,1,CryptoStock,"New Malicious Malware Stealing Crypto Funds – Bitcoin, Ethereum, XRP, Litecoin, Cardano and Monero Users Targeted",0.0,0.791,-0.5719
2019-09-29 09:31:17,0,1,CryptoCurrency,"#DTA #ADA Cardano Sees Massive Adoption Event While Cardano (ADA) has been slipping over recent months, losing its spot as a top ten crypto asset, the blockchain und...Read more: https://t.co/9LtYy5aNu3",0.131,0.79,0.1779
2019-09-29 11:20:36,0,1,CryptoCrunchApp,New Balance To Use Cardano In Global Supply Chain,0.0,1.0,0.0
2019-09-29 02:22:14,0,1,CryptoCurrency,Charles Hoskinson announces that New Balance will be using the Cardano blockchain to help authenticate its products...Read more: https://t.co/oEcyPcaKPY,0.13,0.87,0.4019
2019-09-30 18:18:14,0,1,CoinPath,Cardano Partnering With Billion-Dollar Footwear Company to Battle Counterfeit Goods: Report,0.0,0.794,-0.3818
2019-09-30 07:50:40,2,1,cardano,New Balance and the Cardano blockchain questions,0.0,1.0,0.0
2019-09-30 12:42:06,0,1,CryptoCurrency,"#ADA The global footwear brand New Balance will use the Cardano blockchain to authenticate a premium line of sport shoes for the company, according to Charles H...Read more: https://t.co/kpIAS73jKG",0.0,1.0,0.0
2019-09-29 15:46:33,0,1,CryptoCurrency,"Cardano, the &amp;#8220;third-generation&amp;#8221; blockchain platform, is all set to make a shift toward a more decentralized community-run network. And as Carda...Read more: https://t.co/vfH0d4IPlJ",0.0,1.0,0.0
2019-09-30 17:52:22,0,1,CryptoCurrency,"Cardano rolled out the much anticipated Shelly testnet and in a recent event, Charles Hoskinson IOHK CEO revealed that an incentivized testnet would be lau...Read more: https://t.co/0nAVde8yE6",0.0,1.0,0.0
2019-09-30 19:16:41,0,1,u_viiyiiv,"[Cardano Users Able To Earn ADA From November, Says Hoskinson] (via Quarry app)",0.0,1.0,0.0
2019-09-25 14:12:28,0,1,cryptoall,Cardano Prep Testnet Launch; 50% World To Use Bitcoin; OkEx CEO Bets 100 BTC; Uber $5 Billion+ Loss,0.0,0.869,-0.3744
2019-09-24 11:40:23,0,1,TheCoinRepublic,Binance.US Going Live today with 7 New Cryptocurrencies including Cardano &amp; Stellar,0.0,1.0,0.0
2019-09-26 12:27:10,0,1,cvsreceipts,"Cardano (ADA) Price Analysis: Past, Present and the Future",0.0,1.0,0.0
2019-10-06 05:26:32,0,1,u_moneyshouters,Cardano launches the Shelley testnet website,0.0,1.0,0.0
2019-10-03 15:20:41,1,1,Bitcoin,New Balance to Use Cardano Blockchain to Confirm Product Authenticity,0.0,1.0,0.0
2019-10-03 18:08:17,0,1,cryptoall,Cardano Testnet Updates; XRP Backed Stablecoin &amp; REBRANDING; Fed 'Digital Currency'; Funfair Wallet,0.084,0.916,0.0258
2019-10-05 10:08:16,0,1,CryptoCurrency,"#ADA As the Cryptoverse is trying to guess BTC’s next move, we found out whom to blame for the crash. Meanwhile, ETH went below USD 180 again, Cardano dropped 2...Read more: https://t.co/SJPLvx8NyT",0.0,0.855,-0.6249
2019-10-05 17:24:10,0,1,AltcoinTrader,Cardano Analysis: Intraday Timeframe Chart Patterns and Bullish Bias,0.0,0.851,-0.1027
2019-10-06 10:03:13,0,1,CryptoCurrency,"#ETH #ETC #BTC #ADA #DTA This article provides a quick overview of how the crypto markets have been doing—with the focus on Bitcoin (BTC), Ether (ETH), Cardano (ADA), Unus Sed Leo ...Read more: https://t.co/F5rUSZhaJr",0.0,1.0,0.0
2019-10-06 22:41:42,0,1,cryptolobe,ADA Could Be Set For An Impressive Surge As Cardano Sees Positive Bounce,0.385,0.615,0.7845
2019-10-07 09:21:16,0,1,CryptocurrencyToday,"From Cardano to Ethereum, 2020 Could Be Deciding Year for Proof-of-Stake",0.0,1.0,0.0
2019-10-07 18:41:31,0,1,CryptoCrunchApp,Charles Hoskinson: Cardano (ADA) Is In Good Shape And Moving Fast,0.225,0.775,0.4404
2019-10-02 15:28:26,0,1,TCCP,New The Cardano Community Podcast video: Ep. 15 | Evgeny | Cardano Russia | Shelley | Atala | Cardano Foundation,0.0,1.0,0.0
2019-10-01 15:47:01,0,1,crypto_currency,"Cardano To Be 'Most Useful Crypto'; Bakkt Driving Bitcoin Adoption; EOS, SEC $24 Million Settlement",0.186,0.814,0.4927
2019-10-01 15:29:08,0,1,Changelly,How to exchange Bitcoin (BTC) to Cardano (ADA) Instantly?,0.0,1.0,0.0
2019-10-05 16:26:51,0,1,noncensored_bitcoin,[uncensored-r/CryptoCurrency] Cardano hit an 8-month low last month after Bitcoin’s sudden fall in value on the 24th. As its va...,0.107,0.8,0.0772
2019-10-05 21:43:12,0,1,CryptoCurrency,"#ADA #SNT #SYNC Developers have been working on the Cardano (ADA) project in many different areas. There were many different updates on the Cardano Wallet, on decentraliza...Read more: https://t.co/xNF2zrYc1e",0.0,1.0,0.0
2019-10-04 14:58:27,0,1,CryptoCurrency,Cardano&amp;#8217;s founder Charles Hoskinson has stated he will eat a show made of cake because that&amp;#8217;s what he said he will do if the Proof of Stake (Po...Read more: https://t.co/pkGiR54zUB,0.0,1.0,0.0
2019-10-02 11:47:31,0,1,CryptoCurrency,IOHK founder Charles Hoskinson discussed recent developments around Cardano during an event held in celebration of the project&amp;#8217;s secondary anniversar...Read more: https://t.co/WgmUoe2vzE,0.0,1.0,0.0
2019-10-06 08:49:27,0,1,cardano,Cardano Cryptocurrency Trading Profit Calculator using FIFO or LIFO methods,0.244,0.756,0.4404
2019-10-03 15:51:12,0,1,noncensored_bitcoin,[uncensored-r/Bitcoin] New Balance to Use Cardano Blockchain to Confirm Product Authenticity,0.0,1.0,0.0
2019-10-05 00:21:04,0,1,CoinPath,Cardano bearish in the long term as selling pressure continues to build,0.0,0.833,-0.296
2019-10-07 09:49:36,0,1,CryptoCurrencies,Map of Cardano Shelley Testnet Live Stream,0.0,1.0,0.0
2019-10-07 23:13:19,0,1,CryptoCurrency,Recent news reveals comments by Charles Hoskinson on Cardano and the future of the company along with the cryptocurrency. The chief executive officer of In...Read more: https://t.co/KgVUDBY33W,0.0,1.0,0.0
2019-10-06 18:58:29,0,1,CryptoCurrency,"#ADA In a recent surprise AMA, Charles Hoskinson, the co-founder of Cardano and CEO of IOHK, said that Cardano (ADA) is in good shape and moving fast. He has […...Read more: https://t.co/AnZKtAHzHS",0.147,0.853,0.6124
2019-10-07 15:53:17,0,1,CryptoCurrency,Coinspeaker Cardano and Ethereum Might Finally Switch to PoS in 2020It is expected that 2020 will finally be the year when Ethereum and Cardano might switc...Read more: https://t.co/RIB5aumNRq,0.0,1.0,0.0
2019-10-07 17:18:59,0,1,Crypto_Currency_News,Cardano &amp; Ethereum - 2020 Year of Proof of Stake; Hyundai Blockchain; Dethroning Bitcoin,0.0,1.0,0.0
2019-10-04 16:01:28,0,1,cryptolobe,Cardano Founder to Eat Shoe For Missing Staking Deadline,0.0,0.784,-0.296
2019-10-04 18:08:25,0,1,CryptoCurrency,"Cryptocurrencies are seeing some green today, though Bitcoin continues trading around $8,200. Some altcoins are seeing a stronger recovery, as BAT, Cardano...Read more: https://t.co/oFAc8xw9qc",0.106,0.894,0.3818
2019-10-04 06:18:14,0,1,CryptoCurrency,"ADA coin has spent the entire week fluctuating in the market. The period was power-packed, but the volatility has invited the drop in the Cardano price. Th...Read more: https://t.co/xw43GftP8C",0.0,0.914,-0.3919
2019-10-05 15:48:11,0,1,CryptoCurrency,Cardano price analysis reveals that a bullish breakout may occur soon. Cardano price analysis: Overview Cardano&amp;#8217;s (ADA&amp;#8217;s) price fell severely l...Read more: https://t.co/W6zcYcg8ez,0.0,0.875,-0.4588
2019-10-05 16:18:34,0,1,CryptoCurrency,Cardano seems to be loosing it,0.0,1.0,0.0
